DROP TABLE IF EXISTS t1, t2;
CREATE TABLE t1 (a TINYINT UNSIGNED NOT NULL, b INT UNSIGNED NOT NULL);
CREATE TABLE t2 (a TINYINT UNSIGNED NOT NULL, b INT UNSIGNED NOT NULL);
INSERT INTO t1 (a,b) VALUES (1,36),(8,11),(3,5),(6,9),(4,10),(9,1),(2,12),(7,18),(5,2),(10,0);
INSERT INTO t2 (a,b) VALUES (102,6),(99,5),(87,22),(79,9),(85,7),(101,5),(80,14),(100,1),(97,29),(98,19);
INSERT INTO t1 ( a, b ) SELECT MAX(a), MAX(b) FROM t2;
INSERT INTO t2 ( a, b ) SELECT MIN(a), MIN(b) FROM t1;
INSERT INTO t1 SELECT t2.a,t2.b FROM t2;
INSERT INTO t2 SELECT t1.a,t1.b FROM t1;
SELECT * FROM t1;
a	b
1	0
1	36
10	0
100	1
101	5
102	29
102	6
2	12
3	5
4	10
5	2
6	9
7	18
79	9
8	11
80	14
85	7
87	22
9	1
97	29
98	19
99	5
SELECT * FROM t2;
a	b
1	0
1	0
1	36
10	0
100	1
100	1
101	5
101	5
102	29
102	6
102	6
2	12
3	5
4	10
5	2
6	9
7	18
79	9
79	9
8	11
80	14
80	14
85	7
85	7
87	22
87	22
9	1
97	29
97	29
98	19
98	19
99	5
99	5
UPDATE t1 SET b = 3 WHERE b>5;
UPDATE t2 SET b = 2 WHERE b>=0;
SELECT * FROM t1;
a	b
1	0
1	3
10	0
100	1
101	5
102	3
102	3
2	3
3	5
4	3
5	2
6	3
7	3
79	3
8	3
80	3
85	3
87	3
9	1
97	3
98	3
99	5
SELECT * FROM t2;
a	b
1	2
1	2
1	2
10	2
100	2
100	2
101	2
101	2
102	2
102	2
102	2
2	2
3	2
4	2
5	2
6	2
7	2
79	2
79	2
8	2
80	2
80	2
85	2
85	2
87	2
87	2
9	2
97	2
97	2
98	2
98	2
99	2
99	2
DELETE FROM t1 WHERE a > 3;
DELETE FROM t2 WHERE a >= 0;
SELECT * FROM t1;
a	b
1	0
1	3
2	3
3	5
SELECT * FROM t2;
a	b
CREATE INDEX a ON t1(a);
CREATE INDEX b ON t1(b);
CREATE INDEX a ON t2(a);
CREATE INDEX b ON t2(b);
INSERT INTO t1 (a,b) VALUES (1,36),(8,11),(3,5),(6,9),(4,10),(9,1),(2,12),(7,18),(5,2),(10,0);
INSERT INTO t2 (a,b) VALUES (102,6),(99,5),(87,22),(79,9),(85,7),(101,5),(80,14),(100,1),(97,29),(98,19);
INSERT INTO t1 ( a, b ) SELECT MAX(a), MAX(b) FROM t2;
INSERT INTO t2 ( a, b ) SELECT MIN(a), MIN(b) FROM t1;
INSERT INTO t1 SELECT t2.a,t2.b FROM t2;
INSERT INTO t2 SELECT t1.a,t1.b FROM t1;
SELECT * FROM t1;
a	b
1	0
1	0
1	3
1	36
10	0
100	1
101	5
102	29
102	6
2	12
2	3
3	5
3	5
4	10
5	2
6	9
7	18
79	9
8	11
80	14
85	7
87	22
9	1
97	29
98	19
99	5
SELECT * FROM t2;
a	b
1	0
1	0
1	0
1	3
1	36
10	0
100	1
100	1
101	5
101	5
102	29
102	6
102	6
2	12
2	3
3	5
3	5
4	10
5	2
6	9
7	18
79	9
79	9
8	11
80	14
80	14
85	7
85	7
87	22
87	22
9	1
97	29
97	29
98	19
98	19
99	5
99	5
UPDATE t1 SET b = 3 WHERE b>5;
UPDATE t2 SET b = 2 WHERE b>=0;
SELECT * FROM t1;
a	b
1	0
1	0
1	3
1	3
10	0
100	1
101	5
102	3
102	3
2	3
2	3
3	5
3	5
4	3
5	2
6	3
7	3
79	3
8	3
80	3
85	3
87	3
9	1
97	3
98	3
99	5
SELECT * FROM t2;
a	b
1	2
1	2
1	2
1	2
1	2
10	2
100	2
100	2
101	2
101	2
102	2
102	2
102	2
2	2
2	2
3	2
3	2
4	2
5	2
6	2
7	2
79	2
79	2
8	2
80	2
80	2
85	2
85	2
87	2
87	2
9	2
97	2
97	2
98	2
98	2
99	2
99	2
DELETE FROM t1 WHERE a > 3;
DELETE FROM t2 WHERE a >= 0;
SELECT * FROM t1;
a	b
1	0
1	0
1	3
1	3
2	3
2	3
3	5
3	5
SELECT * FROM t2;
a	b
DROP TABLE t1,t2;
CREATE TABLE t1 (a INT, b VARCHAR(10));
INSERT INTO t1 VALUES (2,'abcd1e'),(5,'abcd2e'),(11,'helloworld'),(3,'1234567'),(10,'ccccc'),(12,'string'),(9,'word'),(8,'xxyyzz'),(1,'ABCD'),(6,'abcd'),(15,'ABCD1e'),(4,'ABCD2e');
UPDATE t1 SET b = "updateb1" WHERE b = "abcd1e";
SELECT * FROM t1;
a	b
1	ABCD
10	ccccc
11	helloworld
12	string
15	ABCD1e
2	updateb1
3	1234567
4	ABCD2e
5	abcd2e
6	abcd
8	xxyyzz
9	word
UPDATE t1 SET b = "updateb2" WHERE b <=> "abcd2e";
SELECT * FROM t1;
a	b
1	ABCD
10	ccccc
11	helloworld
12	string
15	ABCD1e
2	updateb1
3	1234567
4	ABCD2e
5	updateb2
6	abcd
8	xxyyzz
9	word
UPDATE t1 SET b = "updateb3" WHERE b < "abcd" ORDER BY b DESC;
SELECT * FROM t1;
a	b
1	ABCD
10	ccccc
11	helloworld
12	string
15	ABCD1e
2	updateb1
3	updateb3
4	ABCD2e
5	updateb2
6	abcd
8	xxyyzz
9	word
UPDATE t1 SET b = "updateb4" WHERE b <= "ccccc";
SELECT * FROM t1;
a	b
1	updateb4
10	updateb4
11	helloworld
12	string
15	updateb4
2	updateb1
3	updateb3
4	updateb4
5	updateb2
6	updateb4
8	xxyyzz
9	word
UPDATE t1 SET b = "updateb5" WHERE b > "word";
SELECT * FROM t1;
a	b
1	updateb4
10	updateb4
11	helloworld
12	string
15	updateb4
2	updateb1
3	updateb3
4	updateb4
5	updateb2
6	updateb4
8	updateb5
9	word
UPDATE t1 SET b = "updateb6" WHERE b >= "updateb4" ORDER BY b LIMIT 2;
SELECT * FROM t1;
a	b
1	updateb6
10	updateb6
11	helloworld
12	string
15	updateb4
2	updateb1
3	updateb3
4	updateb4
5	updateb2
6	updateb4
8	updateb5
9	word
UPDATE t1 SET b = "updateb7" WHERE b BETWEEN "updateb1" AND "updateb4" ORDER BY a DESC LIMIT 4;
SELECT * FROM t1;
a	b
1	updateb6
10	updateb6
11	helloworld
12	string
15	updateb7
2	updateb1
3	updateb3
4	updateb7
5	updateb7
6	updateb7
8	updateb5
9	word
UPDATE t1 SET b = "updateb8" WHERE b IN ("word", "updateb5", "updateb6", "string");
SELECT * FROM t1;
a	b
1	updateb8
10	updateb8
11	helloworld
12	updateb8
15	updateb7
2	updateb1
3	updateb3
4	updateb7
5	updateb7
6	updateb7
8	updateb8
9	updateb8
UPDATE t1 SET b = "updateb9" WHERE b NOT IN ("updateb7", "helloworld");
SELECT * FROM t1;
a	b
1	updateb9
10	updateb9
11	helloworld
12	updateb9
15	updateb7
2	updateb9
3	updateb9
4	updateb7
5	updateb7
6	updateb7
8	updateb9
9	updateb9
UPDATE t1 SET b = "updateb10" WHERE b LIKE "updateb7%";
SELECT * FROM t1;
a	b
1	updateb9
10	updateb9
11	helloworld
12	updateb9
15	updateb10
2	updateb9
3	updateb9
4	updateb10
5	updateb10
6	updateb10
8	updateb9
9	updateb9
UPDATE t1 SET b = "updateb11" WHERE b REGEXP "updateb1";
SELECT * FROM t1;
a	b
1	updateb9
10	updateb9
11	helloworld
12	updateb9
15	updateb11
2	updateb9
3	updateb9
4	updateb11
5	updateb11
6	updateb11
8	updateb9
9	updateb9
UPDATE t1 SET b = "updateb12" WHERE b != "updateb11";
SELECT * FROM t1;
a	b
1	updateb12
10	updateb12
11	updateb12
12	updateb12
15	updateb11
2	updateb12
3	updateb12
4	updateb11
5	updateb11
6	updateb11
8	updateb12
9	updateb12
UPDATE t1 SET b = "updateb13" WHERE b IS NULL;
SELECT * FROM t1;
a	b
1	updateb12
10	updateb12
11	updateb12
12	updateb12
15	updateb11
2	updateb12
3	updateb12
4	updateb11
5	updateb11
6	updateb11
8	updateb12
9	updateb12
UPDATE t1 SET b = "updateb14" WHERE b IS NOT NULL;
SELECT * FROM t1;
a	b
1	updateb14
10	updateb14
11	updateb14
12	updateb14
15	updateb14
2	updateb14
3	updateb14
4	updateb14
5	updateb14
6	updateb14
8	updateb14
9	updateb14
DELETE FROM t1;
INSERT INTO t1 VALUES (2,'abcd1e'),(5,'abcd2e'),(11,'helloworld'),(3,'1234567'),(10,'ccccc'),(12,'string'),(9,'word'),(8,'xxyyzz'),(1,'ABCD'),(6,'abcd'),(15,'ABCD1e'),(4,'ABCD2e'),(14,"test1"),(18,"abcde"),(15,"abcdef"),(13,"bcd"),(21,"bcde"),(17,"acdef");
DELETE FROM t1 WHERE b = "abcd1e";
SELECT * FROM t1;
a	b
1	ABCD
10	ccccc
11	helloworld
12	string
13	bcd
14	test1
15	ABCD1e
15	abcdef
17	acdef
18	abcde
21	bcde
3	1234567
4	ABCD2e
5	abcd2e
6	abcd
8	xxyyzz
9	word
DELETE FROM t1 WHERE b <=> "abcd2e";
SELECT * FROM t1;
a	b
1	ABCD
10	ccccc
11	helloworld
12	string
13	bcd
14	test1
15	ABCD1e
15	abcdef
17	acdef
18	abcde
21	bcde
3	1234567
4	ABCD2e
6	abcd
8	xxyyzz
9	word
DELETE FROM t1 WHERE b < "ABCD1e";
SELECT * FROM t1;
a	b
10	ccccc
11	helloworld
12	string
13	bcd
14	test1
15	ABCD1e
15	abcdef
17	acdef
18	abcde
21	bcde
4	ABCD2e
6	abcd
8	xxyyzz
9	word
DELETE FROM t1 WHERE b <= "abcd" ORDER BY b DESC LIMIT 2;
SELECT * FROM t1;
a	b
10	ccccc
11	helloworld
12	string
13	bcd
14	test1
15	ABCD1e
15	abcdef
17	acdef
18	abcde
21	bcde
4	ABCD2e
8	xxyyzz
9	word
DELETE FROM t1 WHERE b > "word";
SELECT * FROM t1;
a	b
10	ccccc
11	helloworld
12	string
13	bcd
14	test1
15	ABCD1e
15	abcdef
17	acdef
18	abcde
21	bcde
4	ABCD2e
9	word
DELETE FROM t1 WHERE b >= "word";
SELECT * FROM t1;
a	b
10	ccccc
11	helloworld
12	string
13	bcd
14	test1
15	ABCD1e
15	abcdef
17	acdef
18	abcde
21	bcde
4	ABCD2e
DELETE FROM t1 WHERE b BETWEEN "ccccc" AND "helloworld" ORDER BY b LIMIT 2;
SELECT * FROM t1;
a	b
12	string
13	bcd
14	test1
15	ABCD1e
15	abcdef
17	acdef
18	abcde
21	bcde
4	ABCD2e
DELETE FROM t1 WHERE b LIKE "abcde%" ORDER BY a DESC LIMIT 1;
SELECT * FROM t1;
a	b
12	string
13	bcd
14	test1
15	ABCD1e
15	abcdef
17	acdef
21	bcde
4	ABCD2e
DELETE FROM t1 WHERE b REGEXP "str";
SELECT * FROM t1;
a	b
13	bcd
14	test1
15	ABCD1e
15	abcdef
17	acdef
21	bcde
4	ABCD2e
DELETE FROM t1 WHERE b IN ("bcd", "acdef");
SELECT * FROM t1;
a	b
14	test1
15	ABCD1e
15	abcdef
21	bcde
4	ABCD2e
DELETE FROM t1  WHERE b != "test1";
SELECT * FROM t1;
a	b
14	test1
DELETE FROM t1 WHERE b IS NOT NULL;
SELECT * FROM t1;
a	b
CREATE INDEX a ON t1(a);
CREATE INDEX b ON t1(b(5));
INSERT INTO t1 VALUES (2,'abcd1e'),(5,'abcd2e'),(11,'helloworld'),(3,'1234567'),(10,'ccccc'),(12,'string'),(9,'word'),(8,'xxyyzz'),(1,'ABCD'),(6,'abcd'),(15,'ABCD1e'),(4,'ABCD2e');
UPDATE t1 SET b = "updateb1" WHERE b = "abcd1e";
SELECT * FROM t1;
a	b
1	ABCD
10	ccccc
11	helloworld
12	string
15	ABCD1e
2	updateb1
3	1234567
4	ABCD2e
5	abcd2e
6	abcd
8	xxyyzz
9	word
UPDATE t1 SET b = "updateb2" WHERE b <=> "abcd2e";
SELECT * FROM t1;
a	b
1	ABCD
10	ccccc
11	helloworld
12	string
15	ABCD1e
2	updateb1
3	1234567
4	ABCD2e
5	updateb2
6	abcd
8	xxyyzz
9	word
UPDATE t1 SET b = "updateb3" WHERE b < "abcd" ORDER BY b DESC;
SELECT * FROM t1;
a	b
1	ABCD
10	ccccc
11	helloworld
12	string
15	ABCD1e
2	updateb1
3	updateb3
4	ABCD2e
5	updateb2
6	abcd
8	xxyyzz
9	word
UPDATE t1 SET b = "updateb4" WHERE b <= "ccccc";
SELECT * FROM t1;
a	b
1	updateb4
10	updateb4
11	helloworld
12	string
15	updateb4
2	updateb1
3	updateb3
4	updateb4
5	updateb2
6	updateb4
8	xxyyzz
9	word
UPDATE t1 SET b = "updateb5" WHERE b > "word";
SELECT * FROM t1;
a	b
1	updateb4
10	updateb4
11	helloworld
12	string
15	updateb4
2	updateb1
3	updateb3
4	updateb4
5	updateb2
6	updateb4
8	updateb5
9	word
UPDATE t1 SET b = "updateb6" WHERE b >= "UPDATEb4" ORDER BY b LIMIT 2;
SELECT * FROM t1;
a	b
1	updateb6
10	updateb6
11	helloworld
12	string
15	updateb4
2	updateb1
3	updateb3
4	updateb4
5	updateb2
6	updateb4
8	updateb5
9	word
UPDATE t1 SET b = "updateb7" WHERE b BETWEEN "updateb1" AND "updateb4" ORDER BY a DESC LIMIT 4;
SELECT * FROM t1;
a	b
1	updateb6
10	updateb6
11	helloworld
12	string
15	updateb7
2	updateb1
3	updateb3
4	updateb7
5	updateb7
6	updateb7
8	updateb5
9	word
UPDATE t1 SET b = "updateb8" WHERE b IN ("word", "updateb5", "updateb6", "string");
SELECT * FROM t1;
a	b
1	updateb8
10	updateb8
11	helloworld
12	updateb8
15	updateb7
2	updateb1
3	updateb3
4	updateb7
5	updateb7
6	updateb7
8	updateb8
9	updateb8
UPDATE t1 SET b = "updateb9" WHERE b NOT IN ("updateb7", "helloworld");
SELECT * FROM t1;
a	b
1	updateb9
10	updateb9
11	helloworld
12	updateb9
15	updateb7
2	updateb9
3	updateb9
4	updateb7
5	updateb7
6	updateb7
8	updateb9
9	updateb9
UPDATE t1 SET b = "updateb10" WHERE b LIKE "updateb7%";
SELECT * FROM t1;
a	b
1	updateb9
10	updateb9
11	helloworld
12	updateb9
15	updateb10
2	updateb9
3	updateb9
4	updateb10
5	updateb10
6	updateb10
8	updateb9
9	updateb9
UPDATE t1 SET b = "updateb11" WHERE b REGEXP "updateb1";
SELECT * FROM t1;
a	b
1	updateb9
10	updateb9
11	helloworld
12	updateb9
15	updateb11
2	updateb9
3	updateb9
4	updateb11
5	updateb11
6	updateb11
8	updateb9
9	updateb9
UPDATE t1 SET b = "updateb12" WHERE b != "updateb11";
SELECT * FROM t1;
a	b
1	updateb12
10	updateb12
11	updateb12
12	updateb12
15	updateb11
2	updateb12
3	updateb12
4	updateb11
5	updateb11
6	updateb11
8	updateb12
9	updateb12
UPDATE t1 SET b = "updateb13" WHERE b IS NULL;
SELECT * FROM t1;
a	b
1	updateb12
10	updateb12
11	updateb12
12	updateb12
15	updateb11
2	updateb12
3	updateb12
4	updateb11
5	updateb11
6	updateb11
8	updateb12
9	updateb12
UPDATE t1 SET b = "updateb14" WHERE b IS NOT NULL;
SELECT * FROM t1;
a	b
1	updateb14
10	updateb14
11	updateb14
12	updateb14
15	updateb14
2	updateb14
3	updateb14
4	updateb14
5	updateb14
6	updateb14
8	updateb14
9	updateb14
DELETE FROM t1;
INSERT INTO t1 VALUES (2,'abcd1e'),(5,'abcd2e'),(11,'helloworld'),(3,'1234567'),(10,'ccccc'),(12,'string'),(9,'word'),(8,'xxyyzz'),(1,'ABCD'),(6,'abcd'),(15,'ABCD1e'),(4,'ABCD2e'),(14,"test1"),(18,"abcde"),(15,"abcdef"),(13,"bcd"),(21,"bcde"),(17,"acdef");
DELETE FROM t1 WHERE b = "abcd1e";
SELECT * FROM t1;
a	b
1	ABCD
10	ccccc
11	helloworld
12	string
13	bcd
14	test1
15	ABCD1e
15	abcdef
17	acdef
18	abcde
21	bcde
3	1234567
4	ABCD2e
5	abcd2e
6	abcd
8	xxyyzz
9	word
DELETE FROM t1 WHERE b <=> "abcd2e";
SELECT * FROM t1;
a	b
1	ABCD
10	ccccc
11	helloworld
12	string
13	bcd
14	test1
15	ABCD1e
15	abcdef
17	acdef
18	abcde
21	bcde
3	1234567
4	ABCD2e
6	abcd
8	xxyyzz
9	word
DELETE FROM t1 WHERE b < "ABCD1e";
SELECT * FROM t1;
a	b
10	ccccc
11	helloworld
12	string
13	bcd
14	test1
15	ABCD1e
15	abcdef
17	acdef
18	abcde
21	bcde
4	ABCD2e
6	abcd
8	xxyyzz
9	word
DELETE FROM t1 WHERE b <= "abcd" ORDER BY b DESC LIMIT 2;
SELECT * FROM t1;
a	b
10	ccccc
11	helloworld
12	string
13	bcd
14	test1
15	ABCD1e
15	abcdef
17	acdef
18	abcde
21	bcde
4	ABCD2e
6	abcd
8	xxyyzz
9	word
DELETE FROM t1 WHERE b > "word";
SELECT * FROM t1;
a	b
10	ccccc
11	helloworld
12	string
13	bcd
14	test1
15	ABCD1e
15	abcdef
17	acdef
18	abcde
21	bcde
4	ABCD2e
6	abcd
9	word
DELETE FROM t1 WHERE b >= "word";
SELECT * FROM t1;
a	b
10	ccccc
11	helloworld
12	string
13	bcd
14	test1
15	ABCD1e
15	abcdef
17	acdef
18	abcde
21	bcde
4	ABCD2e
6	abcd
DELETE FROM t1 WHERE b BETWEEN "ccccc" AND "helloworld" ORDER BY b LIMIT 2;
SELECT * FROM t1;
a	b
12	string
13	bcd
14	test1
15	ABCD1e
15	abcdef
17	acdef
18	abcde
21	bcde
4	ABCD2e
6	abcd
DELETE FROM t1 WHERE b LIKE "abcde%" ORDER BY a DESC LIMIT 1;
SELECT * FROM t1;
a	b
12	string
13	bcd
14	test1
15	ABCD1e
15	abcdef
17	acdef
21	bcde
4	ABCD2e
6	abcd
DELETE FROM t1 WHERE b REGEXP "str";
SELECT * FROM t1;
a	b
13	bcd
14	test1
15	ABCD1e
15	abcdef
17	acdef
21	bcde
4	ABCD2e
6	abcd
DELETE FROM t1 WHERE b IN ("bcd", "acdef");
SELECT * FROM t1;
a	b
14	test1
15	ABCD1e
15	abcdef
21	bcde
4	ABCD2e
6	abcd
DELETE FROM t1  WHERE b != "test1";
SELECT * FROM t1;
a	b
14	test1
DELETE FROM t1 WHERE b IS NOT NULL;
SELECT * FROM t1;
a	b
DROP TABLE t1;
CREATE TABLE t1(pk INT, a MEDIUMINT, b SMALLINT, PRIMARY KEY (pk));
CREATE TABLE t2(pk INT, a MEDIUMINT, b SMALLINT, PRIMARY KEY (pk));
INSERT INTO t1 VALUES (1,1,1),(13,14,2),(11,8,3),(7,21,14),(5,5,6),(9,13,5),(2,9,4),(16,7,9),(10,28,3),(21,21,21),(8,8,8),(19,8,3);
INSERT INTO t2 VALUES (1,1,1),(6,11,2),(8,13,3),(5,21,14),(7,5,6),(15,17,5),(14,8,4),(21,7,9),(17,21,3),(12,14,21),(10,8,8),(2,8,3);
UPDATE t1 AS A, t2 AS B SET A.a = -1, B.b = -1 WHERE A.a = 9 AND B.b = 3;
SELECT * FROM t1;
pk	a	b
1	1	1
10	28	3
11	8	3
13	14	2
16	7	9
19	8	3
2	-1	4
21	21	21
5	5	6
7	21	14
8	8	8
9	13	5
SELECT * FROM t2;
pk	a	b
1	1	1
10	8	8
12	14	21
14	8	4
15	17	5
17	21	-1
2	8	-1
21	7	9
5	21	14
6	11	2
7	5	6
8	13	-1
UPDATE t1 AS A, t2 AS B SET A.a = -2, B.b = -2 WHERE A.a > 13 AND B.b <= 5;
SELECT * FROM t1;
pk	a	b
1	1	1
10	-2	3
11	8	3
13	-2	2
16	7	9
19	8	3
2	-1	4
21	-2	21
5	5	6
7	-2	14
8	8	8
9	13	5
SELECT * FROM t2;
pk	a	b
1	1	-2
10	8	8
12	14	21
14	8	-2
15	17	-2
17	21	-2
2	8	-2
21	7	9
5	21	14
6	11	-2
7	5	6
8	13	-2
UPDATE t1 AS A, t2 AS B SET A.a = -3, B.b = -3 WHERE A.a < 6 AND B.b >= 11;
SELECT * FROM t1;
pk	a	b
1	-3	1
10	-3	3
11	8	3
13	-3	2
16	7	9
19	8	3
2	-3	4
21	-3	21
5	-3	6
7	-3	14
8	8	8
9	13	5
SELECT * FROM t2;
pk	a	b
1	1	-2
10	8	8
12	14	-3
14	8	-2
15	17	-2
17	21	-2
2	8	-2
21	7	9
5	21	-3
6	11	-2
7	5	6
8	13	-2
UPDATE t1 AS A, t2 AS B SET A.a = -4, B.b = -4 WHERE A.a BETWEEN 6 AND 12;
SELECT * FROM t1;
pk	a	b
1	-3	1
10	-3	3
11	-4	3
13	-3	2
16	-4	9
19	-4	3
2	-3	4
21	-3	21
5	-3	6
7	-3	14
8	-4	8
9	13	5
SELECT * FROM t2;
pk	a	b
1	1	-4
10	8	-4
12	14	-4
14	8	-4
15	17	-4
17	21	-4
2	8	-4
21	7	-4
5	21	-4
6	11	-4
7	5	-4
8	13	-4
DELETE FROM t1;
DELETE FROM t2;
INSERT INTO t1 VALUES (1,1,1),(13,14,2),(11,8,3),(7,21,14),(5,5,6),(9,13,5),(2,9,4),(16,7,9),(10,28,3),(21,21,21),(8,8,8),(19,8,3);
INSERT INTO t2 VALUES (1,1,1),(6,11,2),(8,13,3),(5,21,14),(7,5,6),(15,17,5),(14,8,4),(21,7,9),(17,21,3),(12,14,21),(10,8,8),(2,8,3);
DELETE t1.*, t2.* FROM t1,t2 WHERE t1.a = t2.b AND t1.b > 10;
SELECT * FROM t1;
pk	a	b
1	1	1
10	28	3
11	8	3
13	14	2
16	7	9
19	8	3
2	9	4
5	5	6
8	8	8
9	13	5
SELECT * FROM t2;
pk	a	b
1	1	1
10	8	8
14	8	4
15	17	5
17	21	3
2	8	3
21	7	9
5	21	14
6	11	2
7	5	6
8	13	3
DELETE t1.*, t2.* FROM t1,t2 WHERE t1.a < t2.b AND t1.a >= 11 AND t2.b <= 15;
SELECT * FROM t1;
pk	a	b
1	1	1
10	28	3
11	8	3
13	14	2
16	7	9
19	8	3
2	9	4
5	5	6
8	8	8
SELECT * FROM t2;
pk	a	b
1	1	1
10	8	8
14	8	4
15	17	5
17	21	3
2	8	3
21	7	9
6	11	2
7	5	6
8	13	3
CREATE INDEX a ON t1(a);
CREATE INDEX b ON t1(b);
CREATE INDEX a ON t2(a);
CREATE INDEX b ON t2(b);
DELETE FROM t1;
DELETE FROM t2;
INSERT INTO t1 VALUES (1,1,1),(13,14,2),(11,8,3),(7,21,14),(5,5,6),(9,13,5),(2,9,4),(16,7,9),(10,28,3),(21,21,21),(8,8,8),(19,8,3);
INSERT INTO t2 VALUES (1,1,1),(6,11,2),(8,13,3),(5,21,14),(7,5,6),(15,17,5),(14,8,4),(21,7,9),(17,21,3),(12,14,21),(10,8,8),(2,8,3);
UPDATE t1 AS A, t2 AS B SET A.a = -1, B.b = -1 WHERE A.a = 9 AND B.b = 3;
SELECT * FROM t1;
pk	a	b
1	1	1
10	28	3
11	8	3
13	14	2
16	7	9
19	8	3
2	-1	4
21	21	21
5	5	6
7	21	14
8	8	8
9	13	5
SELECT * FROM t2;
pk	a	b
1	1	1
10	8	8
12	14	21
14	8	4
15	17	5
17	21	-1
2	8	-1
21	7	9
5	21	14
6	11	2
7	5	6
8	13	-1
UPDATE t1 AS A, t2 AS B SET A.a = -2, B.b = -2 WHERE A.a > 13 AND B.b <= 5;
SELECT * FROM t1;
pk	a	b
1	1	1
10	-2	3
11	8	3
13	-2	2
16	7	9
19	8	3
2	-1	4
21	-2	21
5	5	6
7	-2	14
8	8	8
9	13	5
SELECT * FROM t2;
pk	a	b
1	1	-2
10	8	8
12	14	21
14	8	-2
15	17	-2
17	21	-2
2	8	-2
21	7	9
5	21	14
6	11	-2
7	5	6
8	13	-2
UPDATE t1 AS A, t2 AS B SET A.a = -3, B.b = -3 WHERE A.a < 6 AND B.b >= 11;
SELECT * FROM t1;
pk	a	b
1	-3	1
10	-3	3
11	8	3
13	-3	2
16	7	9
19	8	3
2	-3	4
21	-3	21
5	-3	6
7	-3	14
8	8	8
9	13	5
SELECT * FROM t2;
pk	a	b
1	1	-2
10	8	8
12	14	-3
14	8	-2
15	17	-2
17	21	-2
2	8	-2
21	7	9
5	21	-3
6	11	-2
7	5	6
8	13	-2
UPDATE t1 AS A, t2 AS B SET A.a = -4, B.b = -4 WHERE A.a BETWEEN 6 AND 12;
SELECT * FROM t1;
pk	a	b
1	-3	1
10	-3	3
11	-4	3
13	-3	2
16	-4	9
19	-4	3
2	-3	4
21	-3	21
5	-3	6
7	-3	14
8	-4	8
9	13	5
SELECT * FROM t2;
pk	a	b
1	1	-4
10	8	-4
12	14	-4
14	8	-4
15	17	-4
17	21	-4
2	8	-4
21	7	-4
5	21	-4
6	11	-4
7	5	-4
8	13	-4
DELETE FROM t1;
DELETE FROM t2;
INSERT INTO t1 VALUES (1,1,1),(13,14,2),(11,8,3),(7,21,14),(5,5,6),(9,13,5),(2,9,4),(16,7,9),(10,28,3),(21,21,21),(8,8,8),(19,8,3);
INSERT INTO t2 VALUES (1,1,1),(6,11,2),(8,13,3),(5,21,14),(7,5,6),(15,17,5),(14,8,4),(21,7,9),(17,21,3),(12,14,21),(10,8,8),(2,8,3);
DELETE t1.*, t2.* FROM t1,t2 WHERE t1.a = t2.b AND t1.b > 10;
SELECT * FROM t1;
pk	a	b
1	1	1
10	28	3
11	8	3
13	14	2
16	7	9
19	8	3
2	9	4
5	5	6
8	8	8
9	13	5
SELECT * FROM t2;
pk	a	b
1	1	1
10	8	8
14	8	4
15	17	5
17	21	3
2	8	3
21	7	9
5	21	14
6	11	2
7	5	6
8	13	3
DELETE t1.*, t2.* FROM t1,t2 WHERE t1.a < t2.b AND t1.a >= 11 AND t2.b <= 15;
SELECT * FROM t1;
pk	a	b
1	1	1
10	28	3
11	8	3
13	14	2
16	7	9
19	8	3
2	9	4
5	5	6
8	8	8
SELECT * FROM t2;
pk	a	b
1	1	1
10	8	8
14	8	4
15	17	5
17	21	3
2	8	3
21	7	9
6	11	2
7	5	6
8	13	3
DROP TABLE t1,t2;
CREATE TABLE t1(a BINARY(127));
INSERT INTO t1 VALUES ("a"),("a "),("abcdefg"),("ABCD"),("hello"),(" HELLO"),(" string ");
SELECT * FROM t1;
a
a
TRUNCATE TABLE t1;
SELECT * FROM t1;
a
DROP TABLE t1;
CREATE TABLE t1 (a INT, b TEXT, c char(16));
INSERT INTO t1 VALUES (2,'abcd1e', 'testc1'),(5,'abcd2e','testc2'),(11,'helloworld','helloworld'),(3,'1234567','1234567'),(10,'ccccc','testc3'),(12,'string','string'),(9,'word','testc4'),(8,'xxyyzz','xxyyzz'),(1,'ABCD','ABCD'),(6,'abcd','testc5'),(15,'ABCD1e','testc6'),(4,'ABCD2e','ABCD2e'),(14,"11111","11111"),(7,"22222","22222"),(21,NULL,NULL);
SELECT * FROM t1 WHERE b = "abcd1e";
a	b	c
2	abcd1e	testc1
SELECT a,b FROM t1 WHERE b <=> "abcd2e";
a	b
5	abcd2e
SELECT a,b,c FROM t1 WHERE b < "abcd" ORDER BY b DESC;
a	b	c
7	22222	22222
3	1234567	1234567
14	11111	11111
SELECT * FROM t1 WHERE b <= "ccccc";
a	b	c
1	ABCD	ABCD
10	ccccc	testc3
14	11111	11111
15	ABCD1e	testc6
2	abcd1e	testc1
3	1234567	1234567
4	ABCD2e	ABCD2e
5	abcd2e	testc2
6	abcd	testc5
7	22222	22222
SELECT * FROM t1 WHERE b > "abcde";
a	b	c
10	ccccc	testc3
11	helloworld	helloworld
12	string	string
8	xxyyzz	xxyyzz
9	word	testc4
SELECT * FROM t1 WHERE b >= "ABCD1e" ORDER BY b LIMIT 7;
a	b	c
2	abcd1e	testc1
15	ABCD1e	testc6
5	abcd2e	testc2
4	ABCD2e	ABCD2e
10	ccccc	testc3
11	helloworld	helloworld
12	string	string
SELECT a FROM t1 WHERE b BETWEEN "abcd1e" AND "xxyyzz" ORDER BY a DESC LIMIT 7;
a
12
11
10
9
8
5
2
SELECT b FROM t1 WHERE b IN ("word", "ABCD", "ABCD2e", "string", "helloworld", "11111", "1234567");
b
11111
1234567
ABCD
ABCD2e
helloworld
string
word
SELECT c FROM t1 WHERE b NOT IN ("abcd", "22222", "11111");
c
1234567
ABCD2e
helloworld
string
testc1
testc2
testc3
testc4
testc6
xxyyzz
SELECT * FROM t1 WHERE b LIKE "abc%";
a	b	c
2	abcd1e	testc1
5	abcd2e	testc2
6	abcd	testc5
SELECT * FROM t1 WHERE b REGEXP "1";
a	b	c
14	11111	11111
15	ABCD1e	testc6
2	abcd1e	testc1
3	1234567	1234567
SELECT * FROM t1 WHERE b != "abcd2e";
a	b	c
1	ABCD	ABCD
10	ccccc	testc3
11	helloworld	helloworld
12	string	string
14	11111	11111
15	ABCD1e	testc6
2	abcd1e	testc1
3	1234567	1234567
6	abcd	testc5
7	22222	22222
8	xxyyzz	xxyyzz
9	word	testc4
SELECT * FROM t1 WHERE b <> "ABCD";
a	b	c
10	ccccc	testc3
11	helloworld	helloworld
12	string	string
14	11111	11111
15	ABCD1e	testc6
2	abcd1e	testc1
3	1234567	1234567
4	ABCD2e	ABCD2e
5	abcd2e	testc2
7	22222	22222
8	xxyyzz	xxyyzz
9	word	testc4
SELECT b,c FROM t1 WHERE b = c;
b	c
11111	11111
1234567	1234567
22222	22222
ABCD	ABCD
ABCD2e	ABCD2e
helloworld	helloworld
string	string
xxyyzz	xxyyzz
SELECT a FROM t1 WHERE b IS NULL;
a
21
SELECT * FROM t1 WHERE b > "abcd1e" AND c <= "testc4";
a	b	c
10	ccccc	testc3
11	helloworld	helloworld
12	string	string
5	abcd2e	testc2
9	word	testc4
SELECT * FROM t1 WHERE b < "string" AND c >= "testc1";
a	b	c
10	ccccc	testc3
15	ABCD1e	testc6
2	abcd1e	testc1
5	abcd2e	testc2
6	abcd	testc5
SELECT * FROM t1 WHERE b <= "string" OR c > "testc5";
a	b	c
1	ABCD	ABCD
10	ccccc	testc3
11	helloworld	helloworld
12	string	string
14	11111	11111
15	ABCD1e	testc6
2	abcd1e	testc1
3	1234567	1234567
4	ABCD2e	ABCD2e
5	abcd2e	testc2
6	abcd	testc5
7	22222	22222
8	xxyyzz	xxyyzz
SELECT * FROM t1 WHERE b > "abcdefg" OR c < "testc11";
a	b	c
1	ABCD	ABCD
10	ccccc	testc3
11	helloworld	helloworld
12	string	string
14	11111	11111
2	abcd1e	testc1
3	1234567	1234567
4	ABCD2e	ABCD2e
7	22222	22222
8	xxyyzz	xxyyzz
9	word	testc4
SELECT * FROM t1 WHERE NOT b <= "abcd";
a	b	c
10	ccccc	testc3
11	helloworld	helloworld
12	string	string
2	abcd1e	testc1
5	abcd2e	testc2
8	xxyyzz	xxyyzz
9	word	testc4
SELECT * FROM t1 WHERE NOT b > "11111" OR c < "testc3";
a	b	c
1	ABCD	ABCD
11	helloworld	helloworld
12	string	string
14	11111	11111
2	abcd1e	testc1
3	1234567	1234567
4	ABCD2e	ABCD2e
5	abcd2e	testc2
7	22222	22222
CREATE INDEX b ON t1(b(3));
SELECT * FROM t1 WHERE b = "abcd1e";
a	b	c
2	abcd1e	testc1
SELECT a,b FROM t1 WHERE b <=> "abcd2e";
a	b
5	abcd2e
SELECT a,b,c FROM t1 WHERE b < "abcd" ORDER BY b DESC;
a	b	c
7	22222	22222
3	1234567	1234567
14	11111	11111
SELECT * FROM t1 WHERE b <= "ccccc";
a	b	c
1	ABCD	ABCD
10	ccccc	testc3
14	11111	11111
15	ABCD1e	testc6
2	abcd1e	testc1
3	1234567	1234567
4	ABCD2e	ABCD2e
5	abcd2e	testc2
6	abcd	testc5
7	22222	22222
SELECT * FROM t1 WHERE b > "abcde";
a	b	c
10	ccccc	testc3
11	helloworld	helloworld
12	string	string
8	xxyyzz	xxyyzz
9	word	testc4
SELECT * FROM t1 WHERE b >= "ABCD1e" ORDER BY b LIMIT 7;
a	b	c
2	abcd1e	testc1
15	ABCD1e	testc6
5	abcd2e	testc2
4	ABCD2e	ABCD2e
10	ccccc	testc3
11	helloworld	helloworld
12	string	string
SELECT a FROM t1 WHERE b BETWEEN "abcd1e" AND "xxyyzz" ORDER BY a DESC LIMIT 7;
a
12
11
10
9
8
5
2
SELECT b FROM t1 WHERE b IN ("word", "ABCD", "ABCD2e", "string", "helloworld", "11111", "1234567");
b
11111
1234567
ABCD
ABCD2e
helloworld
string
word
SELECT c FROM t1 WHERE b NOT IN ("abcd", "22222", "11111");
c
1234567
ABCD2e
helloworld
string
testc1
testc2
testc3
testc4
testc6
xxyyzz
SELECT * FROM t1 WHERE b LIKE "abc%";
a	b	c
2	abcd1e	testc1
5	abcd2e	testc2
6	abcd	testc5
SELECT * FROM t1 WHERE b REGEXP "1";
a	b	c
14	11111	11111
15	ABCD1e	testc6
2	abcd1e	testc1
3	1234567	1234567
SELECT * FROM t1 WHERE b != "abcd2e";
a	b	c
1	ABCD	ABCD
10	ccccc	testc3
11	helloworld	helloworld
12	string	string
14	11111	11111
15	ABCD1e	testc6
2	abcd1e	testc1
3	1234567	1234567
6	abcd	testc5
7	22222	22222
8	xxyyzz	xxyyzz
9	word	testc4
SELECT * FROM t1 WHERE b <> "ABCD";
a	b	c
10	ccccc	testc3
11	helloworld	helloworld
12	string	string
14	11111	11111
15	ABCD1e	testc6
2	abcd1e	testc1
3	1234567	1234567
4	ABCD2e	ABCD2e
5	abcd2e	testc2
7	22222	22222
8	xxyyzz	xxyyzz
9	word	testc4
SELECT b,c FROM t1 WHERE b = c;
b	c
helloworld	helloworld
string	string
xxyyzz	xxyyzz
11111	11111
1234567	1234567
ABCD	ABCD
ABCD2e	ABCD2e
22222	22222
SELECT a FROM t1 WHERE b IS NULL;
a
21
SELECT * FROM t1 WHERE b > "abcd1e" AND c <= "testc4";
a	b	c
10	ccccc	testc3
11	helloworld	helloworld
12	string	string
5	abcd2e	testc2
9	word	testc4
SELECT * FROM t1 WHERE b < "string" AND c >= "testc1";
a	b	c
10	ccccc	testc3
15	ABCD1e	testc6
2	abcd1e	testc1
5	abcd2e	testc2
6	abcd	testc5
SELECT * FROM t1 WHERE b <= "string" OR c > "testc5";
a	b	c
1	ABCD	ABCD
10	ccccc	testc3
11	helloworld	helloworld
12	string	string
14	11111	11111
15	ABCD1e	testc6
2	abcd1e	testc1
3	1234567	1234567
4	ABCD2e	ABCD2e
5	abcd2e	testc2
6	abcd	testc5
7	22222	22222
8	xxyyzz	xxyyzz
SELECT * FROM t1 WHERE b > "abcdefg" OR c < "testc11";
a	b	c
1	ABCD	ABCD
10	ccccc	testc3
11	helloworld	helloworld
12	string	string
14	11111	11111
2	abcd1e	testc1
3	1234567	1234567
4	ABCD2e	ABCD2e
7	22222	22222
8	xxyyzz	xxyyzz
9	word	testc4
SELECT * FROM t1 WHERE NOT b <= "abcd";
a	b	c
10	ccccc	testc3
11	helloworld	helloworld
12	string	string
2	abcd1e	testc1
5	abcd2e	testc2
8	xxyyzz	xxyyzz
9	word	testc4
SELECT * FROM t1 WHERE NOT b > "11111" OR c < "testc3";
a	b	c
1	ABCD	ABCD
11	helloworld	helloworld
12	string	string
14	11111	11111
2	abcd1e	testc1
3	1234567	1234567
4	ABCD2e	ABCD2e
5	abcd2e	testc2
7	22222	22222
DROP TABLE t1;
CREATE TABLE t1(a char(16), b text) DEFAULT CHARSET=latin1 COLLATE=latin1_bin;
INSERT INTO t1 VALUES ("hello", "hello");
INSERT INTO t1 VALUES ("HELLO", "HELLO");
INSERT INTO t1 VALUES ("hello ", "hello ");
INSERT INTO t1 VALUES ("HELLO ", "HELLO ");
INSERT INTO t1 VALUES (" hello", " hello");
INSERT INTO t1 VALUES (" HELLO", " HELLO");
INSERT INTO t1 VALUES (" hello ", " hello ");
INSERT INTO t1 VALUES (" HELLO ", " HELLO ");
INSERT INTO t1 VALUES ("HELLO ", "HELLO ");
INSERT INTO t1 VALUES ("hello ", "hello ");
INSERT INTO t1 VALUES ("hello", "hello");
INSERT INTO t1 VALUES ("HELLO", "HELLO");
INSERT INTO t1 VALUES ("hello1", "hello1");
INSERT INTO t1 VALUES ("HELLO1", "HELLO1");
INSERT INTO t1 VALUES ("hello1 ", "hello1 ");
INSERT INTO t1 VALUES ("HELLO1 ", "HELLO1 ");
INSERT INTO t1 VALUES (" hello1", " hello1");
INSERT INTO t1 VALUES (" HELLO1", " HELLO1");
INSERT INTO t1 VALUES (" hello1 ", " hello1 ");
INSERT INTO t1 VALUES (" HELLO1 ", " HELLO1 ");
INSERT INTO t1 VALUES ("HELLO1 ", "HELLO1 ");
INSERT INTO t1 VALUES ("hello1", "hello1");
INSERT INTO t1 VALUES ("hello1 ", "hello1 ");
INSERT INTO t1 VALUES ("HELLO1", "HELLO1");
SELECT a, COUNT(*) FROM t1 GROUP BY a;
a	COUNT(*)
 HELLO	2
 HELLO1	2
 hello	2
 hello1	2
HELLO	4
HELLO1	4
hello	4
hello1	4
SELECT a, COUNT(*) FROM t1 GROUP BY a HAVING a = "hello";
a	COUNT(*)
hello	4
SELECT a, COUNT(*) FROM t1 GROUP BY a HAVING a = "HELLO";
a	COUNT(*)
HELLO	4
SELECT a, COUNT(*) FROM t1 GROUP BY a HAVING a = "hello1 ";
a	COUNT(*)
hello1	4
SELECT a, COUNT(*) FROM t1 GROUP BY a HAVING a = "HELLO1 ";
a	COUNT(*)
HELLO1	4
SELECT a, COUNT(*) FROM t1 GROUP BY a HAVING a = " hello";
a	COUNT(*)
 hello	2
SELECT a, COUNT(*) FROM t1 GROUP BY a HAVING a = " HELLO";
a	COUNT(*)
 HELLO	2
SELECT a, COUNT(*) FROM t1 GROUP BY a HAVING a = " hello1 ";
a	COUNT(*)
 hello1	2
SELECT a, COUNT(*) FROM t1 GROUP BY a HAVING a = " HELLO1 ";
a	COUNT(*)
 HELLO1	2
SELECT a, b, COUNT(*) FROM t1 GROUP BY a,b HAVING a = b;
a	b	COUNT(*)
 HELLO	 HELLO	2
 HELLO1	 HELLO1	2
 hello	 hello	2
 hello1	 hello1	2
HELLO	HELLO	4
HELLO1	HELLO1	4
hello	hello	4
hello1	hello1	4
CREATE INDEX a ON t1(a);
SELECT a, COUNT(*) FROM t1 GROUP BY a;
a	COUNT(*)
 HELLO	2
 HELLO1	2
 hello	2
 hello1	2
HELLO	4
HELLO1	4
hello	4
hello1	4
SELECT a, COUNT(*) FROM t1 GROUP BY a HAVING a = "hello";
a	COUNT(*)
hello	4
SELECT a, COUNT(*) FROM t1 GROUP BY a HAVING a = "HELLO";
a	COUNT(*)
HELLO	4
SELECT a, COUNT(*) FROM t1 GROUP BY a HAVING a = "hello1 ";
a	COUNT(*)
hello1	4
SELECT a, COUNT(*) FROM t1 GROUP BY a HAVING a = "HELLO1 ";
a	COUNT(*)
HELLO1	4
SELECT a, COUNT(*) FROM t1 GROUP BY a HAVING a = " hello";
a	COUNT(*)
 hello	2
SELECT a, COUNT(*) FROM t1 GROUP BY a HAVING a = " HELLO";
a	COUNT(*)
 HELLO	2
SELECT a, COUNT(*) FROM t1 GROUP BY a HAVING a = " hello1 ";
a	COUNT(*)
 hello1	2
SELECT a, COUNT(*) FROM t1 GROUP BY a HAVING a = " HELLO1 ";
a	COUNT(*)
 HELLO1	2
SELECT a, b, COUNT(*) FROM t1 GROUP BY a,b HAVING a = b;
a	b	COUNT(*)
 HELLO	 HELLO	2
 HELLO1	 HELLO1	2
 hello	 hello	2
 hello1	 hello1	2
HELLO	HELLO	4
HELLO1	HELLO1	4
hello	hello	4
hello1	hello1	4
DROP TABLE t1;
CREATE TABLE t1(a varchar(16), b set("hello","hello1"," hello", " hello1", " HELLO"," HELLO1","HELLO","HELLO1")) DEFAULT CHARSET=latin1 COLLATE=latin1_bin;
INSERT INTO t1 VALUES ("hello", "hello");
INSERT INTO t1 VALUES ("HELLO", "HELLO");
INSERT INTO t1 VALUES ("hello ", "hello ");
INSERT INTO t1 VALUES ("HELLO ", "HELLO ");
INSERT INTO t1 VALUES (" hello", " hello");
INSERT INTO t1 VALUES (" HELLO", " HELLO");
INSERT INTO t1 VALUES (" hello ", " hello ");
INSERT INTO t1 VALUES (" HELLO ", " HELLO ");
INSERT INTO t1 VALUES ("HELLO ", "HELLO ");
INSERT INTO t1 VALUES ("hello ", "hello ");
INSERT INTO t1 VALUES ("hello", "hello");
INSERT INTO t1 VALUES ("HELLO", "HELLO");
INSERT INTO t1 VALUES ("hello1", "hello1");
INSERT INTO t1 VALUES ("HELLO1", "HELLO1");
INSERT INTO t1 VALUES ("hello1 ", "hello1 ");
INSERT INTO t1 VALUES ("HELLO1 ", "HELLO1 ");
INSERT INTO t1 VALUES (" hello1", " hello1");
INSERT INTO t1 VALUES (" HELLO1", " HELLO1");
INSERT INTO t1 VALUES (" hello1 ", " hello1 ");
INSERT INTO t1 VALUES (" HELLO1 ", " HELLO1 ");
INSERT INTO t1 VALUES ("HELLO1 ", "HELLO1 ");
INSERT INTO t1 VALUES ("hello1", "hello1");
INSERT INTO t1 VALUES ("hello1 ", "hello1 ");
INSERT INTO t1 VALUES ("HELLO1", "HELLO1");
SELECT a, COUNT(*) FROM t1 GROUP BY a;
a	COUNT(*)
 HELLO	2
 HELLO1 	2
 hello 	2
 hello1	2
HELLO	4
HELLO1	4
hello 	4
hello1	4
SELECT a, COUNT(*) FROM t1 GROUP BY a HAVING a = "hello";
a	COUNT(*)
hello 	4
SELECT a, COUNT(*) FROM t1 GROUP BY a HAVING a = "HELLO";
a	COUNT(*)
HELLO	4
SELECT a, COUNT(*) FROM t1 GROUP BY a HAVING a = "hello1 ";
a	COUNT(*)
hello1	4
SELECT a, COUNT(*) FROM t1 GROUP BY a HAVING a = "HELLO1 ";
a	COUNT(*)
HELLO1	4
SELECT a, COUNT(*) FROM t1 GROUP BY a HAVING a = " hello";
a	COUNT(*)
 hello 	2
SELECT a, COUNT(*) FROM t1 GROUP BY a HAVING a = " HELLO";
a	COUNT(*)
 HELLO	2
SELECT a, COUNT(*) FROM t1 GROUP BY a HAVING a = " hello1 ";
a	COUNT(*)
 hello1	2
SELECT a, COUNT(*) FROM t1 GROUP BY a HAVING a = " HELLO1 ";
a	COUNT(*)
 HELLO1 	2
SELECT a, b, COUNT(*) FROM t1 GROUP BY a,b HAVING a = b;
a	b	COUNT(*)
 HELLO	 HELLO	2
 HELLO1 	 HELLO1	2
 hello 	 hello	2
 hello1	 hello1	2
HELLO	HELLO	4
HELLO1	HELLO1	4
hello 	hello	4
hello1	hello1	4
CREATE INDEX a ON t1(a);
SELECT a, COUNT(*) FROM t1 GROUP BY a;
a	COUNT(*)
 HELLO	2
 HELLO1 	2
 hello 	2
 hello1	2
HELLO	4
HELLO1	4
hello 	4
hello1	4
SELECT a, COUNT(*) FROM t1 GROUP BY a HAVING a = "hello";
a	COUNT(*)
hello 	4
SELECT a, COUNT(*) FROM t1 GROUP BY a HAVING a = "HELLO";
a	COUNT(*)
HELLO	4
SELECT a, COUNT(*) FROM t1 GROUP BY a HAVING a = "hello1 ";
a	COUNT(*)
hello1	4
SELECT a, COUNT(*) FROM t1 GROUP BY a HAVING a = "HELLO1 ";
a	COUNT(*)
HELLO1	4
SELECT a, COUNT(*) FROM t1 GROUP BY a HAVING a = " hello";
a	COUNT(*)
 hello 	2
SELECT a, COUNT(*) FROM t1 GROUP BY a HAVING a = " HELLO";
a	COUNT(*)
 HELLO	2
SELECT a, COUNT(*) FROM t1 GROUP BY a HAVING a = " hello1 ";
a	COUNT(*)
 hello1	2
SELECT a, COUNT(*) FROM t1 GROUP BY a HAVING a = " HELLO1 ";
a	COUNT(*)
 HELLO1 	2
SELECT a, b, COUNT(*) FROM t1 GROUP BY a,b HAVING a = b;
a	b	COUNT(*)
 HELLO	 HELLO	2
 HELLO1 	 HELLO1	2
 hello 	 hello	2
 hello1	 hello1	2
HELLO	HELLO	4
HELLO1	HELLO1	4
hello 	hello	4
hello1	hello1	4
DROP TABLE t1;
CREATE TABLE t1(a tinytext, b mediumtext, c text, d longtext) DEFAULT CHARSET=latin1 COLLATE=latin1_bin;
INSERT INTO t1 VALUES ("hello", "hello", "hello", "hello");
INSERT INTO t1 VALUES ("HELLO", "HELLO", "HELLO", "HELLO");
INSERT INTO t1 VALUES ("hello ", "hello ", "hello ", "hello ");
INSERT INTO t1 VALUES ("HELLO ", "HELLO ", "HELLO ", "HELLO ");
INSERT INTO t1 VALUES (" hello", " hello", " hello", " hello");
INSERT INTO t1 VALUES (" HELLO", " HELLO", " HELLO", " HELLO");
INSERT INTO t1 VALUES (" hello ", " hello ", " hello ", " hello ");
INSERT INTO t1 VALUES (" HELLO ", " HELLO ", " HELLO ", " HELLO ");
INSERT INTO t1 VALUES ("HELLO ", "HELLO ", "HELLO ", "HELLO ");
INSERT INTO t1 VALUES ("hello ", "hello ", "hello ", "hello ");
INSERT INTO t1 VALUES ("hello", "hello", "hello", "hello");
INSERT INTO t1 VALUES ("HELLO", "HELLO", "HELLO", "HELLO");
INSERT INTO t1 VALUES ("hello1", "hello1", "hello1", "hello1");
INSERT INTO t1 VALUES ("HELLO1", "HELLO1", "HELLO1", "HELLO1");
INSERT INTO t1 VALUES ("hello1 ", "hello1 ", "hello1 ", "hello1 ");
INSERT INTO t1 VALUES ("HELLO1 ", "HELLO1 ", "HELLO1 ", "HELLO1 ");
INSERT INTO t1 VALUES (" hello1", " hello1", " hello1", " hello1");
INSERT INTO t1 VALUES (" HELLO1", " HELLO1", " HELLO1", " HELLO1");
INSERT INTO t1 VALUES (" hello1 ", " hello1 ", " hello1 ", " hello1 ");
INSERT INTO t1 VALUES (" HELLO1 ", " HELLO1 ", " HELLO1 ", " HELLO1 ");
INSERT INTO t1 VALUES ("HELLO1 ", "HELLO1 ", "HELLO1 ", "HELLO1 ");
INSERT INTO t1 VALUES ("hello1", "hello1", "hello1", "hello1");
INSERT INTO t1 VALUES ("hello1 ", "hello1 ", "hello1 ", "hello1 ");
INSERT INTO t1 VALUES ("HELLO1", "HELLO1", "HELLO1", "HELLO1");
SELECT a, COUNT(*) FROM t1 GROUP BY a;
a	COUNT(*)
 HELLO	2
 HELLO1 	2
 hello 	2
 hello1	2
HELLO	4
HELLO1	4
hello 	4
hello1	4
SELECT a, COUNT(*) FROM t1 GROUP BY a HAVING a = "hello";
a	COUNT(*)
hello 	4
SELECT b, COUNT(*) FROM t1 GROUP BY b HAVING b = "HELLO";
b	COUNT(*)
HELLO	4
SELECT c, COUNT(*) FROM t1 GROUP BY c HAVING c = "hello1 ";
c	COUNT(*)
hello1	4
SELECT d, COUNT(*) FROM t1 GROUP BY d HAVING d = "HELLO1 ";
d	COUNT(*)
HELLO1	4
SELECT d, COUNT(*) FROM t1 GROUP BY d HAVING d = " hello";
d	COUNT(*)
 hello 	2
SELECT c, COUNT(*) FROM t1 GROUP BY c HAVING c = " HELLO";
c	COUNT(*)
 HELLO	2
SELECT b, COUNT(*) FROM t1 GROUP BY b HAVING b = " hello1 ";
b	COUNT(*)
 hello1	2
SELECT a, COUNT(*) FROM t1 GROUP BY a HAVING a = " HELLO1 ";
a	COUNT(*)
 HELLO1 	2
SELECT c, d, COUNT(*) FROM t1 GROUP BY c, d HAVING c = d;
c	d	COUNT(*)
 HELLO	 HELLO	2
 HELLO1 	 HELLO1 	2
 hello 	 hello 	2
 hello1	 hello1	2
HELLO	HELLO	4
HELLO1	HELLO1	4
hello 	hello 	4
hello1	hello1	4
CREATE INDEX a ON t1(a(16));
CREATE INDEX b ON t1(b(16));
CREATE INDEX c ON t1(c(16));
CREATE INDEX d ON t1(d(16));
SELECT a, COUNT(*) FROM t1 GROUP BY a;
a	COUNT(*)
 HELLO	2
 HELLO1 	2
 hello 	2
 hello1	2
HELLO	4
HELLO1	4
hello 	4
hello1	4
SELECT a, COUNT(*) FROM t1 GROUP BY a HAVING a = "hello";
a	COUNT(*)
hello 	4
SELECT b, COUNT(*) FROM t1 GROUP BY b HAVING b = "HELLO";
b	COUNT(*)
HELLO	4
SELECT c, COUNT(*) FROM t1 GROUP BY c HAVING c = "hello1 ";
c	COUNT(*)
hello1	4
SELECT d, COUNT(*) FROM t1 GROUP BY d HAVING d = "HELLO1 ";
d	COUNT(*)
HELLO1	4
SELECT d, COUNT(*) FROM t1 GROUP BY d HAVING d = " hello";
d	COUNT(*)
 hello 	2
SELECT c, COUNT(*) FROM t1 GROUP BY c HAVING c = " HELLO";
c	COUNT(*)
 HELLO	2
SELECT b, COUNT(*) FROM t1 GROUP BY b HAVING b = " hello1 ";
b	COUNT(*)
 hello1	2
SELECT a, COUNT(*) FROM t1 GROUP BY a HAVING a = " HELLO1 ";
a	COUNT(*)
 HELLO1 	2
SELECT c, d, COUNT(*) FROM t1 GROUP BY c,d HAVING c = d;
c	d	COUNT(*)
 HELLO	 HELLO	2
 HELLO1 	 HELLO1 	2
 hello 	 hello 	2
 hello1	 hello1	2
HELLO	HELLO	4
HELLO1	HELLO1	4
hello 	hello 	4
hello1	hello1	4
DROP TABLE t1;
