DROP TABLE IF EXISTS t1, t2;
CREATE TABLE t1 (a TINYINT UNSIGNED NOT NULL, b INT UNSIGNED NOT NULL);
CREATE TABLE t2 (a TINYINT UNSIGNED NOT NULL, b INT UNSIGNED NOT NULL);
INSERT INTO t1 (a,b) VALUES (1,36),(8,11),(3,5),(6,9),(4,10),(9,1),(2,12),(7,18),(5,2),(10,0);
INSERT INTO t2 (a,b) VALUES (102,6),(99,5),(87,22),(79,9),(85,7),(101,5),(80,14),(100,1),(97,29),(98,19);
INSERT INTO t1 ( a, b ) SELECT MAX(a), MAX(b) FROM t2;
INSERT INTO t2 ( a, b ) SELECT MIN(a), MIN(b) FROM t1;
INSERT INTO t1 SELECT t2.a,t2.b FROM t2;
INSERT INTO t2 SELECT t1.a,t1.b FROM t1;
SELECT * FROM t1;
a	b
1	0
1	36
10	0
100	1
101	5
102	29
102	6
2	12
3	5
4	10
5	2
6	9
7	18
79	9
8	11
80	14
85	7
87	22
9	1
97	29
98	19
99	5
SELECT * FROM t2;
a	b
1	0
1	0
1	36
10	0
100	1
100	1
101	5
101	5
102	29
102	6
102	6
2	12
3	5
4	10
5	2
6	9
7	18
79	9
79	9
8	11
80	14
80	14
85	7
85	7
87	22
87	22
9	1
97	29
97	29
98	19
98	19
99	5
99	5
UPDATE t1 SET b = 3 WHERE b>5;
UPDATE t2 SET b = 2 WHERE b>=0;
SELECT * FROM t1;
a	b
1	0
1	3
10	0
100	1
101	5
102	3
102	3
2	3
3	5
4	3
5	2
6	3
7	3
79	3
8	3
80	3
85	3
87	3
9	1
97	3
98	3
99	5
SELECT * FROM t2;
a	b
1	2
1	2
1	2
10	2
100	2
100	2
101	2
101	2
102	2
102	2
102	2
2	2
3	2
4	2
5	2
6	2
7	2
79	2
79	2
8	2
80	2
80	2
85	2
85	2
87	2
87	2
9	2
97	2
97	2
98	2
98	2
99	2
99	2
DELETE FROM t1 WHERE a > 3;
DELETE FROM t2 WHERE a >= 0;
SELECT * FROM t1;
a	b
1	0
1	3
2	3
3	5
SELECT * FROM t2;
a	b
CREATE INDEX a ON t1(a);
CREATE INDEX b ON t1(b);
CREATE INDEX a ON t2(a);
CREATE INDEX b ON t2(b);
INSERT INTO t1 (a,b) VALUES (1,36),(8,11),(3,5),(6,9),(4,10),(9,1),(2,12),(7,18),(5,2),(10,0);
INSERT INTO t2 (a,b) VALUES (102,6),(99,5),(87,22),(79,9),(85,7),(101,5),(80,14),(100,1),(97,29),(98,19);
INSERT INTO t1 ( a, b ) SELECT MAX(a), MAX(b) FROM t2;
INSERT INTO t2 ( a, b ) SELECT MIN(a), MIN(b) FROM t1;
INSERT INTO t1 SELECT t2.a,t2.b FROM t2;
INSERT INTO t2 SELECT t1.a,t1.b FROM t1;
SELECT * FROM t1;
a	b
1	0
1	0
1	3
1	36
10	0
100	1
101	5
102	29
102	6
2	12
2	3
3	5
3	5
4	10
5	2
6	9
7	18
79	9
8	11
80	14
85	7
87	22
9	1
97	29
98	19
99	5
SELECT * FROM t2;
a	b
1	0
1	0
1	0
1	3
1	36
10	0
100	1
100	1
101	5
101	5
102	29
102	6
102	6
2	12
2	3
3	5
3	5
4	10
5	2
6	9
7	18
79	9
79	9
8	11
80	14
80	14
85	7
85	7
87	22
87	22
9	1
97	29
97	29
98	19
98	19
99	5
99	5
UPDATE t1 SET b = 3 WHERE b>5;
UPDATE t2 SET b = 2 WHERE b>=0;
SELECT * FROM t1;
a	b
1	0
1	0
1	3
1	3
10	0
100	1
101	5
102	3
102	3
2	3
2	3
3	5
3	5
4	3
5	2
6	3
7	3
79	3
8	3
80	3
85	3
87	3
9	1
97	3
98	3
99	5
SELECT * FROM t2;
a	b
1	2
1	2
1	2
1	2
1	2
10	2
100	2
100	2
101	2
101	2
102	2
102	2
102	2
2	2
2	2
3	2
3	2
4	2
5	2
6	2
7	2
79	2
79	2
8	2
80	2
80	2
85	2
85	2
87	2
87	2
9	2
97	2
97	2
98	2
98	2
99	2
99	2
DELETE FROM t1 WHERE a > 3;
DELETE FROM t2 WHERE a >= 0;
SELECT * FROM t1;
a	b
1	0
1	0
1	3
1	3
2	3
2	3
3	5
3	5
SELECT * FROM t2;
a	b
DROP TABLE t1,t2;
CREATE TABLE t1 (a INT, b VARCHAR(10));
INSERT INTO t1 VALUES (2,'abcd1e'),(5,'abcd2e'),(11,'helloworld'),(3,'1234567'),(10,'ccccc'),(12,'string'),(9,'word'),(8,'xxyyzz'),(1,'ABCD'),(6,'abcd'),(15,'ABCD1e'),(4,'ABCD2e');
UPDATE t1 SET b = "updateb1" WHERE b = "abcd1e";
SELECT * FROM t1;
a	b
1	ABCD
10	ccccc
11	helloworld
12	string
15	ABCD1e
2	updateb1
3	1234567
4	ABCD2e
5	abcd2e
6	abcd
8	xxyyzz
9	word
UPDATE t1 SET b = "updateb2" WHERE b <=> "abcd2e";
SELECT * FROM t1;
a	b
1	ABCD
10	ccccc
11	helloworld
12	string
15	ABCD1e
2	updateb1
3	1234567
4	ABCD2e
5	updateb2
6	abcd
8	xxyyzz
9	word
UPDATE t1 SET b = "updateb3" WHERE b < "abcd" ORDER BY b DESC;
SELECT * FROM t1;
a	b
1	ABCD
10	ccccc
11	helloworld
12	string
15	ABCD1e
2	updateb1
3	updateb3
4	ABCD2e
5	updateb2
6	abcd
8	xxyyzz
9	word
UPDATE t1 SET b = "updateb4" WHERE b <= "ccccc";
SELECT * FROM t1;
a	b
1	updateb4
10	updateb4
11	helloworld
12	string
15	updateb4
2	updateb1
3	updateb3
4	updateb4
5	updateb2
6	updateb4
8	xxyyzz
9	word
UPDATE t1 SET b = "updateb5" WHERE b > "word";
SELECT * FROM t1;
a	b
1	updateb4
10	updateb4
11	helloworld
12	string
15	updateb4
2	updateb1
3	updateb3
4	updateb4
5	updateb2
6	updateb4
8	updateb5
9	word
UPDATE t1 SET b = "updateb6" WHERE b >= "updateb4" ORDER BY b LIMIT 2;
SELECT * FROM t1;
a	b
1	updateb6
10	updateb6
11	helloworld
12	string
15	updateb4
2	updateb1
3	updateb3
4	updateb4
5	updateb2
6	updateb4
8	updateb5
9	word
UPDATE t1 SET b = "updateb7" WHERE b BETWEEN "updateb1" AND "updateb4" ORDER BY a DESC LIMIT 4;
SELECT * FROM t1;
a	b
1	updateb6
10	updateb6
11	helloworld
12	string
15	updateb7
2	updateb1
3	updateb3
4	updateb7
5	updateb7
6	updateb7
8	updateb5
9	word
UPDATE t1 SET b = "updateb8" WHERE b IN ("word", "updateb5", "updateb6", "string");
SELECT * FROM t1;
a	b
1	updateb8
10	updateb8
11	helloworld
12	updateb8
15	updateb7
2	updateb1
3	updateb3
4	updateb7
5	updateb7
6	updateb7
8	updateb8
9	updateb8
UPDATE t1 SET b = "updateb9" WHERE b NOT IN ("updateb7", "helloworld");
SELECT * FROM t1;
a	b
1	updateb9
10	updateb9
11	helloworld
12	updateb9
15	updateb7
2	updateb9
3	updateb9
4	updateb7
5	updateb7
6	updateb7
8	updateb9
9	updateb9
UPDATE t1 SET b = "updateb10" WHERE b LIKE "updateb7%";
SELECT * FROM t1;
a	b
1	updateb9
10	updateb9
11	helloworld
12	updateb9
15	updateb10
2	updateb9
3	updateb9
4	updateb10
5	updateb10
6	updateb10
8	updateb9
9	updateb9
UPDATE t1 SET b = "updateb11" WHERE b REGEXP "updateb1";
SELECT * FROM t1;
a	b
1	updateb9
10	updateb9
11	helloworld
12	updateb9
15	updateb11
2	updateb9
3	updateb9
4	updateb11
5	updateb11
6	updateb11
8	updateb9
9	updateb9
UPDATE t1 SET b = "updateb12" WHERE b != "updateb11";
SELECT * FROM t1;
a	b
1	updateb12
10	updateb12
11	updateb12
12	updateb12
15	updateb11
2	updateb12
3	updateb12
4	updateb11
5	updateb11
6	updateb11
8	updateb12
9	updateb12
UPDATE t1 SET b = "updateb13" WHERE b IS NULL;
SELECT * FROM t1;
a	b
1	updateb12
10	updateb12
11	updateb12
12	updateb12
15	updateb11
2	updateb12
3	updateb12
4	updateb11
5	updateb11
6	updateb11
8	updateb12
9	updateb12
UPDATE t1 SET b = "updateb14" WHERE b IS NOT NULL;
SELECT * FROM t1;
a	b
1	updateb14
10	updateb14
11	updateb14
12	updateb14
15	updateb14
2	updateb14
3	updateb14
4	updateb14
5	updateb14
6	updateb14
8	updateb14
9	updateb14
DELETE FROM t1;
INSERT INTO t1 VALUES (2,'abcd1e'),(5,'abcd2e'),(11,'helloworld'),(3,'1234567'),(10,'ccccc'),(12,'string'),(9,'word'),(8,'xxyyzz'),(1,'ABCD'),(6,'abcd'),(15,'ABCD1e'),(4,'ABCD2e'),(14,"test1"),(18,"abcde"),(15,"abcdef"),(13,"bcd"),(21,"bcde"),(17,"acdef");
DELETE FROM t1 WHERE b = "abcd1e";
SELECT * FROM t1;
a	b
1	ABCD
10	ccccc
11	helloworld
12	string
13	bcd
14	test1
15	ABCD1e
15	abcdef
17	acdef
18	abcde
21	bcde
3	1234567
4	ABCD2e
5	abcd2e
6	abcd
8	xxyyzz
9	word
DELETE FROM t1 WHERE b <=> "abcd2e";
SELECT * FROM t1;
a	b
1	ABCD
10	ccccc
11	helloworld
12	string
13	bcd
14	test1
15	ABCD1e
15	abcdef
17	acdef
18	abcde
21	bcde
3	1234567
4	ABCD2e
6	abcd
8	xxyyzz
9	word
DELETE FROM t1 WHERE b < "ABCD1e";
SELECT * FROM t1;
a	b
10	ccccc
11	helloworld
12	string
13	bcd
14	test1
15	ABCD1e
15	abcdef
17	acdef
18	abcde
21	bcde
4	ABCD2e
6	abcd
8	xxyyzz
9	word
DELETE FROM t1 WHERE b <= "abcd" ORDER BY b DESC LIMIT 2;
SELECT * FROM t1;
a	b
10	ccccc
11	helloworld
12	string
13	bcd
14	test1
15	ABCD1e
15	abcdef
17	acdef
18	abcde
21	bcde
4	ABCD2e
8	xxyyzz
9	word
DELETE FROM t1 WHERE b > "word";
SELECT * FROM t1;
a	b
10	ccccc
11	helloworld
12	string
13	bcd
14	test1
15	ABCD1e
15	abcdef
17	acdef
18	abcde
21	bcde
4	ABCD2e
9	word
DELETE FROM t1 WHERE b >= "word";
SELECT * FROM t1;
a	b
10	ccccc
11	helloworld
12	string
13	bcd
14	test1
15	ABCD1e
15	abcdef
17	acdef
18	abcde
21	bcde
4	ABCD2e
DELETE FROM t1 WHERE b BETWEEN "ccccc" AND "helloworld" ORDER BY b LIMIT 2;
SELECT * FROM t1;
a	b
12	string
13	bcd
14	test1
15	ABCD1e
15	abcdef
17	acdef
18	abcde
21	bcde
4	ABCD2e
DELETE FROM t1 WHERE b LIKE "abcde%" ORDER BY a DESC LIMIT 1;
SELECT * FROM t1;
a	b
12	string
13	bcd
14	test1
15	ABCD1e
15	abcdef
17	acdef
21	bcde
4	ABCD2e
DELETE FROM t1 WHERE b REGEXP "str";
SELECT * FROM t1;
a	b
13	bcd
14	test1
15	ABCD1e
15	abcdef
17	acdef
21	bcde
4	ABCD2e
DELETE FROM t1 WHERE b IN ("bcd", "acdef");
SELECT * FROM t1;
a	b
14	test1
15	ABCD1e
15	abcdef
21	bcde
4	ABCD2e
DELETE FROM t1  WHERE b != "test1";
SELECT * FROM t1;
a	b
14	test1
DELETE FROM t1 WHERE b IS NOT NULL;
SELECT * FROM t1;
a	b
CREATE INDEX a ON t1(a);
CREATE INDEX b ON t1(b(5));
INSERT INTO t1 VALUES (2,'abcd1e'),(5,'abcd2e'),(11,'helloworld'),(3,'1234567'),(10,'ccccc'),(12,'string'),(9,'word'),(8,'xxyyzz'),(1,'ABCD'),(6,'abcd'),(15,'ABCD1e'),(4,'ABCD2e');
UPDATE t1 SET b = "updateb1" WHERE b = "abcd1e";
SELECT * FROM t1;
a	b
1	ABCD
10	ccccc
11	helloworld
12	string
15	ABCD1e
2	updateb1
3	1234567
4	ABCD2e
5	abcd2e
6	abcd
8	xxyyzz
9	word
UPDATE t1 SET b = "updateb2" WHERE b <=> "abcd2e";
SELECT * FROM t1;
a	b
1	ABCD
10	ccccc
11	helloworld
12	string
15	ABCD1e
2	updateb1
3	1234567
4	ABCD2e
5	updateb2
6	abcd
8	xxyyzz
9	word
UPDATE t1 SET b = "updateb3" WHERE b < "abcd" ORDER BY b DESC;
SELECT * FROM t1;
a	b
1	ABCD
10	ccccc
11	helloworld
12	string
15	ABCD1e
2	updateb1
3	updateb3
4	ABCD2e
5	updateb2
6	abcd
8	xxyyzz
9	word
UPDATE t1 SET b = "updateb4" WHERE b <= "ccccc";
SELECT * FROM t1;
a	b
1	updateb4
10	updateb4
11	helloworld
12	string
15	updateb4
2	updateb1
3	updateb3
4	updateb4
5	updateb2
6	updateb4
8	xxyyzz
9	word
UPDATE t1 SET b = "updateb5" WHERE b > "word";
SELECT * FROM t1;
a	b
1	updateb4
10	updateb4
11	helloworld
12	string
15	updateb4
2	updateb1
3	updateb3
4	updateb4
5	updateb2
6	updateb4
8	updateb5
9	word
UPDATE t1 SET b = "updateb6" WHERE b >= "UPDATEb4" ORDER BY b LIMIT 2;
SELECT * FROM t1;
a	b
1	updateb6
10	updateb6
11	helloworld
12	string
15	updateb4
2	updateb1
3	updateb3
4	updateb4
5	updateb2
6	updateb4
8	updateb5
9	word
UPDATE t1 SET b = "updateb7" WHERE b BETWEEN "updateb1" AND "updateb4" ORDER BY a DESC LIMIT 4;
SELECT * FROM t1;
a	b
1	updateb6
10	updateb6
11	helloworld
12	string
15	updateb7
2	updateb1
3	updateb3
4	updateb7
5	updateb7
6	updateb7
8	updateb5
9	word
UPDATE t1 SET b = "updateb8" WHERE b IN ("word", "updateb5", "updateb6", "string");
SELECT * FROM t1;
a	b
1	updateb8
10	updateb8
11	helloworld
12	updateb8
15	updateb7
2	updateb1
3	updateb3
4	updateb7
5	updateb7
6	updateb7
8	updateb8
9	updateb8
UPDATE t1 SET b = "updateb9" WHERE b NOT IN ("updateb7", "helloworld");
SELECT * FROM t1;
a	b
1	updateb9
10	updateb9
11	helloworld
12	updateb9
15	updateb7
2	updateb9
3	updateb9
4	updateb7
5	updateb7
6	updateb7
8	updateb9
9	updateb9
UPDATE t1 SET b = "updateb10" WHERE b LIKE "updateb7%";
SELECT * FROM t1;
a	b
1	updateb9
10	updateb9
11	helloworld
12	updateb9
15	updateb10
2	updateb9
3	updateb9
4	updateb10
5	updateb10
6	updateb10
8	updateb9
9	updateb9
UPDATE t1 SET b = "updateb11" WHERE b REGEXP "updateb1";
SELECT * FROM t1;
a	b
1	updateb9
10	updateb9
11	helloworld
12	updateb9
15	updateb11
2	updateb9
3	updateb9
4	updateb11
5	updateb11
6	updateb11
8	updateb9
9	updateb9
UPDATE t1 SET b = "updateb12" WHERE b != "updateb11";
SELECT * FROM t1;
a	b
1	updateb12
10	updateb12
11	updateb12
12	updateb12
15	updateb11
2	updateb12
3	updateb12
4	updateb11
5	updateb11
6	updateb11
8	updateb12
9	updateb12
UPDATE t1 SET b = "updateb13" WHERE b IS NULL;
SELECT * FROM t1;
a	b
1	updateb12
10	updateb12
11	updateb12
12	updateb12
15	updateb11
2	updateb12
3	updateb12
4	updateb11
5	updateb11
6	updateb11
8	updateb12
9	updateb12
UPDATE t1 SET b = "updateb14" WHERE b IS NOT NULL;
SELECT * FROM t1;
a	b
1	updateb14
10	updateb14
11	updateb14
12	updateb14
15	updateb14
2	updateb14
3	updateb14
4	updateb14
5	updateb14
6	updateb14
8	updateb14
9	updateb14
DELETE FROM t1;
INSERT INTO t1 VALUES (2,'abcd1e'),(5,'abcd2e'),(11,'helloworld'),(3,'1234567'),(10,'ccccc'),(12,'string'),(9,'word'),(8,'xxyyzz'),(1,'ABCD'),(6,'abcd'),(15,'ABCD1e'),(4,'ABCD2e'),(14,"test1"),(18,"abcde"),(15,"abcdef"),(13,"bcd"),(21,"bcde"),(17,"acdef");
DELETE FROM t1 WHERE b = "abcd1e";
SELECT * FROM t1;
a	b
1	ABCD
10	ccccc
11	helloworld
12	string
13	bcd
14	test1
15	ABCD1e
15	abcdef
17	acdef
18	abcde
21	bcde
3	1234567
4	ABCD2e
5	abcd2e
6	abcd
8	xxyyzz
9	word
DELETE FROM t1 WHERE b <=> "abcd2e";
SELECT * FROM t1;
a	b
1	ABCD
10	ccccc
11	helloworld
12	string
13	bcd
14	test1
15	ABCD1e
15	abcdef
17	acdef
18	abcde
21	bcde
3	1234567
4	ABCD2e
6	abcd
8	xxyyzz
9	word
DELETE FROM t1 WHERE b < "ABCD1e";
SELECT * FROM t1;
a	b
10	ccccc
11	helloworld
12	string
13	bcd
14	test1
15	ABCD1e
15	abcdef
17	acdef
18	abcde
21	bcde
4	ABCD2e
6	abcd
8	xxyyzz
9	word
DELETE FROM t1 WHERE b <= "abcd" ORDER BY b DESC LIMIT 2;
SELECT * FROM t1;
a	b
10	ccccc
11	helloworld
12	string
13	bcd
14	test1
15	ABCD1e
15	abcdef
17	acdef
18	abcde
21	bcde
4	ABCD2e
6	abcd
8	xxyyzz
9	word
DELETE FROM t1 WHERE b > "word";
SELECT * FROM t1;
a	b
10	ccccc
11	helloworld
12	string
13	bcd
14	test1
15	ABCD1e
15	abcdef
17	acdef
18	abcde
21	bcde
4	ABCD2e
6	abcd
9	word
DELETE FROM t1 WHERE b >= "word";
SELECT * FROM t1;
a	b
10	ccccc
11	helloworld
12	string
13	bcd
14	test1
15	ABCD1e
15	abcdef
17	acdef
18	abcde
21	bcde
4	ABCD2e
6	abcd
DELETE FROM t1 WHERE b BETWEEN "ccccc" AND "helloworld" ORDER BY b LIMIT 2;
SELECT * FROM t1;
a	b
12	string
13	bcd
14	test1
15	ABCD1e
15	abcdef
17	acdef
18	abcde
21	bcde
4	ABCD2e
6	abcd
DELETE FROM t1 WHERE b LIKE "abcde%" ORDER BY a DESC LIMIT 1;
SELECT * FROM t1;
a	b
12	string
13	bcd
14	test1
15	ABCD1e
15	abcdef
17	acdef
21	bcde
4	ABCD2e
6	abcd
DELETE FROM t1 WHERE b REGEXP "str";
SELECT * FROM t1;
a	b
13	bcd
14	test1
15	ABCD1e
15	abcdef
17	acdef
21	bcde
4	ABCD2e
6	abcd
DELETE FROM t1 WHERE b IN ("bcd", "acdef");
SELECT * FROM t1;
a	b
14	test1
15	ABCD1e
15	abcdef
21	bcde
4	ABCD2e
6	abcd
DELETE FROM t1  WHERE b != "test1";
SELECT * FROM t1;
a	b
14	test1
DELETE FROM t1 WHERE b IS NOT NULL;
SELECT * FROM t1;
a	b
DROP TABLE t1;
CREATE TABLE t1(pk INT, a MEDIUMINT, b SMALLINT, PRIMARY KEY (pk));
CREATE TABLE t2(pk INT, a MEDIUMINT, b SMALLINT, PRIMARY KEY (pk));
INSERT INTO t1 VALUES (1,1,1),(13,14,2),(11,8,3),(7,21,14),(5,5,6),(9,13,5),(2,9,4),(16,7,9),(10,28,3),(21,21,21),(8,8,8),(19,8,3);
INSERT INTO t2 VALUES (1,1,1),(6,11,2),(8,13,3),(5,21,14),(7,5,6),(15,17,5),(14,8,4),(21,7,9),(17,21,3),(12,14,21),(10,8,8),(2,8,3);
UPDATE t1 AS A, t2 AS B SET A.a = -1, B.b = -1 WHERE A.a = 9 AND B.b = 3;
SELECT * FROM t1;
pk	a	b
1	1	1
10	28	3
11	8	3
13	14	2
16	7	9
19	8	3
2	-1	4
21	21	21
5	5	6
7	21	14
8	8	8
9	13	5
SELECT * FROM t2;
pk	a	b
1	1	1
10	8	8
12	14	21
14	8	4
15	17	5
17	21	-1
2	8	-1
21	7	9
5	21	14
6	11	2
7	5	6
8	13	-1
UPDATE t1 AS A, t2 AS B SET A.a = -2, B.b = -2 WHERE A.a > 13 AND B.b <= 5;
SELECT * FROM t1;
pk	a	b
1	1	1
10	-2	3
11	8	3
13	-2	2
16	7	9
19	8	3
2	-1	4
21	-2	21
5	5	6
7	-2	14
8	8	8
9	13	5
SELECT * FROM t2;
pk	a	b
1	1	-2
10	8	8
12	14	21
14	8	-2
15	17	-2
17	21	-2
2	8	-2
21	7	9
5	21	14
6	11	-2
7	5	6
8	13	-2
UPDATE t1 AS A, t2 AS B SET A.a = -3, B.b = -3 WHERE A.a < 6 AND B.b >= 11;
SELECT * FROM t1;
pk	a	b
1	-3	1
10	-3	3
11	8	3
13	-3	2
16	7	9
19	8	3
2	-3	4
21	-3	21
5	-3	6
7	-3	14
8	8	8
9	13	5
SELECT * FROM t2;
pk	a	b
1	1	-2
10	8	8
12	14	-3
14	8	-2
15	17	-2
17	21	-2
2	8	-2
21	7	9
5	21	-3
6	11	-2
7	5	6
8	13	-2
UPDATE t1 AS A, t2 AS B SET A.a = -4, B.b = -4 WHERE A.a BETWEEN 6 AND 12;
SELECT * FROM t1;
pk	a	b
1	-3	1
10	-3	3
11	-4	3
13	-3	2
16	-4	9
19	-4	3
2	-3	4
21	-3	21
5	-3	6
7	-3	14
8	-4	8
9	13	5
SELECT * FROM t2;
pk	a	b
1	1	-4
10	8	-4
12	14	-4
14	8	-4
15	17	-4
17	21	-4
2	8	-4
21	7	-4
5	21	-4
6	11	-4
7	5	-4
8	13	-4
DELETE FROM t1;
DELETE FROM t2;
INSERT INTO t1 VALUES (1,1,1),(13,14,2),(11,8,3),(7,21,14),(5,5,6),(9,13,5),(2,9,4),(16,7,9),(10,28,3),(21,21,21),(8,8,8),(19,8,3);
INSERT INTO t2 VALUES (1,1,1),(6,11,2),(8,13,3),(5,21,14),(7,5,6),(15,17,5),(14,8,4),(21,7,9),(17,21,3),(12,14,21),(10,8,8),(2,8,3);
DELETE t1.*, t2.* FROM t1,t2 WHERE t1.a = t2.b AND t1.b > 10;
SELECT * FROM t1;
pk	a	b
1	1	1
10	28	3
11	8	3
13	14	2
16	7	9
19	8	3
2	9	4
5	5	6
8	8	8
9	13	5
SELECT * FROM t2;
pk	a	b
1	1	1
10	8	8
14	8	4
15	17	5
17	21	3
2	8	3
21	7	9
5	21	14
6	11	2
7	5	6
8	13	3
DELETE t1.*, t2.* FROM t1,t2 WHERE t1.a < t2.b AND t1.a >= 11 AND t2.b <= 15;
SELECT * FROM t1;
pk	a	b
1	1	1
10	28	3
11	8	3
13	14	2
16	7	9
19	8	3
2	9	4
5	5	6
8	8	8
SELECT * FROM t2;
pk	a	b
1	1	1
10	8	8
14	8	4
15	17	5
17	21	3
2	8	3
21	7	9
6	11	2
7	5	6
8	13	3
CREATE INDEX a ON t1(a);
CREATE INDEX b ON t1(b);
CREATE INDEX a ON t2(a);
CREATE INDEX b ON t2(b);
DELETE FROM t1;
DELETE FROM t2;
INSERT INTO t1 VALUES (1,1,1),(13,14,2),(11,8,3),(7,21,14),(5,5,6),(9,13,5),(2,9,4),(16,7,9),(10,28,3),(21,21,21),(8,8,8),(19,8,3);
INSERT INTO t2 VALUES (1,1,1),(6,11,2),(8,13,3),(5,21,14),(7,5,6),(15,17,5),(14,8,4),(21,7,9),(17,21,3),(12,14,21),(10,8,8),(2,8,3);
UPDATE t1 AS A, t2 AS B SET A.a = -1, B.b = -1 WHERE A.a = 9 AND B.b = 3;
SELECT * FROM t1;
pk	a	b
1	1	1
10	28	3
11	8	3
13	14	2
16	7	9
19	8	3
2	-1	4
21	21	21
5	5	6
7	21	14
8	8	8
9	13	5
SELECT * FROM t2;
pk	a	b
1	1	1
10	8	8
12	14	21
14	8	4
15	17	5
17	21	-1
2	8	-1
21	7	9
5	21	14
6	11	2
7	5	6
8	13	-1
UPDATE t1 AS A, t2 AS B SET A.a = -2, B.b = -2 WHERE A.a > 13 AND B.b <= 5;
SELECT * FROM t1;
pk	a	b
1	1	1
10	-2	3
11	8	3
13	-2	2
16	7	9
19	8	3
2	-1	4
21	-2	21
5	5	6
7	-2	14
8	8	8
9	13	5
SELECT * FROM t2;
pk	a	b
1	1	-2
10	8	8
12	14	21
14	8	-2
15	17	-2
17	21	-2
2	8	-2
21	7	9
5	21	14
6	11	-2
7	5	6
8	13	-2
UPDATE t1 AS A, t2 AS B SET A.a = -3, B.b = -3 WHERE A.a < 6 AND B.b >= 11;
SELECT * FROM t1;
pk	a	b
1	-3	1
10	-3	3
11	8	3
13	-3	2
16	7	9
19	8	3
2	-3	4
21	-3	21
5	-3	6
7	-3	14
8	8	8
9	13	5
SELECT * FROM t2;
pk	a	b
1	1	-2
10	8	8
12	14	-3
14	8	-2
15	17	-2
17	21	-2
2	8	-2
21	7	9
5	21	-3
6	11	-2
7	5	6
8	13	-2
UPDATE t1 AS A, t2 AS B SET A.a = -4, B.b = -4 WHERE A.a BETWEEN 6 AND 12;
SELECT * FROM t1;
pk	a	b
1	-3	1
10	-3	3
11	-4	3
13	-3	2
16	-4	9
19	-4	3
2	-3	4
21	-3	21
5	-3	6
7	-3	14
8	-4	8
9	13	5
SELECT * FROM t2;
pk	a	b
1	1	-4
10	8	-4
12	14	-4
14	8	-4
15	17	-4
17	21	-4
2	8	-4
21	7	-4
5	21	-4
6	11	-4
7	5	-4
8	13	-4
DELETE FROM t1;
DELETE FROM t2;
INSERT INTO t1 VALUES (1,1,1),(13,14,2),(11,8,3),(7,21,14),(5,5,6),(9,13,5),(2,9,4),(16,7,9),(10,28,3),(21,21,21),(8,8,8),(19,8,3);
INSERT INTO t2 VALUES (1,1,1),(6,11,2),(8,13,3),(5,21,14),(7,5,6),(15,17,5),(14,8,4),(21,7,9),(17,21,3),(12,14,21),(10,8,8),(2,8,3);
DELETE t1.*, t2.* FROM t1,t2 WHERE t1.a = t2.b AND t1.b > 10;
SELECT * FROM t1;
pk	a	b
1	1	1
10	28	3
11	8	3
13	14	2
16	7	9
19	8	3
2	9	4
5	5	6
8	8	8
9	13	5
SELECT * FROM t2;
pk	a	b
1	1	1
10	8	8
14	8	4
15	17	5
17	21	3
2	8	3
21	7	9
5	21	14
6	11	2
7	5	6
8	13	3
DELETE t1.*, t2.* FROM t1,t2 WHERE t1.a < t2.b AND t1.a >= 11 AND t2.b <= 15;
SELECT * FROM t1;
pk	a	b
1	1	1
10	28	3
11	8	3
13	14	2
16	7	9
19	8	3
2	9	4
5	5	6
8	8	8
SELECT * FROM t2;
pk	a	b
1	1	1
10	8	8
14	8	4
15	17	5
17	21	3
2	8	3
21	7	9
6	11	2
7	5	6
8	13	3
DROP TABLE t1,t2;
CREATE TABLE t1(a BINARY(127));
INSERT INTO t1 VALUES ("a"),("a "),("abcdefg"),("ABCD"),("hello"),(" HELLO"),(" string ");
SELECT * FROM t1;
a
a
TRUNCATE TABLE t1;
SELECT * FROM t1;
a
DROP TABLE t1;
CREATE TABLE t1 (a INT, b TEXT, c char(16));
INSERT INTO t1 VALUES (2,'abcd1e', 'testc1'),(5,'abcd2e','testc2'),(11,'helloworld','helloworld'),(3,'1234567','1234567'),(10,'ccccc','testc3'),(12,'string','string'),(9,'word','testc4'),(8,'xxyyzz','xxyyzz'),(1,'ABCD','ABCD'),(6,'abcd','testc5'),(15,'ABCD1e','testc6'),(4,'ABCD2e','ABCD2e'),(14,"11111","11111"),(7,"22222","22222"),(21,NULL,NULL);
SELECT * FROM t1 WHERE b = "abcd1e";
a	b	c
2	abcd1e	testc1
SELECT a,b FROM t1 WHERE b <=> "abcd2e";
a	b
5	abcd2e
SELECT a,b,c FROM t1 WHERE b < "abcd" ORDER BY b DESC;
a	b	c
7	22222	22222
3	1234567	1234567
14	11111	11111
SELECT * FROM t1 WHERE b <= "ccccc";
a	b	c
1	ABCD	ABCD
10	ccccc	testc3
14	11111	11111
15	ABCD1e	testc6
2	abcd1e	testc1
3	1234567	1234567
4	ABCD2e	ABCD2e
5	abcd2e	testc2
6	abcd	testc5
7	22222	22222
SELECT * FROM t1 WHERE b > "abcde";
a	b	c
10	ccccc	testc3
11	helloworld	helloworld
12	string	string
8	xxyyzz	xxyyzz
9	word	testc4
SELECT * FROM t1 WHERE b >= "ABCD1e" ORDER BY b LIMIT 7;
a	b	c
2	abcd1e	testc1
15	ABCD1e	testc6
5	abcd2e	testc2
4	ABCD2e	ABCD2e
10	ccccc	testc3
11	helloworld	helloworld
12	string	string
SELECT a FROM t1 WHERE b BETWEEN "abcd1e" AND "xxyyzz" ORDER BY a DESC LIMIT 7;
a
12
11
10
9
8
5
2
SELECT b FROM t1 WHERE b IN ("word", "ABCD", "ABCD2e", "string", "helloworld", "11111", "1234567");
b
11111
1234567
ABCD
ABCD2e
helloworld
string
word
SELECT c FROM t1 WHERE b NOT IN ("abcd", "22222", "11111");
c
1234567
ABCD2e
helloworld
string
testc1
testc2
testc3
testc4
testc6
xxyyzz
SELECT * FROM t1 WHERE b LIKE "abc%";
a	b	c
2	abcd1e	testc1
5	abcd2e	testc2
6	abcd	testc5
SELECT * FROM t1 WHERE b REGEXP "1";
a	b	c
14	11111	11111
15	ABCD1e	testc6
2	abcd1e	testc1
3	1234567	1234567
SELECT * FROM t1 WHERE b != "abcd2e";
a	b	c
1	ABCD	ABCD
10	ccccc	testc3
11	helloworld	helloworld
12	string	string
14	11111	11111
15	ABCD1e	testc6
2	abcd1e	testc1
3	1234567	1234567
6	abcd	testc5
7	22222	22222
8	xxyyzz	xxyyzz
9	word	testc4
SELECT * FROM t1 WHERE b <> "ABCD";
a	b	c
10	ccccc	testc3
11	helloworld	helloworld
12	string	string
14	11111	11111
15	ABCD1e	testc6
2	abcd1e	testc1
3	1234567	1234567
4	ABCD2e	ABCD2e
5	abcd2e	testc2
7	22222	22222
8	xxyyzz	xxyyzz
9	word	testc4
SELECT b,c FROM t1 WHERE b = c;
b	c
11111	11111
1234567	1234567
22222	22222
ABCD	ABCD
ABCD2e	ABCD2e
helloworld	helloworld
string	string
xxyyzz	xxyyzz
SELECT a FROM t1 WHERE b IS NULL;
a
21
SELECT * FROM t1 WHERE b > "abcd1e" AND c <= "testc4";
a	b	c
10	ccccc	testc3
11	helloworld	helloworld
12	string	string
5	abcd2e	testc2
9	word	testc4
SELECT * FROM t1 WHERE b < "string" AND c >= "testc1";
a	b	c
10	ccccc	testc3
15	ABCD1e	testc6
2	abcd1e	testc1
5	abcd2e	testc2
6	abcd	testc5
SELECT * FROM t1 WHERE b <= "string" OR c > "testc5";
a	b	c
1	ABCD	ABCD
10	ccccc	testc3
11	helloworld	helloworld
12	string	string
14	11111	11111
15	ABCD1e	testc6
2	abcd1e	testc1
3	1234567	1234567
4	ABCD2e	ABCD2e
5	abcd2e	testc2
6	abcd	testc5
7	22222	22222
8	xxyyzz	xxyyzz
SELECT * FROM t1 WHERE b > "abcdefg" OR c < "testc11";
a	b	c
1	ABCD	ABCD
10	ccccc	testc3
11	helloworld	helloworld
12	string	string
14	11111	11111
2	abcd1e	testc1
3	1234567	1234567
4	ABCD2e	ABCD2e
7	22222	22222
8	xxyyzz	xxyyzz
9	word	testc4
SELECT * FROM t1 WHERE NOT b <= "abcd";
a	b	c
10	ccccc	testc3
11	helloworld	helloworld
12	string	string
2	abcd1e	testc1
5	abcd2e	testc2
8	xxyyzz	xxyyzz
9	word	testc4
SELECT * FROM t1 WHERE NOT b > "11111" OR c < "testc3";
a	b	c
1	ABCD	ABCD
11	helloworld	helloworld
12	string	string
14	11111	11111
2	abcd1e	testc1
3	1234567	1234567
4	ABCD2e	ABCD2e
5	abcd2e	testc2
7	22222	22222
CREATE INDEX b ON t1(b(3));
SELECT * FROM t1 WHERE b = "abcd1e";
a	b	c
2	abcd1e	testc1
SELECT a,b FROM t1 WHERE b <=> "abcd2e";
a	b
5	abcd2e
SELECT a,b,c FROM t1 WHERE b < "abcd" ORDER BY b DESC;
a	b	c
7	22222	22222
3	1234567	1234567
14	11111	11111
SELECT * FROM t1 WHERE b <= "ccccc";
a	b	c
1	ABCD	ABCD
10	ccccc	testc3
14	11111	11111
15	ABCD1e	testc6
2	abcd1e	testc1
3	1234567	1234567
4	ABCD2e	ABCD2e
5	abcd2e	testc2
6	abcd	testc5
7	22222	22222
SELECT * FROM t1 WHERE b > "abcde";
a	b	c
10	ccccc	testc3
11	helloworld	helloworld
12	string	string
8	xxyyzz	xxyyzz
9	word	testc4
SELECT * FROM t1 WHERE b >= "ABCD1e" ORDER BY b LIMIT 7;
a	b	c
2	abcd1e	testc1
15	ABCD1e	testc6
5	abcd2e	testc2
4	ABCD2e	ABCD2e
10	ccccc	testc3
11	helloworld	helloworld
12	string	string
SELECT a FROM t1 WHERE b BETWEEN "abcd1e" AND "xxyyzz" ORDER BY a DESC LIMIT 7;
a
12
11
10
9
8
5
2
SELECT b FROM t1 WHERE b IN ("word", "ABCD", "ABCD2e", "string", "helloworld", "11111", "1234567");
b
11111
1234567
ABCD
ABCD2e
helloworld
string
word
SELECT c FROM t1 WHERE b NOT IN ("abcd", "22222", "11111");
c
1234567
ABCD2e
helloworld
string
testc1
testc2
testc3
testc4
testc6
xxyyzz
SELECT * FROM t1 WHERE b LIKE "abc%";
a	b	c
2	abcd1e	testc1
5	abcd2e	testc2
6	abcd	testc5
SELECT * FROM t1 WHERE b REGEXP "1";
a	b	c
14	11111	11111
15	ABCD1e	testc6
2	abcd1e	testc1
3	1234567	1234567
SELECT * FROM t1 WHERE b != "abcd2e";
a	b	c
1	ABCD	ABCD
10	ccccc	testc3
11	helloworld	helloworld
12	string	string
14	11111	11111
15	ABCD1e	testc6
2	abcd1e	testc1
3	1234567	1234567
6	abcd	testc5
7	22222	22222
8	xxyyzz	xxyyzz
9	word	testc4
SELECT * FROM t1 WHERE b <> "ABCD";
a	b	c
10	ccccc	testc3
11	helloworld	helloworld
12	string	string
14	11111	11111
15	ABCD1e	testc6
2	abcd1e	testc1
3	1234567	1234567
4	ABCD2e	ABCD2e
5	abcd2e	testc2
7	22222	22222
8	xxyyzz	xxyyzz
9	word	testc4
SELECT b,c FROM t1 WHERE b = c;
b	c
11111	11111
1234567	1234567
22222	22222
ABCD	ABCD
ABCD2e	ABCD2e
helloworld	helloworld
string	string
xxyyzz	xxyyzz
SELECT a FROM t1 WHERE b IS NULL;
a
21
SELECT * FROM t1 WHERE b > "abcd1e" AND c <= "testc4";
a	b	c
10	ccccc	testc3
11	helloworld	helloworld
12	string	string
5	abcd2e	testc2
9	word	testc4
SELECT * FROM t1 WHERE b < "string" AND c >= "testc1";
a	b	c
10	ccccc	testc3
15	ABCD1e	testc6
2	abcd1e	testc1
5	abcd2e	testc2
6	abcd	testc5
SELECT * FROM t1 WHERE b <= "string" OR c > "testc5";
a	b	c
1	ABCD	ABCD
10	ccccc	testc3
11	helloworld	helloworld
12	string	string
14	11111	11111
15	ABCD1e	testc6
2	abcd1e	testc1
3	1234567	1234567
4	ABCD2e	ABCD2e
5	abcd2e	testc2
6	abcd	testc5
7	22222	22222
8	xxyyzz	xxyyzz
SELECT * FROM t1 WHERE b > "abcdefg" OR c < "testc11";
a	b	c
1	ABCD	ABCD
10	ccccc	testc3
11	helloworld	helloworld
12	string	string
14	11111	11111
2	abcd1e	testc1
3	1234567	1234567
4	ABCD2e	ABCD2e
7	22222	22222
8	xxyyzz	xxyyzz
9	word	testc4
SELECT * FROM t1 WHERE NOT b <= "abcd";
a	b	c
10	ccccc	testc3
11	helloworld	helloworld
12	string	string
2	abcd1e	testc1
5	abcd2e	testc2
8	xxyyzz	xxyyzz
9	word	testc4
SELECT * FROM t1 WHERE NOT b > "11111" OR c < "testc3";
a	b	c
1	ABCD	ABCD
11	helloworld	helloworld
12	string	string
14	11111	11111
2	abcd1e	testc1
3	1234567	1234567
4	ABCD2e	ABCD2e
5	abcd2e	testc2
7	22222	22222
DROP TABLE t1;
CREATE TABLE t1 (a SMALLINT NOT NULL, b MEDIUMINT NOT NULL);
INSERT INTO t1 (a,b) VALUES (1,36),(8,11),(3,5),(6,9),(4,10),(9,1),(2,12),(7,18),(5,2),(10,0);
SELECT COUNT(a) FROM t1 WHERE a > 3;
COUNT(a)
7
SELECT AVG(b) FROM t1 WHERE a >= 2;
AVG(b)
7.5556
SELECT MAX(a) FROM t1 WHERE a < 10;
MAX(a)
9
SELECT MIN(b) FROM t1 WHERE a != 1;
MIN(b)
0
SELECT SUM(a) FROM t1 WHERE a IS NOT NULL;
SUM(a)
55
SELECT CONCAT(a,b) AS ab FROM t1 WHERE a IS NOT NULL AND b IS NOT NULL;
ab
100
136
212
35
410
52
69
718
811
91
CREATE INDEX a ON t1(a);
CREATE INDEX b ON t1(b);
SELECT COUNT(a) FROM t1 WHERE a > 3;
COUNT(a)
7
SELECT AVG(b) FROM t1 WHERE a >= 2;
AVG(b)
7.5556
SELECT MAX(a) FROM t1 WHERE a < 10;
MAX(a)
9
SELECT MIN(b) FROM t1 WHERE a != 1;
MIN(b)
0
SELECT SUM(a) FROM t1 WHERE a IS NOT NULL;
SUM(a)
55
SELECT CONCAT(a,b) AS ab FROM t1 WHERE a IS NOT NULL AND b IS NOT NULL;
ab
100
136
212
35
410
52
69
718
811
91
DROP TABLE t1;
CREATE TABLE t1 (a CHAR(64), b BIT(8));
INSERT INTO t1 VALUES ('one', 94),(NULL, 31),('two', 61),('four', 78),('hello', 88),('abcdefg', 122),('abc', 0),('monty', 9),('www.sequoiadb.com', 107),(' 123', 11),('456 ', 23),(' 789 ', 34), (' 01', 34), ('VVV', 1);
SELECT a,b FROM t1 WHERE BIT_LENGTH(b) > 6;
a	b

 01	"
 123	
 789	"
456	
NULL	
VVV	
abc	
abcdefg	z
four	N
hello	X
monty		
one	^
two	=
www.sequoiadb.com	k
SELECT * FROM t1 WHERE CHAR_LENGTH(a) <= 4 ;
a	b

 01	"
 123	
 789	"
456	
VVV	
abc	
four	N
one	^
two	=
SELECT * FROM t1 WHERE LENGTH(a) != 3 ;
a	b
 123	
 789	"
abcdefg	z
four	N
hello	X
monty		
www.sequoiadb.com	k
SELECT * FROM t1 WHERE CHAR(ASCII(a)) = 'a' OR ORD(a) = 't' ;
a	b

Warning	1292	Truncated incorrect DOUBLE value: 't'
Warnings:
abc	
abcdefg	z
SELECT * FROM t1 WHERE HEX(b) >= '4D';
a	b
 123	
abcdefg	z
four	N
hello	X
monty		
one	^
www.sequoiadb.com	k
SELECT * FROM t1 WHERE LOCATE(a, "abc") > 0 OR LOCATE(a, "hel") IS NULL;
a	b

NULL	
abc	
SELECT * FROM t1 WHERE INSTR(a, "o") > 1;
a	b
four	N
hello	X
monty		
two	=
www.sequoiadb.com	k
SELECT * FROM t1 WHERE POSITION('b' IN a) < 5;
a	b

 01	"
 123	
 789	"
456	
VVV	
abc	
abcdefg	z
four	N
hello	X
monty		
one	^
two	=
SELECT * FROM t1 WHERE a <= LCASE('h') AND a >= UCASE('t');
a	b
SELECT * FROM t1 WHERE SUBSTRING(a,1,2) <> 'bc' AND MID(a,2,1) < 'o';
a	b

 01	"
 123	
 789	"
456	
abc	
abcdefg	z
hello	X
one	^
SELECT a,b FROM t1 WHERE LTRIM(a) <= 'four' and RTRIM(a) >= '456';
a	b

456	
abc	
abcdefg	z
four	N
SELECT * FROM t1 WHERE a > REPEAT('g',10);
a	b
hello	X
monty		
one	^
two	=
www.sequoiadb.com	k
SELECT * FROM t1 WHERE a > CONCAT_WS('com','.','sequoiadb');
a	b

456	
VVV	
abc	
abcdefg	z
four	N
hello	X
monty		
one	^
two	=
www.sequoiadb.com	k
SELECT DISTINCT a FROM t1 WHERE ELT(a, 'ab') IS NOT NULL;
a
 01
Warning	1292	Truncated incorrect INTEGER value: 'VVV                                                             '
Warning	1292	Truncated incorrect INTEGER value: 'ab'
Warning	1292	Truncated incorrect INTEGER value: 'abc                                                             '
Warning	1292	Truncated incorrect INTEGER value: 'abcdefg                                                         '
Warning	1292	Truncated incorrect INTEGER value: 'four                                                            '
Warning	1292	Truncated incorrect INTEGER value: 'hello                                                           '
Warning	1292	Truncated incorrect INTEGER value: 'monty                                                           '
Warning	1292	Truncated incorrect INTEGER value: 'one                                                             '
Warning	1292	Truncated incorrect INTEGER value: 'two                                                             '
Warning	1292	Truncated incorrect INTEGER value: 'www.sequoiadb.com                                               '
Warnings:
SELECT a FROM t1 WHERE FIELD(a, "abc","abcdefg","hello") > 0;
a
abc
abcdefg
hello
SELECT a,b FROM t1 WHERE FIND_IN_SET(a, 'abc') > 0;
a	b

abc	
SELECT * FROM t1 WHERE INSTR(a, 'o') > 0;
a	b
four	N
hello	X
monty		
one	^
two	=
www.sequoiadb.com	k
SELECT a FROM t1 WHERE a != INSERT('axdefg',2,1,'bc');
a
 01
 123
 789
456
VVV
abc
four
hello
monty
one
two
www.sequoiadb.com
SELECT a,b FROM t1 WHERE a > REPLACE('hello','hel','ol');
a	b
one	^
two	=
www.sequoiadb.com	k
SELECT * FROM t1 WHERE a < REVERSE('com');
a	b

 01	"
 123	
 789	"
456	
abc	
abcdefg	z
four	N
hello	X
SELECT * FROM t1 WHERE a > RPAD('abcd',3,'12') AND a < LPAD('helxy', 3 , 2);
a	b
abcdefg	z
four	N
SELECT * FROM t1 WHERE a >= MAKE_SET(7,'a','b','c');
a	b

abc	
abcdefg	z
four	N
hello	X
monty		
one	^
two	=
www.sequoiadb.com	k
SELECT * FROM t1 WHERE b < OCT(56);
a	b

 01	"
 123	
 789	"
456	
NULL	
VVV	
abc	
monty		
two	=
CREATE INDEX a ON t1(a);
CREATE INDEX b ON t1(b);
SELECT a,b FROM t1 WHERE BIT_LENGTH(b) > 6;
a	b

 01	"
 123	
 789	"
456	
NULL	
VVV	
abc	
abcdefg	z
four	N
hello	X
monty		
one	^
two	=
www.sequoiadb.com	k
SELECT * FROM t1 WHERE CHAR_LENGTH(a) <= 4 ;
a	b

 01	"
 123	
 789	"
456	
VVV	
abc	
four	N
one	^
two	=
SELECT * FROM t1 WHERE LENGTH(a) != 3 ;
a	b
 123	
 789	"
abcdefg	z
four	N
hello	X
monty		
www.sequoiadb.com	k
SELECT * FROM t1 WHERE CHAR(ASCII(a)) = 'a' OR ORD(a) = 't' ;
a	b

Warning	1292	Truncated incorrect DOUBLE value: 't'
Warnings:
abc	
abcdefg	z
SELECT * FROM t1 WHERE HEX(b) >= '4D';
a	b
 123	
abcdefg	z
four	N
hello	X
monty		
one	^
www.sequoiadb.com	k
SELECT * FROM t1 WHERE LOCATE(a, "abc") > 0 OR LOCATE(a, "hel") IS NULL;
a	b

NULL	
abc	
SELECT * FROM t1 WHERE INSTR(a, "o") > 1;
a	b
four	N
hello	X
monty		
two	=
www.sequoiadb.com	k
SELECT * FROM t1 WHERE POSITION('b' IN a) < 5;
a	b

 01	"
 123	
 789	"
456	
VVV	
abc	
abcdefg	z
four	N
hello	X
monty		
one	^
two	=
SELECT * FROM t1 WHERE a <= LCASE('h') AND a >= UCASE('t');
a	b
SELECT * FROM t1 WHERE SUBSTRING(a,1,2) <> 'bc' AND MID(a,2,1) < 'o';
a	b

 01	"
 123	
 789	"
456	
abc	
abcdefg	z
hello	X
one	^
SELECT a,b FROM t1 WHERE LTRIM(a) <= 'four' and RTRIM(a) >= '456';
a	b

456	
abc	
abcdefg	z
four	N
SELECT * FROM t1 WHERE a > REPEAT('g',10);
a	b
hello	X
monty		
one	^
two	=
www.sequoiadb.com	k
SELECT * FROM t1 WHERE a > CONCAT_WS('com','.','sequoiadb');
a	b

456	
VVV	
abc	
abcdefg	z
four	N
hello	X
monty		
one	^
two	=
www.sequoiadb.com	k
SELECT DISTINCT a FROM t1 WHERE ELT(a, 'ab') IS NOT NULL;
a
 01
Warning	1292	Truncated incorrect INTEGER value: 'VVV                                                             '
Warning	1292	Truncated incorrect INTEGER value: 'ab'
Warning	1292	Truncated incorrect INTEGER value: 'abc                                                             '
Warning	1292	Truncated incorrect INTEGER value: 'abcdefg                                                         '
Warning	1292	Truncated incorrect INTEGER value: 'four                                                            '
Warning	1292	Truncated incorrect INTEGER value: 'hello                                                           '
Warning	1292	Truncated incorrect INTEGER value: 'monty                                                           '
Warning	1292	Truncated incorrect INTEGER value: 'one                                                             '
Warning	1292	Truncated incorrect INTEGER value: 'two                                                             '
Warning	1292	Truncated incorrect INTEGER value: 'www.sequoiadb.com                                               '
Warnings:
SELECT a FROM t1 WHERE FIELD(a, "abc","abcdefg","hello") > 0;
a
abc
abcdefg
hello
SELECT a,b FROM t1 WHERE FIND_IN_SET(a, 'abc') > 0;
a	b

abc	
SELECT * FROM t1 WHERE INSTR(a, 'o') > 0;
a	b
four	N
hello	X
monty		
one	^
two	=
www.sequoiadb.com	k
SELECT a,b FROM t1 WHERE a > REPLACE('hello','hel','ol');
a	b
one	^
two	=
www.sequoiadb.com	k
SELECT * FROM t1 WHERE a > RPAD('abcd',3,'12') AND a < LPAD('helxy', 3 , 2);
a	b
abcdefg	z
four	N
SELECT * FROM t1 WHERE a >= MAKE_SET(7,'a','b','c');
a	b

abc	
abcdefg	z
four	N
hello	X
monty		
one	^
two	=
www.sequoiadb.com	k
SELECT * FROM t1 WHERE b < OCT(56);
a	b

 01	"
 123	
 789	"
456	
NULL	
VVV	
abc	
monty		
two	=
DROP TABLE t1;
CREATE TABLE t1 (d DATE, dt DATETIME, t TIMESTAMP, tm time);
INSERT INTO t1 VALUES ("2000-02-05", "2002-10-21 00:00:00", "1994-03-02 10:11:12", "09:00:00"),("2002-12-31", "2002-10-28 00:00:00", "1997-01-02 03:04:05", "13:00:00"),("2003-03-01", "2002-11-04 00:00:00", "1999-04-02 00:00:00", "19:38:34"),("2001-01-01", "2003-10-29 16:51:06", "1998-12-31 23:59:59", "12:30:35"),("1997-12-01", "2004-11-05 16:47:31", "2000-12-31 23:59:59", "20:33:34"),("1999-11-30", "2011-01-20 01:00:00", "2001-01-01 00:00:00", "100:55:50"),("2007-08-01", "2038-01-19 12:14:07", "2010-02-01 09:31:01", "300:55:50"),("2006-01-01", "2020-01-13 19:12:17", "2010-02-01 09:31:04", "-24:00:00"),("2005-05-05", "1999-03-14 02:17:27", "2008-02-23 09:23:45", "24:00:00"),("2010-07-15", "2001-06-06 01:01:01", "2010-03-05 11:08:02", "48:00:00"),("2019-01-01", "2008-09-19 07:13:16", "2011-01-06 12:34:30", "-48:00:00");
SELECT * FROM t1 WHERE d > DATE_FORMAT(dt, "%Y-%m-%d");
d	dt	t	tm
2002-12-31	2002-10-28 00:00:00	1997-01-02 03:04:05	13:00:00
2003-03-01	2002-11-04 00:00:00	1999-04-02 00:00:00	19:38:34
2005-05-05	1999-03-14 02:17:27	2008-02-23 09:23:45	24:00:00
2010-07-15	2001-06-06 01:01:01	2010-03-05 11:08:02	48:00:00
2019-01-01	2008-09-19 07:13:16	2011-01-06 12:34:30	-48:00:00
SELECT d,dt,tm FROM t1 WHERE TIME_FORMAT(tm, '%H') >= 20;
d	dt	tm
1997-12-01	2004-11-05 16:47:31	20:33:34
1999-11-30	2011-01-20 01:00:00	100:55:50
2005-05-05	1999-03-14 02:17:27	24:00:00
2007-08-01	2038-01-19 12:14:07	300:55:50
2010-07-15	2001-06-06 01:01:01	48:00:00
SELECT d,tm FROM t1 WHERE tm < SEC_TO_TIME('837:59:59');
d	tm
2006-01-01	-24:00:00
2019-01-01	-48:00:00
SELECT t,tm FROM t1 WHERE TIME_TO_SEC(tm) > 100000;
t	tm
2001-01-01 00:00:00	100:55:50
2010-02-01 09:31:01	300:55:50
2010-03-05 11:08:02	48:00:00
SELECT * FROM t1 WHERE dt <= DATE_ADD(t, INTERVAL 1 SECOND);
d	dt	t	tm
2005-05-05	1999-03-14 02:17:27	2008-02-23 09:23:45	24:00:00
2010-07-15	2001-06-06 01:01:01	2010-03-05 11:08:02	48:00:00
2019-01-01	2008-09-19 07:13:16	2011-01-06 12:34:30	-48:00:00
SELECT * FROM t1 WHERE t <= DATE_SUB(dt, INTERVAL 1 SECOND);
d	dt	t	tm
1997-12-01	2004-11-05 16:47:31	2000-12-31 23:59:59	20:33:34
1999-11-30	2011-01-20 01:00:00	2001-01-01 00:00:00	100:55:50
2000-02-05	2002-10-21 00:00:00	1994-03-02 10:11:12	09:00:00
2001-01-01	2003-10-29 16:51:06	1998-12-31 23:59:59	12:30:35
2002-12-31	2002-10-28 00:00:00	1997-01-02 03:04:05	13:00:00
2003-03-01	2002-11-04 00:00:00	1999-04-02 00:00:00	19:38:34
2006-01-01	2020-01-13 19:12:17	2010-02-01 09:31:04	-24:00:00
2007-08-01	2038-01-19 12:14:07	2010-02-01 09:31:01	300:55:50
SELECT * FROM t1 WHERE EXTRACT(DAY FROM d) > 2;
d	dt	t	tm
1999-11-30	2011-01-20 01:00:00	2001-01-01 00:00:00	100:55:50
2000-02-05	2002-10-21 00:00:00	1994-03-02 10:11:12	09:00:00
2002-12-31	2002-10-28 00:00:00	1997-01-02 03:04:05	13:00:00
2005-05-05	1999-03-14 02:17:27	2008-02-23 09:23:45	24:00:00
2010-07-15	2001-06-06 01:01:01	2010-03-05 11:08:02	48:00:00
SELECT * FROM t1 WHERE DAYNAME(d) > 'Saturday';
d	dt	t	tm
1999-11-30	2011-01-20 01:00:00	2001-01-01 00:00:00	100:55:50
2002-12-31	2002-10-28 00:00:00	1997-01-02 03:04:05	13:00:00
2005-05-05	1999-03-14 02:17:27	2008-02-23 09:23:45	24:00:00
2006-01-01	2020-01-13 19:12:17	2010-02-01 09:31:04	-24:00:00
2007-08-01	2038-01-19 12:14:07	2010-02-01 09:31:01	300:55:50
2010-07-15	2001-06-06 01:01:01	2010-03-05 11:08:02	48:00:00
2019-01-01	2008-09-19 07:13:16	2011-01-06 12:34:30	-48:00:00
SELECT * FROM t1 WHERE MONTHNAME(dt) > 'March';
d	dt	t	tm
1997-12-01	2004-11-05 16:47:31	2000-12-31 23:59:59	20:33:34
2000-02-05	2002-10-21 00:00:00	1994-03-02 10:11:12	09:00:00
2001-01-01	2003-10-29 16:51:06	1998-12-31 23:59:59	12:30:35
2002-12-31	2002-10-28 00:00:00	1997-01-02 03:04:05	13:00:00
2003-03-01	2002-11-04 00:00:00	1999-04-02 00:00:00	19:38:34
2019-01-01	2008-09-19 07:13:16	2011-01-06 12:34:30	-48:00:00
SELECT d,dt,t FROM t1 WHERE DAYOFYEAR(t) > 60;
d	dt	t
1997-12-01	2004-11-05 16:47:31	2000-12-31 23:59:59
2000-02-05	2002-10-21 00:00:00	1994-03-02 10:11:12
2001-01-01	2003-10-29 16:51:06	1998-12-31 23:59:59
2003-03-01	2002-11-04 00:00:00	1999-04-02 00:00:00
2010-07-15	2001-06-06 01:01:01	2010-03-05 11:08:02
SELECT dt,t,tm FROM t1 WHERE DAYOFMONTH(t) > 20;
dt	t	tm
1999-03-14 02:17:27	2008-02-23 09:23:45	24:00:00
2003-10-29 16:51:06	1998-12-31 23:59:59	12:30:35
2004-11-05 16:47:31	2000-12-31 23:59:59	20:33:34
SELECT * FROM t1 WHERE WEEK(d) < 30;
d	dt	t	tm
2000-02-05	2002-10-21 00:00:00	1994-03-02 10:11:12	09:00:00
2001-01-01	2003-10-29 16:51:06	1998-12-31 23:59:59	12:30:35
2003-03-01	2002-11-04 00:00:00	1999-04-02 00:00:00	19:38:34
2005-05-05	1999-03-14 02:17:27	2008-02-23 09:23:45	24:00:00
2006-01-01	2020-01-13 19:12:17	2010-02-01 09:31:04	-24:00:00
2010-07-15	2001-06-06 01:01:01	2010-03-05 11:08:02	48:00:00
2019-01-01	2008-09-19 07:13:16	2011-01-06 12:34:30	-48:00:00
SELECT * FROM t1 WHERE WEEKOFYEAR(dt) != 45 AND WEEKDAY(t) <= 3;
d	dt	t	tm
1999-11-30	2011-01-20 01:00:00	2001-01-01 00:00:00	100:55:50
2000-02-05	2002-10-21 00:00:00	1994-03-02 10:11:12	09:00:00
2001-01-01	2003-10-29 16:51:06	1998-12-31 23:59:59	12:30:35
2002-12-31	2002-10-28 00:00:00	1997-01-02 03:04:05	13:00:00
2006-01-01	2020-01-13 19:12:17	2010-02-01 09:31:04	-24:00:00
2007-08-01	2038-01-19 12:14:07	2010-02-01 09:31:01	300:55:50
2019-01-01	2008-09-19 07:13:16	2011-01-06 12:34:30	-48:00:00
SELECT * FROM t1 WHERE MONTH(d) > 2 AND WEEK(dt) < 50 AND YEAR(t) != 2010;
d	dt	t	tm
1997-12-01	2004-11-05 16:47:31	2000-12-31 23:59:59	20:33:34
1999-11-30	2011-01-20 01:00:00	2001-01-01 00:00:00	100:55:50
2002-12-31	2002-10-28 00:00:00	1997-01-02 03:04:05	13:00:00
2003-03-01	2002-11-04 00:00:00	1999-04-02 00:00:00	19:38:34
2005-05-05	1999-03-14 02:17:27	2008-02-23 09:23:45	24:00:00
SELECT * FROM t1 WHERE YEARWEEK(d) > 200201 AND HOUR(t) < 20 AND QUARTER(dt) <> 1;
d	dt	t	tm
2002-12-31	2002-10-28 00:00:00	1997-01-02 03:04:05	13:00:00
2003-03-01	2002-11-04 00:00:00	1999-04-02 00:00:00	19:38:34
2010-07-15	2001-06-06 01:01:01	2010-03-05 11:08:02	48:00:00
2019-01-01	2008-09-19 07:13:16	2011-01-06 12:34:30	-48:00:00
SELECT * FROM t1 WHERE TO_DAYS(t) <= 731516;
d	dt	t	tm
1997-12-01	2004-11-05 16:47:31	2000-12-31 23:59:59	20:33:34
1999-11-30	2011-01-20 01:00:00	2001-01-01 00:00:00	100:55:50
2000-02-05	2002-10-21 00:00:00	1994-03-02 10:11:12	09:00:00
2001-01-01	2003-10-29 16:51:06	1998-12-31 23:59:59	12:30:35
2002-12-31	2002-10-28 00:00:00	1997-01-02 03:04:05	13:00:00
2003-03-01	2002-11-04 00:00:00	1999-04-02 00:00:00	19:38:34
SELECT * FROM t1 WHERE UNIX_TIMESTAMP(t) > 1000000000;
d	dt	t	tm
2005-05-05	1999-03-14 02:17:27	2008-02-23 09:23:45	24:00:00
2006-01-01	2020-01-13 19:12:17	2010-02-01 09:31:04	-24:00:00
2007-08-01	2038-01-19 12:14:07	2010-02-01 09:31:01	300:55:50
2010-07-15	2001-06-06 01:01:01	2010-03-05 11:08:02	48:00:00
2019-01-01	2008-09-19 07:13:16	2011-01-06 12:34:30	-48:00:00
SELECT * FROM t1 WHERE t < FROM_UNIXTIME(950000000);
d	dt	t	tm
2000-02-05	2002-10-21 00:00:00	1994-03-02 10:11:12	09:00:00
2001-01-01	2003-10-29 16:51:06	1998-12-31 23:59:59	12:30:35
2002-12-31	2002-10-28 00:00:00	1997-01-02 03:04:05	13:00:00
2003-03-01	2002-11-04 00:00:00	1999-04-02 00:00:00	19:38:34
SELECT d,t FROM t1 WHERE t >= TIMESTAMPADD(HOUR,8820,d);
d	t
1997-12-01	2000-12-31 23:59:59
1999-11-30	2001-01-01 00:00:00
2005-05-05	2008-02-23 09:23:45
2006-01-01	2010-02-01 09:31:04
2007-08-01	2010-02-01 09:31:01
SELECT * FROM t1 WHERE TIMESTAMPDIFF(day,dt,t) > 0;
d	dt	t	tm
2005-05-05	1999-03-14 02:17:27	2008-02-23 09:23:45	24:00:00
2010-07-15	2001-06-06 01:01:01	2010-03-05 11:08:02	48:00:00
2019-01-01	2008-09-19 07:13:16	2011-01-06 12:34:30	-48:00:00
SELECT * FROM t1 WHERE LAST_DAY(d) < "2005-12-31" AND FROM_DAYS(TO_DAYS(t)) > "1999-12-01";
d	dt	t	tm
1997-12-01	2004-11-05 16:47:31	2000-12-31 23:59:59	20:33:34
1999-11-30	2011-01-20 01:00:00	2001-01-01 00:00:00	100:55:50
2005-05-05	1999-03-14 02:17:27	2008-02-23 09:23:45	24:00:00
SELECT * FROM t1 WHERE t < LOCALTIMESTAMP() AND t <> UTC_TIMESTAMP();
d	dt	t	tm
1997-12-01	2004-11-05 16:47:31	2000-12-31 23:59:59	20:33:34
1999-11-30	2011-01-20 01:00:00	2001-01-01 00:00:00	100:55:50
2000-02-05	2002-10-21 00:00:00	1994-03-02 10:11:12	09:00:00
2001-01-01	2003-10-29 16:51:06	1998-12-31 23:59:59	12:30:35
2002-12-31	2002-10-28 00:00:00	1997-01-02 03:04:05	13:00:00
2003-03-01	2002-11-04 00:00:00	1999-04-02 00:00:00	19:38:34
2005-05-05	1999-03-14 02:17:27	2008-02-23 09:23:45	24:00:00
2006-01-01	2020-01-13 19:12:17	2010-02-01 09:31:04	-24:00:00
2007-08-01	2038-01-19 12:14:07	2010-02-01 09:31:01	300:55:50
2010-07-15	2001-06-06 01:01:01	2010-03-05 11:08:02	48:00:00
2019-01-01	2008-09-19 07:13:16	2011-01-06 12:34:30	-48:00:00
SELECT * FROM t1 WHERE MONTHNAME(STR_TO_DATE(d,'%Y-%m-%d')) >= 'March';
d	dt	t	tm
1999-11-30	2011-01-20 01:00:00	2001-01-01 00:00:00	100:55:50
2003-03-01	2002-11-04 00:00:00	1999-04-02 00:00:00	19:38:34
2005-05-05	1999-03-14 02:17:27	2008-02-23 09:23:45	24:00:00
SELECT * FROM t1 WHERE DATE(d) BETWEEN CAST("2003-1-1" as DATE) AND CAST("2008-12-1" as DATE);
d	dt	t	tm
2003-03-01	2002-11-04 00:00:00	1999-04-02 00:00:00	19:38:34
2005-05-05	1999-03-14 02:17:27	2008-02-23 09:23:45	24:00:00
2006-01-01	2020-01-13 19:12:17	2010-02-01 09:31:04	-24:00:00
2007-08-01	2038-01-19 12:14:07	2010-02-01 09:31:01	300:55:50
SELECT * FROM t1 WHERE MAKEDATE(2002,1) BETWEEN DATE(d) AND DATE(dt);
d	dt	t	tm
1997-12-01	2004-11-05 16:47:31	2000-12-31 23:59:59	20:33:34
1999-11-30	2011-01-20 01:00:00	2001-01-01 00:00:00	100:55:50
2000-02-05	2002-10-21 00:00:00	1994-03-02 10:11:12	09:00:00
2001-01-01	2003-10-29 16:51:06	1998-12-31 23:59:59	12:30:35
SELECT d,dt,tm FROM t1 WHERE ADDTIME(tm, '20:40:00') > '40:00:00' AND SUBTIME(tm, '30:23:00') < '-80:00:00';
d	dt	tm
1997-12-01	2004-11-05 16:47:31	20:33:34
2003-03-01	2002-11-04 00:00:00	19:38:34
2005-05-05	1999-03-14 02:17:27	24:00:00
SELECT * FROM t1 WHERE tm > MAKETIME(30,25,7);
d	dt	t	tm
1999-11-30	2011-01-20 01:00:00	2001-01-01 00:00:00	100:55:50
2007-08-01	2038-01-19 12:14:07	2010-02-01 09:31:01	300:55:50
2010-07-15	2001-06-06 01:01:01	2010-03-05 11:08:02	48:00:00
SELECT d,dt,t,tm FROM t1 WHERE d <= NOW(6) AND dt  < SUBTIME(CURRENT_TIME(2), '1 1:1:1.000002') AND t <> CURRENT_TIMESTAMP(0);
d	dt	t	tm
1997-12-01	2004-11-05 16:47:31	2000-12-31 23:59:59	20:33:34
1999-11-30	2011-01-20 01:00:00	2001-01-01 00:00:00	100:55:50
2000-02-05	2002-10-21 00:00:00	1994-03-02 10:11:12	09:00:00
2001-01-01	2003-10-29 16:51:06	1998-12-31 23:59:59	12:30:35
2002-12-31	2002-10-28 00:00:00	1997-01-02 03:04:05	13:00:00
2003-03-01	2002-11-04 00:00:00	1999-04-02 00:00:00	19:38:34
2005-05-05	1999-03-14 02:17:27	2008-02-23 09:23:45	24:00:00
2010-07-15	2001-06-06 01:01:01	2010-03-05 11:08:02	48:00:00
2019-01-01	2008-09-19 07:13:16	2011-01-06 12:34:30	-48:00:00
CREATE INDEX d ON t1(d);
CREATE INDEX dt ON t1(dt);
CREATE INDEX t ON t1(t);
CREATE INDEX tm ON t1(tm);
SELECT * FROM t1 WHERE d > DATE_FORMAT(dt, "%Y-%m-%d");
d	dt	t	tm
2002-12-31	2002-10-28 00:00:00	1997-01-02 03:04:05	13:00:00
2003-03-01	2002-11-04 00:00:00	1999-04-02 00:00:00	19:38:34
2005-05-05	1999-03-14 02:17:27	2008-02-23 09:23:45	24:00:00
2010-07-15	2001-06-06 01:01:01	2010-03-05 11:08:02	48:00:00
2019-01-01	2008-09-19 07:13:16	2011-01-06 12:34:30	-48:00:00
SELECT d,dt,tm FROM t1 WHERE TIME_FORMAT(tm, '%H') >= 20;
d	dt	tm
1997-12-01	2004-11-05 16:47:31	20:33:34
1999-11-30	2011-01-20 01:00:00	100:55:50
2005-05-05	1999-03-14 02:17:27	24:00:00
2007-08-01	2038-01-19 12:14:07	300:55:50
2010-07-15	2001-06-06 01:01:01	48:00:00
SELECT d,tm FROM t1 WHERE tm < SEC_TO_TIME('837:59:59');
d	tm
2006-01-01	-24:00:00
2019-01-01	-48:00:00
SELECT t,tm FROM t1 WHERE TIME_TO_SEC(tm) > 100000;
t	tm
2001-01-01 00:00:00	100:55:50
2010-02-01 09:31:01	300:55:50
2010-03-05 11:08:02	48:00:00
SELECT * FROM t1 WHERE dt <= DATE_ADD(t, INTERVAL 1 SECOND);
d	dt	t	tm
2005-05-05	1999-03-14 02:17:27	2008-02-23 09:23:45	24:00:00
2010-07-15	2001-06-06 01:01:01	2010-03-05 11:08:02	48:00:00
2019-01-01	2008-09-19 07:13:16	2011-01-06 12:34:30	-48:00:00
SELECT * FROM t1 WHERE t <= DATE_SUB(dt, INTERVAL 1 SECOND);
d	dt	t	tm
1997-12-01	2004-11-05 16:47:31	2000-12-31 23:59:59	20:33:34
1999-11-30	2011-01-20 01:00:00	2001-01-01 00:00:00	100:55:50
2000-02-05	2002-10-21 00:00:00	1994-03-02 10:11:12	09:00:00
2001-01-01	2003-10-29 16:51:06	1998-12-31 23:59:59	12:30:35
2002-12-31	2002-10-28 00:00:00	1997-01-02 03:04:05	13:00:00
2003-03-01	2002-11-04 00:00:00	1999-04-02 00:00:00	19:38:34
2006-01-01	2020-01-13 19:12:17	2010-02-01 09:31:04	-24:00:00
2007-08-01	2038-01-19 12:14:07	2010-02-01 09:31:01	300:55:50
SELECT * FROM t1 WHERE EXTRACT(DAY FROM d) > 2;
d	dt	t	tm
1999-11-30	2011-01-20 01:00:00	2001-01-01 00:00:00	100:55:50
2000-02-05	2002-10-21 00:00:00	1994-03-02 10:11:12	09:00:00
2002-12-31	2002-10-28 00:00:00	1997-01-02 03:04:05	13:00:00
2005-05-05	1999-03-14 02:17:27	2008-02-23 09:23:45	24:00:00
2010-07-15	2001-06-06 01:01:01	2010-03-05 11:08:02	48:00:00
SELECT * FROM t1 WHERE DAYNAME(d) > 'Saturday';
d	dt	t	tm
1999-11-30	2011-01-20 01:00:00	2001-01-01 00:00:00	100:55:50
2002-12-31	2002-10-28 00:00:00	1997-01-02 03:04:05	13:00:00
2005-05-05	1999-03-14 02:17:27	2008-02-23 09:23:45	24:00:00
2006-01-01	2020-01-13 19:12:17	2010-02-01 09:31:04	-24:00:00
2007-08-01	2038-01-19 12:14:07	2010-02-01 09:31:01	300:55:50
2010-07-15	2001-06-06 01:01:01	2010-03-05 11:08:02	48:00:00
2019-01-01	2008-09-19 07:13:16	2011-01-06 12:34:30	-48:00:00
SELECT * FROM t1 WHERE MONTHNAME(dt) > 'March';
d	dt	t	tm
1997-12-01	2004-11-05 16:47:31	2000-12-31 23:59:59	20:33:34
2000-02-05	2002-10-21 00:00:00	1994-03-02 10:11:12	09:00:00
2001-01-01	2003-10-29 16:51:06	1998-12-31 23:59:59	12:30:35
2002-12-31	2002-10-28 00:00:00	1997-01-02 03:04:05	13:00:00
2003-03-01	2002-11-04 00:00:00	1999-04-02 00:00:00	19:38:34
2019-01-01	2008-09-19 07:13:16	2011-01-06 12:34:30	-48:00:00
SELECT d,dt,t FROM t1 WHERE DAYOFYEAR(t) > 60;
d	dt	t
1997-12-01	2004-11-05 16:47:31	2000-12-31 23:59:59
2000-02-05	2002-10-21 00:00:00	1994-03-02 10:11:12
2001-01-01	2003-10-29 16:51:06	1998-12-31 23:59:59
2003-03-01	2002-11-04 00:00:00	1999-04-02 00:00:00
2010-07-15	2001-06-06 01:01:01	2010-03-05 11:08:02
SELECT dt,t,tm FROM t1 WHERE DAYOFMONTH(t) > 20;
dt	t	tm
1999-03-14 02:17:27	2008-02-23 09:23:45	24:00:00
2003-10-29 16:51:06	1998-12-31 23:59:59	12:30:35
2004-11-05 16:47:31	2000-12-31 23:59:59	20:33:34
SELECT * FROM t1 WHERE WEEK(d) < 30;
d	dt	t	tm
2000-02-05	2002-10-21 00:00:00	1994-03-02 10:11:12	09:00:00
2001-01-01	2003-10-29 16:51:06	1998-12-31 23:59:59	12:30:35
2003-03-01	2002-11-04 00:00:00	1999-04-02 00:00:00	19:38:34
2005-05-05	1999-03-14 02:17:27	2008-02-23 09:23:45	24:00:00
2006-01-01	2020-01-13 19:12:17	2010-02-01 09:31:04	-24:00:00
2010-07-15	2001-06-06 01:01:01	2010-03-05 11:08:02	48:00:00
2019-01-01	2008-09-19 07:13:16	2011-01-06 12:34:30	-48:00:00
SELECT * FROM t1 WHERE WEEKOFYEAR(dt) != 45 AND WEEKDAY(t) <= 3;
d	dt	t	tm
1999-11-30	2011-01-20 01:00:00	2001-01-01 00:00:00	100:55:50
2000-02-05	2002-10-21 00:00:00	1994-03-02 10:11:12	09:00:00
2001-01-01	2003-10-29 16:51:06	1998-12-31 23:59:59	12:30:35
2002-12-31	2002-10-28 00:00:00	1997-01-02 03:04:05	13:00:00
2006-01-01	2020-01-13 19:12:17	2010-02-01 09:31:04	-24:00:00
2007-08-01	2038-01-19 12:14:07	2010-02-01 09:31:01	300:55:50
2019-01-01	2008-09-19 07:13:16	2011-01-06 12:34:30	-48:00:00
SELECT * FROM t1 WHERE MONTH(d) > 2 AND WEEK(dt) < 50 AND YEAR(t) != 2010;
d	dt	t	tm
1997-12-01	2004-11-05 16:47:31	2000-12-31 23:59:59	20:33:34
1999-11-30	2011-01-20 01:00:00	2001-01-01 00:00:00	100:55:50
2002-12-31	2002-10-28 00:00:00	1997-01-02 03:04:05	13:00:00
2003-03-01	2002-11-04 00:00:00	1999-04-02 00:00:00	19:38:34
2005-05-05	1999-03-14 02:17:27	2008-02-23 09:23:45	24:00:00
SELECT * FROM t1 WHERE YEARWEEK(d) > 200201 AND HOUR(t) < 20 AND QUARTER(dt) <> 1;
d	dt	t	tm
2002-12-31	2002-10-28 00:00:00	1997-01-02 03:04:05	13:00:00
2003-03-01	2002-11-04 00:00:00	1999-04-02 00:00:00	19:38:34
2010-07-15	2001-06-06 01:01:01	2010-03-05 11:08:02	48:00:00
2019-01-01	2008-09-19 07:13:16	2011-01-06 12:34:30	-48:00:00
SELECT * FROM t1 WHERE TO_DAYS(t) <= 731516;
d	dt	t	tm
1997-12-01	2004-11-05 16:47:31	2000-12-31 23:59:59	20:33:34
1999-11-30	2011-01-20 01:00:00	2001-01-01 00:00:00	100:55:50
2000-02-05	2002-10-21 00:00:00	1994-03-02 10:11:12	09:00:00
2001-01-01	2003-10-29 16:51:06	1998-12-31 23:59:59	12:30:35
2002-12-31	2002-10-28 00:00:00	1997-01-02 03:04:05	13:00:00
2003-03-01	2002-11-04 00:00:00	1999-04-02 00:00:00	19:38:34
SELECT * FROM t1 WHERE UNIX_TIMESTAMP(t) > 1000000000;
d	dt	t	tm
2005-05-05	1999-03-14 02:17:27	2008-02-23 09:23:45	24:00:00
2006-01-01	2020-01-13 19:12:17	2010-02-01 09:31:04	-24:00:00
2007-08-01	2038-01-19 12:14:07	2010-02-01 09:31:01	300:55:50
2010-07-15	2001-06-06 01:01:01	2010-03-05 11:08:02	48:00:00
2019-01-01	2008-09-19 07:13:16	2011-01-06 12:34:30	-48:00:00
SELECT * FROM t1 WHERE t < FROM_UNIXTIME(950000000);
d	dt	t	tm
2000-02-05	2002-10-21 00:00:00	1994-03-02 10:11:12	09:00:00
2001-01-01	2003-10-29 16:51:06	1998-12-31 23:59:59	12:30:35
2002-12-31	2002-10-28 00:00:00	1997-01-02 03:04:05	13:00:00
2003-03-01	2002-11-04 00:00:00	1999-04-02 00:00:00	19:38:34
SELECT d,t FROM t1 WHERE t >= TIMESTAMPADD(HOUR,8820,d);
d	t
1997-12-01	2000-12-31 23:59:59
1999-11-30	2001-01-01 00:00:00
2005-05-05	2008-02-23 09:23:45
2006-01-01	2010-02-01 09:31:04
2007-08-01	2010-02-01 09:31:01
SELECT * FROM t1 WHERE TIMESTAMPDIFF(day,dt,t) > 0;
d	dt	t	tm
2005-05-05	1999-03-14 02:17:27	2008-02-23 09:23:45	24:00:00
2010-07-15	2001-06-06 01:01:01	2010-03-05 11:08:02	48:00:00
2019-01-01	2008-09-19 07:13:16	2011-01-06 12:34:30	-48:00:00
SELECT * FROM t1 WHERE LAST_DAY(d) < "2005-12-31" AND FROM_DAYS(TO_DAYS(t)) > "1999-12-01";
d	dt	t	tm
1997-12-01	2004-11-05 16:47:31	2000-12-31 23:59:59	20:33:34
1999-11-30	2011-01-20 01:00:00	2001-01-01 00:00:00	100:55:50
2005-05-05	1999-03-14 02:17:27	2008-02-23 09:23:45	24:00:00
SELECT * FROM t1 WHERE t < LOCALTIMESTAMP() AND t <> UTC_TIMESTAMP();
d	dt	t	tm
1997-12-01	2004-11-05 16:47:31	2000-12-31 23:59:59	20:33:34
1999-11-30	2011-01-20 01:00:00	2001-01-01 00:00:00	100:55:50
2000-02-05	2002-10-21 00:00:00	1994-03-02 10:11:12	09:00:00
2001-01-01	2003-10-29 16:51:06	1998-12-31 23:59:59	12:30:35
2002-12-31	2002-10-28 00:00:00	1997-01-02 03:04:05	13:00:00
2003-03-01	2002-11-04 00:00:00	1999-04-02 00:00:00	19:38:34
2005-05-05	1999-03-14 02:17:27	2008-02-23 09:23:45	24:00:00
2006-01-01	2020-01-13 19:12:17	2010-02-01 09:31:04	-24:00:00
2007-08-01	2038-01-19 12:14:07	2010-02-01 09:31:01	300:55:50
2010-07-15	2001-06-06 01:01:01	2010-03-05 11:08:02	48:00:00
2019-01-01	2008-09-19 07:13:16	2011-01-06 12:34:30	-48:00:00
SELECT * FROM t1 WHERE MONTHNAME(STR_TO_DATE(d,'%Y-%m-%d')) >= 'March';
d	dt	t	tm
1999-11-30	2011-01-20 01:00:00	2001-01-01 00:00:00	100:55:50
2003-03-01	2002-11-04 00:00:00	1999-04-02 00:00:00	19:38:34
2005-05-05	1999-03-14 02:17:27	2008-02-23 09:23:45	24:00:00
SELECT * FROM t1 WHERE DATE(d) BETWEEN CAST("2003-1-1" as DATE) AND CAST("2008-12-1" as DATE);
d	dt	t	tm
2003-03-01	2002-11-04 00:00:00	1999-04-02 00:00:00	19:38:34
2005-05-05	1999-03-14 02:17:27	2008-02-23 09:23:45	24:00:00
2006-01-01	2020-01-13 19:12:17	2010-02-01 09:31:04	-24:00:00
2007-08-01	2038-01-19 12:14:07	2010-02-01 09:31:01	300:55:50
SELECT * FROM t1 WHERE MAKEDATE(2002,1) BETWEEN DATE(d) AND DATE(dt);
d	dt	t	tm
1997-12-01	2004-11-05 16:47:31	2000-12-31 23:59:59	20:33:34
1999-11-30	2011-01-20 01:00:00	2001-01-01 00:00:00	100:55:50
2000-02-05	2002-10-21 00:00:00	1994-03-02 10:11:12	09:00:00
2001-01-01	2003-10-29 16:51:06	1998-12-31 23:59:59	12:30:35
SELECT d,dt,tm FROM t1 WHERE ADDTIME(tm, '20:40:00') > '40:00:00' AND SUBTIME(tm, '30:23:00') < '-80:00:00';
d	dt	tm
1997-12-01	2004-11-05 16:47:31	20:33:34
2003-03-01	2002-11-04 00:00:00	19:38:34
2005-05-05	1999-03-14 02:17:27	24:00:00
SELECT * FROM t1 WHERE tm > MAKETIME(30,25,7);
d	dt	t	tm
1999-11-30	2011-01-20 01:00:00	2001-01-01 00:00:00	100:55:50
2007-08-01	2038-01-19 12:14:07	2010-02-01 09:31:01	300:55:50
2010-07-15	2001-06-06 01:01:01	2010-03-05 11:08:02	48:00:00
SELECT d,dt,t,tm FROM t1 WHERE d <= NOW(6) AND dt  < SUBTIME(CURRENT_TIME(2), '1 1:1:1.000002') AND t <> CURRENT_TIMESTAMP(0);
d	dt	t	tm
1997-12-01	2004-11-05 16:47:31	2000-12-31 23:59:59	20:33:34
1999-11-30	2011-01-20 01:00:00	2001-01-01 00:00:00	100:55:50
2000-02-05	2002-10-21 00:00:00	1994-03-02 10:11:12	09:00:00
2001-01-01	2003-10-29 16:51:06	1998-12-31 23:59:59	12:30:35
2002-12-31	2002-10-28 00:00:00	1997-01-02 03:04:05	13:00:00
2003-03-01	2002-11-04 00:00:00	1999-04-02 00:00:00	19:38:34
2005-05-05	1999-03-14 02:17:27	2008-02-23 09:23:45	24:00:00
2010-07-15	2001-06-06 01:01:01	2010-03-05 11:08:02	48:00:00
2019-01-01	2008-09-19 07:13:16	2011-01-06 12:34:30	-48:00:00
DROP TABLE t1;
CREATE TABLE t1 (a INT, b MEDIUMINT, c DECIMAL(60,30), d DOUBLE);
INSERT INTO t1 VALUES (1,4,12.12,4.551),(10,6,11.11,4.55),(22,21,123.123,3.14),(34,30,12345.12345,3.14135),(14,10,100.1,111.551),(9,9,9.9,99.341),(30,31,34.67,14.001),(101,100,234.354,678.1),(89,89,90.89,90.99),(13,21,21.3,-34.01
),(67,34,45.21,123.001),(28,28,12.21,12.21),(110,99,110.99,110.99),(200,200,455.12,455.12),(300,300,1.1,1.1);
SELECT * FROM t1 WHERE FLOOR(d) > 10 AND CEILING(c) < 55 AND CEIL(a) > 10;
a	b	c	d
28	28	12.210000000000000000000000000000	12.21
30	31	34.670000000000000000000000000000	14.001
67	34	45.210000000000000000000000000000	123.001
SELECT * FROM t1 WHERE TRUNCATE(d,1) <= 4.5;
a	b	c	d
1	4	12.120000000000000000000000000000	4.551
10	6	11.110000000000000000000000000000	4.55
13	21	21.300000000000000000000000000000	-34.01
22	21	123.123000000000000000000000000000	3.14
300	300	1.100000000000000000000000000000	1.1
34	30	12345.123450000000000000000000000000	3.14135
SELECT * FROM t1 WHERE ROUND(c) > 100;
a	b	c	d
101	100	234.354000000000000000000000000000	678.1
110	99	110.990000000000000000000000000000	110.99
200	200	455.120000000000000000000000000000	455.12
22	21	123.123000000000000000000000000000	3.14
34	30	12345.123450000000000000000000000000	3.14135
SELECT * FROM t1 WHERE ABS(d) < 100 AND SIGN(d) > -1;
a	b	c	d
1	4	12.120000000000000000000000000000	4.551
10	6	11.110000000000000000000000000000	4.55
22	21	123.123000000000000000000000000000	3.14
28	28	12.210000000000000000000000000000	12.21
30	31	34.670000000000000000000000000000	14.001
300	300	1.100000000000000000000000000000	1.1
34	30	12345.123450000000000000000000000000	3.14135
89	89	90.890000000000000000000000000000	90.99
9	9	9.900000000000000000000000000000	99.341
SELECT * FROM t1 WHERE LOG(EXP(a)) >100;
a	b	c	d
101	100	234.354000000000000000000000000000	678.1
110	99	110.990000000000000000000000000000	110.99
200	200	455.120000000000000000000000000000	455.12
300	300	1.100000000000000000000000000000	1.1
SELECT * FROM t1 WHERE EXP(LN(SQRT(a))*4) < 1000.000000000000002;
a	b	c	d
1	4	12.120000000000000000000000000000	4.551
10	6	11.110000000000000000000000000000	4.55
13	21	21.300000000000000000000000000000	-34.01
14	10	100.100000000000000000000000000000	111.551
22	21	123.123000000000000000000000000000	3.14
28	28	12.210000000000000000000000000000	12.21
30	31	34.670000000000000000000000000000	14.001
9	9	9.900000000000000000000000000000	99.341
SELECT * FROM t1 WHERE LOG2(a) > 6 AND POW(10,LOG10(b)) > 81;
a	b	c	d
101	100	234.354000000000000000000000000000	678.1
110	99	110.990000000000000000000000000000	110.99
200	200	455.120000000000000000000000000000	455.12
300	300	1.100000000000000000000000000000	1.1
89	89	90.890000000000000000000000000000	90.99
SELECT * FROM t1 WHERE POWER(a,2) > b;
a	b	c	d
10	6	11.110000000000000000000000000000	4.55
101	100	234.354000000000000000000000000000	678.1
110	99	110.990000000000000000000000000000	110.99
13	21	21.300000000000000000000000000000	-34.01
14	10	100.100000000000000000000000000000	111.551
200	200	455.120000000000000000000000000000	455.12
22	21	123.123000000000000000000000000000	3.14
28	28	12.210000000000000000000000000000	12.21
30	31	34.670000000000000000000000000000	14.001
300	300	1.100000000000000000000000000000	1.1
34	30	12345.123450000000000000000000000000	3.14135
67	34	45.210000000000000000000000000000	123.001
89	89	90.890000000000000000000000000000	90.99
9	9	9.900000000000000000000000000000	99.341
SELECT * FROM t1 WHERE RAND(b) < 0.23454;
a	b	c	d
1	4	12.120000000000000000000000000000	4.551
101	100	234.354000000000000000000000000000	678.1
200	200	455.120000000000000000000000000000	455.12
28	28	12.210000000000000000000000000000	12.21
300	300	1.100000000000000000000000000000	1.1
SELECT * FROM t1 WHERE FORMAT(ABS(TAN(d)),6) > 1.23456 AND FORMAT(SIN(a/2),6) > 0;
a	b	c	d
1	4	12.120000000000000000000000000000	4.551
14	10	100.100000000000000000000000000000	111.551
30	31	34.670000000000000000000000000000	14.001
SELECT * FROM t1 WHERE FORMAT(COS(c/2),6) > 0.333333 AND FORMAT(cot(b),6) < 0.123456;
a	b	c	d
10	6	11.110000000000000000000000000000	4.55
110	99	110.990000000000000000000000000000	110.99
28	28	12.210000000000000000000000000000	12.21
300	300	1.100000000000000000000000000000	1.1
SELECT * FROM t1 WHERE DEGREES(a) > 1000 AND RADIANS(b) > 1.0001;
a	b	c	d
101	100	234.354000000000000000000000000000	678.1
110	99	110.990000000000000000000000000000	110.99
200	200	455.120000000000000000000000000000	455.12
300	300	1.100000000000000000000000000000	1.1
89	89	90.890000000000000000000000000000	90.99
SELECT * FROM t1 WHERE ACOS(c/100) IS NOT NULL AND ASIN(d/100) IS NOT NULL;
a	b	c	d
1	4	12.120000000000000000000000000000	4.551
10	6	11.110000000000000000000000000000	4.55
13	21	21.300000000000000000000000000000	-34.01
28	28	12.210000000000000000000000000000	12.21
30	31	34.670000000000000000000000000000	14.001
300	300	1.100000000000000000000000000000	1.1
89	89	90.890000000000000000000000000000	90.99
9	9	9.900000000000000000000000000000	99.341
SELECT * FROM t1 WHERE MOD(CAST(b AS UNSIGNED), 3) > 0 AND SQRT(CAST(a AS UNSIGNED)) >= 5.5;
a	b	c	d
101	100	234.354000000000000000000000000000	678.1
200	200	455.120000000000000000000000000000	455.12
67	34	45.210000000000000000000000000000	123.001
89	89	90.890000000000000000000000000000	90.99
SELECT * FROM t1 WHERE (a DIV 2) >= c - b;
a	b	c	d
110	99	110.990000000000000000000000000000	110.99
13	21	21.300000000000000000000000000000	-34.01
28	28	12.210000000000000000000000000000	12.21
30	31	34.670000000000000000000000000000	14.001
300	300	1.100000000000000000000000000000	1.1
67	34	45.210000000000000000000000000000	123.001
89	89	90.890000000000000000000000000000	90.99
9	9	9.900000000000000000000000000000	99.341
SELECT * FROM t1 WHERE a * b / 10 > d + c;
a	b	c	d
101	100	234.354000000000000000000000000000	678.1
110	99	110.990000000000000000000000000000	110.99
13	21	21.300000000000000000000000000000	-34.01
200	200	455.120000000000000000000000000000	455.12
28	28	12.210000000000000000000000000000	12.21
30	31	34.670000000000000000000000000000	14.001
300	300	1.100000000000000000000000000000	1.1
67	34	45.210000000000000000000000000000	123.001
89	89	90.890000000000000000000000000000	90.99
SELECT * FROM t1 WHERE MOD(CRC32(b), 2) > 0;
a	b	c	d
110	99	110.990000000000000000000000000000	110.99
14	10	100.100000000000000000000000000000	111.551
200	200	455.120000000000000000000000000000	455.12
30	31	34.670000000000000000000000000000	14.001
34	30	12345.123450000000000000000000000000	3.14135
9	9	9.900000000000000000000000000000	99.341
CREATE INDEX a ON t1(a);
CREATE INDEX b ON t1(b);
CREATE INDEX c ON t1(c);
CREATE INDEX d ON t1(d);
SELECT * FROM t1 WHERE FLOOR(d) > 10 AND CEILING(c) < 55 AND CEIL(a) > 10;
a	b	c	d
28	28	12.210000000000000000000000000000	12.21
30	31	34.670000000000000000000000000000	14.001
67	34	45.210000000000000000000000000000	123.001
SELECT * FROM t1 WHERE TRUNCATE(d,1) <= 4.5;
a	b	c	d
1	4	12.120000000000000000000000000000	4.551
10	6	11.110000000000000000000000000000	4.55
13	21	21.300000000000000000000000000000	-34.01
22	21	123.123000000000000000000000000000	3.14
300	300	1.100000000000000000000000000000	1.1
34	30	12345.123450000000000000000000000000	3.14135
SELECT * FROM t1 WHERE ROUND(c) > 100;
a	b	c	d
101	100	234.354000000000000000000000000000	678.1
110	99	110.990000000000000000000000000000	110.99
200	200	455.120000000000000000000000000000	455.12
22	21	123.123000000000000000000000000000	3.14
34	30	12345.123450000000000000000000000000	3.14135
SELECT * FROM t1 WHERE ABS(d) < 100 AND SIGN(d) > -1;
a	b	c	d
1	4	12.120000000000000000000000000000	4.551
10	6	11.110000000000000000000000000000	4.55
22	21	123.123000000000000000000000000000	3.14
28	28	12.210000000000000000000000000000	12.21
30	31	34.670000000000000000000000000000	14.001
300	300	1.100000000000000000000000000000	1.1
34	30	12345.123450000000000000000000000000	3.14135
89	89	90.890000000000000000000000000000	90.99
9	9	9.900000000000000000000000000000	99.341
SELECT * FROM t1 WHERE LOG(EXP(a)) >100;
a	b	c	d
101	100	234.354000000000000000000000000000	678.1
110	99	110.990000000000000000000000000000	110.99
200	200	455.120000000000000000000000000000	455.12
300	300	1.100000000000000000000000000000	1.1
SELECT * FROM t1 WHERE EXP(LN(SQRT(a))*4) < 1000.000000000000002;
a	b	c	d
1	4	12.120000000000000000000000000000	4.551
10	6	11.110000000000000000000000000000	4.55
13	21	21.300000000000000000000000000000	-34.01
14	10	100.100000000000000000000000000000	111.551
22	21	123.123000000000000000000000000000	3.14
28	28	12.210000000000000000000000000000	12.21
30	31	34.670000000000000000000000000000	14.001
9	9	9.900000000000000000000000000000	99.341
SELECT * FROM t1 WHERE LOG2(a) > 6 AND POW(10,LOG10(b)) > 81;
a	b	c	d
101	100	234.354000000000000000000000000000	678.1
110	99	110.990000000000000000000000000000	110.99
200	200	455.120000000000000000000000000000	455.12
300	300	1.100000000000000000000000000000	1.1
89	89	90.890000000000000000000000000000	90.99
SELECT * FROM t1 WHERE POWER(a,2) > b;
a	b	c	d
10	6	11.110000000000000000000000000000	4.55
101	100	234.354000000000000000000000000000	678.1
110	99	110.990000000000000000000000000000	110.99
13	21	21.300000000000000000000000000000	-34.01
14	10	100.100000000000000000000000000000	111.551
200	200	455.120000000000000000000000000000	455.12
22	21	123.123000000000000000000000000000	3.14
28	28	12.210000000000000000000000000000	12.21
30	31	34.670000000000000000000000000000	14.001
300	300	1.100000000000000000000000000000	1.1
34	30	12345.123450000000000000000000000000	3.14135
67	34	45.210000000000000000000000000000	123.001
89	89	90.890000000000000000000000000000	90.99
9	9	9.900000000000000000000000000000	99.341
SELECT * FROM t1 WHERE RAND(b) < 0.23454;
a	b	c	d
1	4	12.120000000000000000000000000000	4.551
101	100	234.354000000000000000000000000000	678.1
200	200	455.120000000000000000000000000000	455.12
28	28	12.210000000000000000000000000000	12.21
300	300	1.100000000000000000000000000000	1.1
SELECT * FROM t1 WHERE FORMAT(ABS(TAN(d)),6) > 1.23456 AND FORMAT(SIN(a/2),6) > 0;
a	b	c	d
1	4	12.120000000000000000000000000000	4.551
14	10	100.100000000000000000000000000000	111.551
30	31	34.670000000000000000000000000000	14.001
SELECT * FROM t1 WHERE FORMAT(COS(c/2),6) > 0.333333 AND FORMAT(cot(b),6) < 0.123456;
a	b	c	d
10	6	11.110000000000000000000000000000	4.55
110	99	110.990000000000000000000000000000	110.99
28	28	12.210000000000000000000000000000	12.21
300	300	1.100000000000000000000000000000	1.1
SELECT * FROM t1 WHERE DEGREES(a) > 1000 AND RADIANS(b) > 1.0001;
a	b	c	d
101	100	234.354000000000000000000000000000	678.1
110	99	110.990000000000000000000000000000	110.99
200	200	455.120000000000000000000000000000	455.12
300	300	1.100000000000000000000000000000	1.1
89	89	90.890000000000000000000000000000	90.99
SELECT * FROM t1 WHERE ACOS(c/100) IS NOT NULL AND ASIN(d/100) IS NOT NULL;
a	b	c	d
1	4	12.120000000000000000000000000000	4.551
10	6	11.110000000000000000000000000000	4.55
13	21	21.300000000000000000000000000000	-34.01
28	28	12.210000000000000000000000000000	12.21
30	31	34.670000000000000000000000000000	14.001
300	300	1.100000000000000000000000000000	1.1
89	89	90.890000000000000000000000000000	90.99
9	9	9.900000000000000000000000000000	99.341
SELECT * FROM t1 WHERE MOD(CAST(b AS UNSIGNED), 3) > 0 AND SQRT(CAST(a AS UNSIGNED)) >= 5.5;
a	b	c	d
101	100	234.354000000000000000000000000000	678.1
200	200	455.120000000000000000000000000000	455.12
67	34	45.210000000000000000000000000000	123.001
89	89	90.890000000000000000000000000000	90.99
SELECT * FROM t1 WHERE (a DIV 2) >= c - b;
a	b	c	d
110	99	110.990000000000000000000000000000	110.99
13	21	21.300000000000000000000000000000	-34.01
28	28	12.210000000000000000000000000000	12.21
30	31	34.670000000000000000000000000000	14.001
300	300	1.100000000000000000000000000000	1.1
67	34	45.210000000000000000000000000000	123.001
89	89	90.890000000000000000000000000000	90.99
9	9	9.900000000000000000000000000000	99.341
SELECT * FROM t1 WHERE a * b / 10 > d + c;
a	b	c	d
101	100	234.354000000000000000000000000000	678.1
110	99	110.990000000000000000000000000000	110.99
13	21	21.300000000000000000000000000000	-34.01
200	200	455.120000000000000000000000000000	455.12
28	28	12.210000000000000000000000000000	12.21
30	31	34.670000000000000000000000000000	14.001
300	300	1.100000000000000000000000000000	1.1
67	34	45.210000000000000000000000000000	123.001
89	89	90.890000000000000000000000000000	90.99
SELECT * FROM t1 WHERE MOD(CRC32(b), 2) > 0;
a	b	c	d
110	99	110.990000000000000000000000000000	110.99
14	10	100.100000000000000000000000000000	111.551
200	200	455.120000000000000000000000000000	455.12
30	31	34.670000000000000000000000000000	14.001
34	30	12345.123450000000000000000000000000	3.14135
9	9	9.900000000000000000000000000000	99.341
DROP TABLE t1;
CREATE TABLE t1(a INT, b BIGINT, c VARCHAR(127));
INSERT INTO t1 VALUES (11, 101, 'abcd'),(34, 75, '123'),(-9, 56, 'hello'),(22, 99, 'vac'),(-1, 32, '456'),(4, -25, '789'),(30, 30, 'page'),(67, 59, 'opp'),(12, 63, 'ewi'),(36,-23, 'roe'),(-13, 49, 'fls'),(17, 9, 'dj'),(6, 19, 'gfl'),(2, -2, 'fks');
SELECT SUM(a) FROM t1 GROUP BY a;
SUM(a)
-1
-13
-9
11
12
17
2
22
30
34
36
4
6
67
SELECT COUNT(b) FROM t1 GROUP BY b;
COUNT(b)
1
1
1
1
1
1
1
1
1
1
1
1
1
1
SELECT AVG(a) FROM t1 GROUP BY a;
AVG(a)
-1.0000
-13.0000
-9.0000
11.0000
12.0000
17.0000
2.0000
22.0000
30.0000
34.0000
36.0000
4.0000
6.0000
67.0000
SELECT STD(ALL b) FROM t1;
STD(ALL b)
38.87237096563311
SELECT BIT_OR(a) FROM t1;
BIT_OR(a)
18446744073709551615
SELECT BIT_AND(b) FROM t1;
BIT_AND(b)
0
SELECT MIN(a) FROM t1;
MIN(a)
-13
SELECT MAX(b) FROM t1;
MAX(b)
101
SELECT a,b FROM t1 GROUP BY a,b HAVING SUM(a) = SUM(b) ;
a	b
30	30
SELECT a FROM t1 GROUP BY a HAVING AVG(a) > 9;
a
11
12
17
22
30
34
36
67
SELECT a FROM t1 GROUP BY a HAVING MAX(a) > 20;
a
22
30
34
36
67
SELECT b FROM t1 GROUP BY b HAVING MIN(b) < 15;
b
-2
-23
-25
9
CREATE INDEX a ON t1(a);
CREATE INDEX b ON t1(b);
SELECT SUM(a) FROM t1 GROUP BY a;
SUM(a)
-1
-13
-9
11
12
17
2
22
30
34
36
4
6
67
SELECT COUNT(b) FROM t1 GROUP BY b;
COUNT(b)
1
1
1
1
1
1
1
1
1
1
1
1
1
1
SELECT AVG(a) FROM t1 GROUP BY a;
AVG(a)
-1.0000
-13.0000
-9.0000
11.0000
12.0000
17.0000
2.0000
22.0000
30.0000
34.0000
36.0000
4.0000
6.0000
67.0000
SELECT STD(ALL b) FROM t1;
STD(ALL b)
38.87237096563311
SELECT BIT_OR(a) FROM t1;
BIT_OR(a)
18446744073709551615
SELECT BIT_AND(b) FROM t1;
BIT_AND(b)
0
SELECT MIN(a) FROM t1;
MIN(a)
-13
SELECT MAX(b) FROM t1;
MAX(b)
101
SELECT a,b FROM t1 GROUP BY a,b HAVING SUM(a) = SUM(b) ;
a	b
30	30
SELECT a FROM t1 GROUP BY a HAVING AVG(a) > 9;
a
11
12
17
22
30
34
36
67
SELECT a FROM t1 GROUP BY a HAVING MAX(a) > 20;
a
22
30
34
36
67
SELECT b FROM t1 GROUP BY b HAVING MIN(b) < 15;
b
-2
-23
-25
9
DROP TABLE t1;
CREATE TABLE t1 (a MEDIUMINT, b INT, c CHAR(64), d BLOB, e DATE, f TEXT);
CREATE TABLE t2 (a INT, b BIGINT);
CREATE TABLE t3 (a INT4, b CHAR(16), c DATETIME) CHARSET=UTF8;
INSERT INTO t1 VALUES (13,5,'aaa','aaa','2005-05-01','aaa'),(5,2,'bb1','bb1','2006-06-05','bb1'),(-3,1,'111','111','2008-01-12','111'),(21,3,'eog','eog','1990-03-01','eog'),(15,35,'fqc','fqc','2015-09-30','fqc'),(-16,-9,'yew','yew','2001-09-01','yew'),(31,13,'bow','bow','2101-07-21','bow'),(6,10,NULL,NULL,NULL,NULL),(101,-2,NULL,NULL,NULL,NULL),(7,2,'dno','dno','2010-04-01','dno'),(65,4,'hello','hello','2093-11-5','hello'),(27,-14,NULL,NULL,NULL,NULL),(22,11,NULL,NULL,NULL,NULL),(-3,-3,'yew','yew','2001-09-01','yew'),(13,13,'bb1','bb1','2006-06-05','bb1');
INSERT INTO t2 VALUES (13,5),(-3,2),(21,3),(65,4),(31,4),(13,13),(45,-4),(1,24),(11,9),(10,10);
INSERT INTO t3 VALUES (13,'aaa','2005-05-01 12:30:00'),(-3,'bb1','2005-05-01 12:30:00'),(21,'111','2005-05-01 12:30:00'),(65,'eog','2004-05-01 12:30:00'),(31,'fqc','2195-05-01 11:30:00'),(13,'yew','2000-10-01 12:30:00'),(45,'bow',NULL),(1,'dno',NULL),(11,'hello',NULL),(10,'fed',NULL);
SELECT a, COUNT(*) FROM t1 GROUP BY a HAVING a > 20;
a	COUNT(*)
101	1
21	1
22	1
27	1
31	1
65	1
SELECT b, SUM(a) FROM t1 GROUP BY b,a DESC;
b	SUM(a)
-14	27
-2	101
-3	-3
-9	-16
1	-3
10	6
11	22
13	13
13	31
2	5
2	7
3	21
35	15
4	65
5	13
Warning	1287	'GROUP BY with ASC/DESC' is deprecated and will be removed in a future release. Please use GROUP BY ... ORDER BY ... ASC/DESC instead
Warnings:
SELECT a, MIN(b),e, COUNT(DISTINCT c) FROM t1 GROUP BY a,b,c,e HAVING a > b + c;
a	MIN(b)	e	COUNT(DISTINCT c)
13	5	2005-05-01	1
21	3	1990-03-01	1
31	13	2101-07-21	1
5	2	2006-06-05	1
65	4	2093-11-05	1
7	2	2010-04-01	1
Warning	1292	Truncated incorrect DOUBLE value: 'aaa                                                             '
Warning	1292	Truncated incorrect DOUBLE value: 'bb1                                                             '
Warning	1292	Truncated incorrect DOUBLE value: 'bb1                                                             '
Warning	1292	Truncated incorrect DOUBLE value: 'bow                                                             '
Warning	1292	Truncated incorrect DOUBLE value: 'dno                                                             '
Warning	1292	Truncated incorrect DOUBLE value: 'eog                                                             '
Warning	1292	Truncated incorrect DOUBLE value: 'fqc                                                             '
Warning	1292	Truncated incorrect DOUBLE value: 'hello                                                           '
Warning	1292	Truncated incorrect DOUBLE value: 'yew                                                             '
Warning	1292	Truncated incorrect DOUBLE value: 'yew                                                             '
Warnings:
SELECT BINARY d FROM t1 GROUP BY d;
BINARY d
111
NULL
aaa
bb1
bow
dno
eog
fqc
hello
yew
SELECT GROUP_CONCAT(DISTINCT d) AS dd FROM t1 GROUP BY d HAVING dd LIKE "%";
dd
111
aaa
bb1
bow
dno
eog
fqc
hello
yew
SELECT a, d, ROUND(RAND(b)*5) r2 FROM t1 WHERE a < 60 GROUP BY a,b,d HAVING d > 'a';
a	d	r2
-16	yew	5
-3	yew	2
13	aaa	2
13	bb1	2
15	fqc	5
21	eog	5
31	bow	2
5	bb1	3
7	dno	3
SELECT MAX(t1.a), t1.b, t1.e FROM t1 LEFT JOIN t2 ON t2.a = t1.a AND t2.b = t1.b WHERE t1.d < 'hello' GROUP BY t1.a,t1.b,t1.e;
MAX(t1.a)	b	e
-3	1	2008-01-12
13	13	2006-06-05
13	5	2005-05-01
15	35	2015-09-30
21	3	1990-03-01
31	13	2101-07-21
5	2	2006-06-05
7	2	2010-04-01
SELECT t1.a,t2.b FROM t1,t2 WHERE t1.b=t2.b GROUP BY t1.a,t2.b ORDER BY NULL;
a	b
13	13
13	5
21	3
31	13
5	2
6	10
65	4
7	2
SELECT a, SUM(b) AS b1 FROM t1 GROUP BY a HAVING SUM(b) > 10 AND a < 50;
a	b1
13	18
15	35
22	11
31	13
SELECT b FROM t3 WHERE a >= 20 AND b <= 'f' GROUP BY b;
b
111
bow
eog
SELECT DISTINCT a, b, c, d, e, f FROM t1 WHERE a > 31 GROUP BY 'const';
a	b	c	d	e	f
101	-2	NULL	NULL	NULL	NULL
SELECT c DIV 1 AS cc, a FROM t1 GROUP BY cc,a;
cc	a
0	-16
0	-3
0	13
0	15
0	21
0	31
0	5
0	65
0	7
111	-3
NULL	101
NULL	22
NULL	27
NULL	6
Warning	1292	Truncated incorrect DECIMAL value: 'aaa                                                             '
Warning	1292	Truncated incorrect DECIMAL value: 'bb1                                                             '
Warning	1292	Truncated incorrect DECIMAL value: 'bb1                                                             '
Warning	1292	Truncated incorrect DECIMAL value: 'bow                                                             '
Warning	1292	Truncated incorrect DECIMAL value: 'dno                                                             '
Warning	1292	Truncated incorrect DECIMAL value: 'eog                                                             '
Warning	1292	Truncated incorrect DECIMAL value: 'fqc                                                             '
Warning	1292	Truncated incorrect DECIMAL value: 'hello                                                           '
Warning	1292	Truncated incorrect DECIMAL value: 'yew                                                             '
Warning	1292	Truncated incorrect DECIMAL value: 'yew                                                             '
Warning	1366	Incorrect DECIMAL value: '0' for column '' at row -1
Warning	1366	Incorrect DECIMAL value: '0' for column '' at row -1
Warning	1366	Incorrect DECIMAL value: '0' for column '' at row -1
Warning	1366	Incorrect DECIMAL value: '0' for column '' at row -1
Warning	1366	Incorrect DECIMAL value: '0' for column '' at row -1
Warning	1366	Incorrect DECIMAL value: '0' for column '' at row -1
Warning	1366	Incorrect DECIMAL value: '0' for column '' at row -1
Warning	1366	Incorrect DECIMAL value: '0' for column '' at row -1
Warning	1366	Incorrect DECIMAL value: '0' for column '' at row -1
Warning	1366	Incorrect DECIMAL value: '0' for column '' at row -1
Warnings:
SELECT COUNT(DISTINCT(t1.c)), LEFT(d, 256) AS comment FROM t1 LEFT JOIN t2 ON t1.a=t2.a GROUP BY comment;
COUNT(DISTINCT(t1.c))	comment
0	NULL
1	111
1	aaa
1	bb1
1	bow
1	dno
1	eog
1	fqc
1	hello
1	yew
SELECT DATE(LEFT(e+1,7)) FROM t1 GROUP BY 1;
DATE(LEFT(e+1,7))
2020-01-09
2020-05-05
2020-06-06
2020-08-01
2020-10-04
2021-01-07
NULL
Warning	1292	Incorrect datetime value: '1990030'
Warning	1292	Incorrect datetime value: '2015093'
Warning	1292	Incorrect datetime value: '2093110'
Warnings:
SET SQL_MODE = 'ONLY_FULL_GROUP_BY';
Warnings:
Warning	3090	Changing sql mode 'NO_AUTO_CREATE_USER' is deprecated. It will be removed in a future release.
SELECT MAX(a)-MIN(a) FROM t1 GROUP BY b;
MAX(a)-MIN(a)
0
0
0
0
0
0
0
0
0
0
0
18
2
SELECT a FROM t1 GROUP BY t1.a
HAVING (SELECT AVG(SUM(t1.b) + t2.b) FROM t2 ORDER BY SUM(t2.a) LIMIT 1);
a
-16
-3
101
13
15
21
22
27
31
5
6
65
7
SELECT SUBSTRING(a,1,10), LENGTH(a), GROUP_CONCAT(b) FROM t3 GROUP BY a;
SUBSTRING(a,1,10)	LENGTH(a)	GROUP_CONCAT(b)
-3	2	bb1
1	1	dno
10	2	fed
11	2	hello
13	2	aaa,yew
21	2	111
31	2	fqc
45	2	bow
65	2	eog
SET sql_mode = default;
CREATE INDEX a ON t1(a);
CREATE INDEX b ON t1(b);
CREATE INDEX c ON t1(c);
CREATE INDEX e ON t1(e);
CREATE INDEX f ON t1(f(16));
CREATE INDEX a ON t2(a);
CREATE INDEX b ON t2(b);
CREATE INDEX a ON t3(a);
CREATE INDEX b ON t3(b);
CREATE INDEX c ON t3(c);
SELECT a, COUNT(*) FROM t1 GROUP BY a HAVING a > 20;
a	COUNT(*)
101	1
21	1
22	1
27	1
31	1
65	1
SELECT b, SUM(a) FROM t1 GROUP BY b,a DESC;
b	SUM(a)
-14	27
-2	101
-3	-3
-9	-16
1	-3
10	6
11	22
13	13
13	31
2	5
2	7
3	21
35	15
4	65
5	13
Warning	1287	'GROUP BY with ASC/DESC' is deprecated and will be removed in a future release. Please use GROUP BY ... ORDER BY ... ASC/DESC instead
Warnings:
SELECT a, MIN(b),e, COUNT(DISTINCT c) FROM t1 GROUP BY a,b,c,e HAVING a > b + c;
a	MIN(b)	e	COUNT(DISTINCT c)
13	5	2005-05-01	1
21	3	1990-03-01	1
31	13	2101-07-21	1
5	2	2006-06-05	1
65	4	2093-11-05	1
7	2	2010-04-01	1
Warning	1292	Truncated incorrect DOUBLE value: 'aaa                                                             '
Warning	1292	Truncated incorrect DOUBLE value: 'bb1                                                             '
Warning	1292	Truncated incorrect DOUBLE value: 'bb1                                                             '
Warning	1292	Truncated incorrect DOUBLE value: 'bow                                                             '
Warning	1292	Truncated incorrect DOUBLE value: 'dno                                                             '
Warning	1292	Truncated incorrect DOUBLE value: 'eog                                                             '
Warning	1292	Truncated incorrect DOUBLE value: 'fqc                                                             '
Warning	1292	Truncated incorrect DOUBLE value: 'hello                                                           '
Warning	1292	Truncated incorrect DOUBLE value: 'yew                                                             '
Warning	1292	Truncated incorrect DOUBLE value: 'yew                                                             '
Warnings:
SELECT BINARY d FROM t1 GROUP BY d;
BINARY d
111
NULL
aaa
bb1
bow
dno
eog
fqc
hello
yew
SELECT GROUP_CONCAT(DISTINCT d) AS dd FROM t1 GROUP BY d HAVING dd LIKE "%";
dd
111
aaa
bb1
bow
dno
eog
fqc
hello
yew
SELECT a, d, ROUND(RAND(b)*5) r2 FROM t1 WHERE a < 60 GROUP BY a,b,d HAVING d > 'a';
a	d	r2
-16	yew	5
-3	yew	2
13	aaa	2
13	bb1	2
15	fqc	5
21	eog	5
31	bow	2
5	bb1	3
7	dno	3
SELECT MAX(t1.a), t1.b, t1.e FROM t1 LEFT JOIN t2 ON t2.a = t1.a AND t2.b = t1.b WHERE t1.d < 'hello' GROUP BY t1.a,t1.b,t1.e;
MAX(t1.a)	b	e
-3	1	2008-01-12
13	13	2006-06-05
13	5	2005-05-01
15	35	2015-09-30
21	3	1990-03-01
31	13	2101-07-21
5	2	2006-06-05
7	2	2010-04-01
SELECT t1.a,t2.b FROM t1,t2 WHERE t1.b=t2.b GROUP BY t1.a,t2.b ORDER BY NULL;
a	b
13	13
13	5
21	3
31	13
5	2
6	10
65	4
7	2
SELECT a, SUM(b) AS b1 FROM t1 GROUP BY a HAVING SUM(b) > 10 AND a < 50;
a	b1
13	18
15	35
22	11
31	13
SELECT b FROM t3 WHERE a >= 20 AND b <= 'f' GROUP BY b;
b
111
bow
eog
SELECT DISTINCT a, b, c, d, e, f FROM t1 WHERE a > 31 GROUP BY 'const';
a	b	c	d	e	f
65	4	hello	hello	2093-11-05	hello
SELECT c DIV 1 AS cc, a FROM t1 GROUP BY cc,a;
cc	a
0	-16
0	-3
0	13
0	15
0	21
0	31
0	5
0	65
0	7
111	-3
NULL	101
NULL	22
NULL	27
NULL	6
Warning	1292	Truncated incorrect DECIMAL value: 'aaa                                                             '
Warning	1292	Truncated incorrect DECIMAL value: 'bb1                                                             '
Warning	1292	Truncated incorrect DECIMAL value: 'bb1                                                             '
Warning	1292	Truncated incorrect DECIMAL value: 'bow                                                             '
Warning	1292	Truncated incorrect DECIMAL value: 'dno                                                             '
Warning	1292	Truncated incorrect DECIMAL value: 'eog                                                             '
Warning	1292	Truncated incorrect DECIMAL value: 'fqc                                                             '
Warning	1292	Truncated incorrect DECIMAL value: 'hello                                                           '
Warning	1292	Truncated incorrect DECIMAL value: 'yew                                                             '
Warning	1292	Truncated incorrect DECIMAL value: 'yew                                                             '
Warning	1366	Incorrect DECIMAL value: '0' for column '' at row -1
Warning	1366	Incorrect DECIMAL value: '0' for column '' at row -1
Warning	1366	Incorrect DECIMAL value: '0' for column '' at row -1
Warning	1366	Incorrect DECIMAL value: '0' for column '' at row -1
Warning	1366	Incorrect DECIMAL value: '0' for column '' at row -1
Warning	1366	Incorrect DECIMAL value: '0' for column '' at row -1
Warning	1366	Incorrect DECIMAL value: '0' for column '' at row -1
Warning	1366	Incorrect DECIMAL value: '0' for column '' at row -1
Warning	1366	Incorrect DECIMAL value: '0' for column '' at row -1
Warning	1366	Incorrect DECIMAL value: '0' for column '' at row -1
Warnings:
SELECT COUNT(DISTINCT(t1.c)), LEFT(d, 256) AS comment FROM t1 LEFT JOIN t2 ON t1.a=t2.a GROUP BY comment;
COUNT(DISTINCT(t1.c))	comment
0	NULL
1	111
1	aaa
1	bb1
1	bow
1	dno
1	eog
1	fqc
1	hello
1	yew
SELECT DATE(LEFT(e+1,7)) FROM t1 GROUP BY 1;
DATE(LEFT(e+1,7))
2020-01-09
2020-05-05
2020-06-06
2020-08-01
2020-10-04
2021-01-07
NULL
Warning	1292	Incorrect datetime value: '1990030'
Warning	1292	Incorrect datetime value: '2015093'
Warning	1292	Incorrect datetime value: '2093110'
Warnings:
SET SQL_MODE = 'ONLY_FULL_GROUP_BY';
Warnings:
Warning	3090	Changing sql mode 'NO_AUTO_CREATE_USER' is deprecated. It will be removed in a future release.
SELECT MAX(a)-MIN(a) FROM t1 GROUP BY b;
MAX(a)-MIN(a)
0
0
0
0
0
0
0
0
0
0
0
18
2
SELECT a FROM t1 GROUP BY t1.a
HAVING (SELECT AVG(SUM(t1.b) + t2.b) FROM t2 ORDER BY SUM(t2.a) LIMIT 1);
a
-16
-3
101
13
15
21
22
27
31
5
6
65
7
SELECT SUBSTRING(a,1,10), LENGTH(a), GROUP_CONCAT(b) FROM t3 GROUP BY a;
SUBSTRING(a,1,10)	LENGTH(a)	GROUP_CONCAT(b)
-3	2	bb1
1	1	dno
10	2	fed
11	2	hello
13	2	aaa,yew
21	2	111
31	2	fqc
45	2	bow
65	2	eog
SET sql_mode = default;
DROP TABLE t1,t2,t3;
CREATE TABLE t1(a char(16), b text) DEFAULT CHARSET=latin1 COLLATE=latin1_bin;
INSERT INTO t1 VALUES ("hello", "hello");
INSERT INTO t1 VALUES ("HELLO", "HELLO");
INSERT INTO t1 VALUES ("hello ", "hello ");
INSERT INTO t1 VALUES ("HELLO ", "HELLO ");
INSERT INTO t1 VALUES (" hello", " hello");
INSERT INTO t1 VALUES (" HELLO", " HELLO");
INSERT INTO t1 VALUES (" hello ", " hello ");
INSERT INTO t1 VALUES (" HELLO ", " HELLO ");
INSERT INTO t1 VALUES ("HELLO ", "HELLO ");
INSERT INTO t1 VALUES ("hello ", "hello ");
INSERT INTO t1 VALUES ("hello", "hello");
INSERT INTO t1 VALUES ("HELLO", "HELLO");
INSERT INTO t1 VALUES ("hello1", "hello1");
INSERT INTO t1 VALUES ("HELLO1", "HELLO1");
INSERT INTO t1 VALUES ("hello1 ", "hello1 ");
INSERT INTO t1 VALUES ("HELLO1 ", "HELLO1 ");
INSERT INTO t1 VALUES (" hello1", " hello1");
INSERT INTO t1 VALUES (" HELLO1", " HELLO1");
INSERT INTO t1 VALUES (" hello1 ", " hello1 ");
INSERT INTO t1 VALUES (" HELLO1 ", " HELLO1 ");
INSERT INTO t1 VALUES ("HELLO1 ", "HELLO1 ");
INSERT INTO t1 VALUES ("hello1", "hello1");
INSERT INTO t1 VALUES ("hello1 ", "hello1 ");
INSERT INTO t1 VALUES ("HELLO1", "HELLO1");
SELECT a, COUNT(*) FROM t1 GROUP BY a;
a	COUNT(*)
 HELLO	2
 HELLO1	2
 hello	2
 hello1	2
HELLO	4
HELLO1	4
hello	4
hello1	4
SELECT a, COUNT(*) FROM t1 GROUP BY a HAVING a = "hello";
a	COUNT(*)
hello	4
SELECT a, COUNT(*) FROM t1 GROUP BY a HAVING a = "HELLO";
a	COUNT(*)
HELLO	4
SELECT a, COUNT(*) FROM t1 GROUP BY a HAVING a = "hello1 ";
a	COUNT(*)
hello1	4
SELECT a, COUNT(*) FROM t1 GROUP BY a HAVING a = "HELLO1 ";
a	COUNT(*)
HELLO1	4
SELECT a, COUNT(*) FROM t1 GROUP BY a HAVING a = " hello";
a	COUNT(*)
 hello	2
SELECT a, COUNT(*) FROM t1 GROUP BY a HAVING a = " HELLO";
a	COUNT(*)
 HELLO	2
SELECT a, COUNT(*) FROM t1 GROUP BY a HAVING a = " hello1 ";
a	COUNT(*)
 hello1	2
SELECT a, COUNT(*) FROM t1 GROUP BY a HAVING a = " HELLO1 ";
a	COUNT(*)
 HELLO1	2
SELECT a, b, COUNT(*) FROM t1 GROUP BY a,b HAVING a = b;
a	b	COUNT(*)
 HELLO	 HELLO	2
 HELLO1	 HELLO1	2
 hello	 hello	2
 hello1	 hello1	2
HELLO	HELLO	4
HELLO1	HELLO1	4
hello	hello	4
hello1	hello1	4
CREATE INDEX a ON t1(a);
SELECT a, COUNT(*) FROM t1 GROUP BY a;
a	COUNT(*)
 HELLO	2
 HELLO1	2
 hello	2
 hello1	2
HELLO	4
HELLO1	4
hello	4
hello1	4
SELECT a, COUNT(*) FROM t1 GROUP BY a HAVING a = "hello";
a	COUNT(*)
hello	4
SELECT a, COUNT(*) FROM t1 GROUP BY a HAVING a = "HELLO";
a	COUNT(*)
HELLO	4
SELECT a, COUNT(*) FROM t1 GROUP BY a HAVING a = "hello1 ";
a	COUNT(*)
hello1	4
SELECT a, COUNT(*) FROM t1 GROUP BY a HAVING a = "HELLO1 ";
a	COUNT(*)
HELLO1	4
SELECT a, COUNT(*) FROM t1 GROUP BY a HAVING a = " hello";
a	COUNT(*)
 hello	2
SELECT a, COUNT(*) FROM t1 GROUP BY a HAVING a = " HELLO";
a	COUNT(*)
 HELLO	2
SELECT a, COUNT(*) FROM t1 GROUP BY a HAVING a = " hello1 ";
a	COUNT(*)
 hello1	2
SELECT a, COUNT(*) FROM t1 GROUP BY a HAVING a = " HELLO1 ";
a	COUNT(*)
 HELLO1	2
SELECT a, b, COUNT(*) FROM t1 GROUP BY a,b HAVING a = b;
a	b	COUNT(*)
 HELLO	 HELLO	2
 HELLO1	 HELLO1	2
 hello	 hello	2
 hello1	 hello1	2
HELLO	HELLO	4
HELLO1	HELLO1	4
hello	hello	4
hello1	hello1	4
DROP TABLE t1;
CREATE TABLE t1(a varchar(16), b set("hello","hello1"," hello", " hello1", " HELLO"," HELLO1","HELLO","HELLO1")) DEFAULT CHARSET=latin1 COLLATE=latin1_bin;
INSERT INTO t1 VALUES ("hello", "hello");
INSERT INTO t1 VALUES ("HELLO", "HELLO");
INSERT INTO t1 VALUES ("hello ", "hello ");
INSERT INTO t1 VALUES ("HELLO ", "HELLO ");
INSERT INTO t1 VALUES (" hello", " hello");
INSERT INTO t1 VALUES (" HELLO", " HELLO");
INSERT INTO t1 VALUES (" hello ", " hello ");
INSERT INTO t1 VALUES (" HELLO ", " HELLO ");
INSERT INTO t1 VALUES ("HELLO ", "HELLO ");
INSERT INTO t1 VALUES ("hello ", "hello ");
INSERT INTO t1 VALUES ("hello", "hello");
INSERT INTO t1 VALUES ("HELLO", "HELLO");
INSERT INTO t1 VALUES ("hello1", "hello1");
INSERT INTO t1 VALUES ("HELLO1", "HELLO1");
INSERT INTO t1 VALUES ("hello1 ", "hello1 ");
INSERT INTO t1 VALUES ("HELLO1 ", "HELLO1 ");
INSERT INTO t1 VALUES (" hello1", " hello1");
INSERT INTO t1 VALUES (" HELLO1", " HELLO1");
INSERT INTO t1 VALUES (" hello1 ", " hello1 ");
INSERT INTO t1 VALUES (" HELLO1 ", " HELLO1 ");
INSERT INTO t1 VALUES ("HELLO1 ", "HELLO1 ");
INSERT INTO t1 VALUES ("hello1", "hello1");
INSERT INTO t1 VALUES ("hello1 ", "hello1 ");
INSERT INTO t1 VALUES ("HELLO1", "HELLO1");
SELECT a, COUNT(*) FROM t1 GROUP BY a;
a	COUNT(*)
 HELLO	2
 HELLO1 	2
 hello 	2
 hello1 	2
HELLO	4
HELLO1	4
hello 	4
hello1	4
SELECT a, COUNT(*) FROM t1 GROUP BY a HAVING a = "hello";
a	COUNT(*)
hello 	4
SELECT a, COUNT(*) FROM t1 GROUP BY a HAVING a = "HELLO";
a	COUNT(*)
HELLO	4
SELECT a, COUNT(*) FROM t1 GROUP BY a HAVING a = "hello1 ";
a	COUNT(*)
hello1	4
SELECT a, COUNT(*) FROM t1 GROUP BY a HAVING a = "HELLO1 ";
a	COUNT(*)
HELLO1	4
SELECT a, COUNT(*) FROM t1 GROUP BY a HAVING a = " hello";
a	COUNT(*)
 hello 	2
SELECT a, COUNT(*) FROM t1 GROUP BY a HAVING a = " HELLO";
a	COUNT(*)
 HELLO	2
SELECT a, COUNT(*) FROM t1 GROUP BY a HAVING a = " hello1 ";
a	COUNT(*)
 hello1 	2
SELECT a, COUNT(*) FROM t1 GROUP BY a HAVING a = " HELLO1 ";
a	COUNT(*)
 HELLO1 	2
SELECT a, b, COUNT(*) FROM t1 GROUP BY a,b HAVING a = b;
a	b	COUNT(*)
 HELLO	 HELLO	2
 HELLO1 	 HELLO1	2
 hello 	 hello	2
 hello1 	 hello1	2
HELLO	HELLO	4
HELLO1	HELLO1	4
hello 	hello	4
hello1	hello1	4
CREATE INDEX a ON t1(a);
SELECT a, COUNT(*) FROM t1 GROUP BY a;
a	COUNT(*)
 HELLO	2
 HELLO1 	2
 hello 	2
 hello1 	2
HELLO	4
HELLO1	4
hello 	4
hello1	4
SELECT a, COUNT(*) FROM t1 GROUP BY a HAVING a = "hello";
a	COUNT(*)
hello 	4
SELECT a, COUNT(*) FROM t1 GROUP BY a HAVING a = "HELLO";
a	COUNT(*)
HELLO	4
SELECT a, COUNT(*) FROM t1 GROUP BY a HAVING a = "hello1 ";
a	COUNT(*)
hello1	4
SELECT a, COUNT(*) FROM t1 GROUP BY a HAVING a = "HELLO1 ";
a	COUNT(*)
HELLO1	4
SELECT a, COUNT(*) FROM t1 GROUP BY a HAVING a = " hello";
a	COUNT(*)
 hello 	2
SELECT a, COUNT(*) FROM t1 GROUP BY a HAVING a = " HELLO";
a	COUNT(*)
 HELLO	2
SELECT a, COUNT(*) FROM t1 GROUP BY a HAVING a = " hello1 ";
a	COUNT(*)
 hello1 	2
SELECT a, COUNT(*) FROM t1 GROUP BY a HAVING a = " HELLO1 ";
a	COUNT(*)
 HELLO1 	2
SELECT a, b, COUNT(*) FROM t1 GROUP BY a,b HAVING a = b;
a	b	COUNT(*)
 HELLO	 HELLO	2
 HELLO1 	 HELLO1	2
 hello 	 hello	2
 hello1 	 hello1	2
HELLO	HELLO	4
HELLO1	HELLO1	4
hello 	hello	4
hello1	hello1	4
DROP TABLE t1;
CREATE TABLE t1(a tinytext, b mediumtext, c text, d longtext) DEFAULT CHARSET=latin1 COLLATE=latin1_bin;
INSERT INTO t1 VALUES ("hello", "hello", "hello", "hello");
INSERT INTO t1 VALUES ("HELLO", "HELLO", "HELLO", "HELLO");
INSERT INTO t1 VALUES ("hello ", "hello ", "hello ", "hello ");
INSERT INTO t1 VALUES ("HELLO ", "HELLO ", "HELLO ", "HELLO ");
INSERT INTO t1 VALUES (" hello", " hello", " hello", " hello");
INSERT INTO t1 VALUES (" HELLO", " HELLO", " HELLO", " HELLO");
INSERT INTO t1 VALUES (" hello ", " hello ", " hello ", " hello ");
INSERT INTO t1 VALUES (" HELLO ", " HELLO ", " HELLO ", " HELLO ");
INSERT INTO t1 VALUES ("HELLO ", "HELLO ", "HELLO ", "HELLO ");
INSERT INTO t1 VALUES ("hello ", "hello ", "hello ", "hello ");
INSERT INTO t1 VALUES ("hello", "hello", "hello", "hello");
INSERT INTO t1 VALUES ("HELLO", "HELLO", "HELLO", "HELLO");
INSERT INTO t1 VALUES ("hello1", "hello1", "hello1", "hello1");
INSERT INTO t1 VALUES ("HELLO1", "HELLO1", "HELLO1", "HELLO1");
INSERT INTO t1 VALUES ("hello1 ", "hello1 ", "hello1 ", "hello1 ");
INSERT INTO t1 VALUES ("HELLO1 ", "HELLO1 ", "HELLO1 ", "HELLO1 ");
INSERT INTO t1 VALUES (" hello1", " hello1", " hello1", " hello1");
INSERT INTO t1 VALUES (" HELLO1", " HELLO1", " HELLO1", " HELLO1");
INSERT INTO t1 VALUES (" hello1 ", " hello1 ", " hello1 ", " hello1 ");
INSERT INTO t1 VALUES (" HELLO1 ", " HELLO1 ", " HELLO1 ", " HELLO1 ");
INSERT INTO t1 VALUES ("HELLO1 ", "HELLO1 ", "HELLO1 ", "HELLO1 ");
INSERT INTO t1 VALUES ("hello1", "hello1", "hello1", "hello1");
INSERT INTO t1 VALUES ("hello1 ", "hello1 ", "hello1 ", "hello1 ");
INSERT INTO t1 VALUES ("HELLO1", "HELLO1", "HELLO1", "HELLO1");
SELECT a, COUNT(*) FROM t1 GROUP BY a;
a	COUNT(*)
 HELLO	2
 HELLO1 	2
 hello 	2
 hello1 	2
HELLO	4
HELLO1	4
hello 	4
hello1	4
SELECT a, COUNT(*) FROM t1 GROUP BY a HAVING a = "hello";
a	COUNT(*)
hello 	4
SELECT b, COUNT(*) FROM t1 GROUP BY b HAVING b = "HELLO";
b	COUNT(*)
HELLO	4
SELECT c, COUNT(*) FROM t1 GROUP BY c HAVING c = "hello1 ";
c	COUNT(*)
hello1	4
SELECT d, COUNT(*) FROM t1 GROUP BY d HAVING d = "HELLO1 ";
d	COUNT(*)
HELLO1	4
SELECT d, COUNT(*) FROM t1 GROUP BY d HAVING d = " hello";
d	COUNT(*)
 hello 	2
SELECT c, COUNT(*) FROM t1 GROUP BY c HAVING c = " HELLO";
c	COUNT(*)
 HELLO	2
SELECT b, COUNT(*) FROM t1 GROUP BY b HAVING b = " hello1 ";
b	COUNT(*)
 hello1 	2
SELECT a, COUNT(*) FROM t1 GROUP BY a HAVING a = " HELLO1 ";
a	COUNT(*)
 HELLO1 	2
SELECT c, d, COUNT(*) FROM t1 GROUP BY c, d HAVING c = d;
c	d	COUNT(*)
 HELLO	 HELLO	2
 HELLO1 	 HELLO1 	2
 hello 	 hello 	2
 hello1 	 hello1 	2
HELLO	HELLO	4
HELLO1	HELLO1	4
hello 	hello 	4
hello1	hello1	4
CREATE INDEX a ON t1(a(16));
CREATE INDEX b ON t1(b(16));
CREATE INDEX c ON t1(c(16));
CREATE INDEX d ON t1(d(16));
SELECT a, COUNT(*) FROM t1 GROUP BY a;
a	COUNT(*)
 HELLO	2
 HELLO1 	2
 hello 	2
 hello1 	2
HELLO	4
HELLO1	4
hello 	4
hello1	4
SELECT a, COUNT(*) FROM t1 GROUP BY a HAVING a = "hello";
a	COUNT(*)
hello 	4
SELECT b, COUNT(*) FROM t1 GROUP BY b HAVING b = "HELLO";
b	COUNT(*)
HELLO	4
SELECT c, COUNT(*) FROM t1 GROUP BY c HAVING c = "hello1 ";
c	COUNT(*)
hello1	4
SELECT d, COUNT(*) FROM t1 GROUP BY d HAVING d = "HELLO1 ";
d	COUNT(*)
HELLO1	4
SELECT d, COUNT(*) FROM t1 GROUP BY d HAVING d = " hello";
d	COUNT(*)
 hello 	2
SELECT c, COUNT(*) FROM t1 GROUP BY c HAVING c = " HELLO";
c	COUNT(*)
 HELLO	2
SELECT b, COUNT(*) FROM t1 GROUP BY b HAVING b = " hello1 ";
b	COUNT(*)
 hello1 	2
SELECT a, COUNT(*) FROM t1 GROUP BY a HAVING a = " HELLO1 ";
a	COUNT(*)
 HELLO1 	2
SELECT c, d, COUNT(*) FROM t1 GROUP BY c,d HAVING c = d;
c	d	COUNT(*)
 HELLO	 HELLO	2
 HELLO1 	 HELLO1 	2
 hello 	 hello 	2
 hello1 	 hello1 	2
HELLO	HELLO	4
HELLO1	HELLO1	4
hello 	hello 	4
hello1	hello1	4
DROP TABLE t1;
