create database test_insert;
use test_insert;
drop table if exists t1,t2,t3;
SET sql_mode = 'NO_ENGINE_SUBSTITUTION';
Warnings:
Warning	3090	Changing sql mode 'NO_AUTO_CREATE_USER' is deprecated. It will be removed in a future release.
create table t1 (a int not null);
insert into t1 values (1);
insert into t1 values (a+2);
insert into t1 values (a+3),(a+4);
insert into t1 values (5),(a+6);
select * from t1;
a
1
2
3
4
5
6
drop table t1;
create table t1 (id int NOT NULL DEFAULT 8);
insert into t1 values(NULL);
ERROR 23000: Column 'id' cannot be null
insert into t1 values (1), (NULL), (2);
Warnings:
Warning	1048	Column 'id' cannot be null
select * from t1;
id
1
0
2
drop table t1;
drop database if exists mysqltest_insert;
create database mysqltest_insert;
use mysqltest_insert;
create table t1 (c int);
insert into mysqltest_insert.t1 set mysqltest_insert.t1.c = '1';
drop database mysqltest_insert;
use test_insert;
create table t1 (a int, b int);
insert into t1 (a,b) values (a,b);
insert into t1 SET a=1, b=a+1;
insert into t1 (a,b) select 1,2;
INSERT INTO t1 ( a ) SELECT 0 ON DUPLICATE KEY UPDATE a = a + VALUES (a);
prepare stmt1 from ' replace into t1 (a,a) select 100, ''hundred'' ';
ERROR 42000: Column 'a' specified twice
insert into t1 (a,b,b) values (1,1,1);
ERROR 42000: Column 'b' specified twice
insert into t1 (a,a) values (1,1,1);
ERROR 21S01: Column count doesn't match value count at row 1
insert into t1 (a,a) values (1,1);
ERROR 42000: Column 'a' specified twice
insert into t1 SET a=1,b=2,a=1;
ERROR 42000: Column 'a' specified twice
insert into t1 (b,b) select 1,2;
ERROR 42000: Column 'b' specified twice
INSERT INTO t1 (b,b) SELECT 0,0 ON DUPLICATE KEY UPDATE a = a + VALUES (a);
ERROR 42000: Column 'b' specified twice
drop table t1;
create table t1 (id int primary key, data int);
insert into t1 values (1, 1), (2, 2), (3, 3);
select row_count();
row_count()
3
insert ignore into t1 values (1, 1);
select row_count();
row_count()
1
drop table t1;
create table t1 (f1 int unique, f2 int);
create table t2 (f3 int, f4 int);
create view v1 as select * from t1, t2 where f1= f3;
insert into t1 values (1,11), (2,22);
insert into t2 values (1,12), (2,24);
insert into v1 (f1) values (3) on duplicate key update f3= f3 + 10;
ERROR HY000: Can not modify more than one base table through a join view 'test_insert.v1'
insert into v1 (f1) values (3) on duplicate key update f1= f3 + 10;
ERROR HY000: Can not modify more than one base table through a join view 'test_insert.v1'
select * from t1;
f1	f2
1	11
2	22
insert into v1 (f1) values (3) on duplicate key update f1= f3 + 10;
ERROR HY000: Can not modify more than one base table through a join view 'test_insert.v1'
select * from t1;
f1	f2
1	11
2	22
drop view v1;
drop table t1,t2;
CREATE TABLE t1 (
a char(20) NOT NULL,
b char(7) DEFAULT NULL,
c char(4) DEFAULT NULL
);
INSERT INTO t1(a,b,c) VALUES (9.999999e+0, 9.999999e+0, 9.999e+0);
INSERT INTO t1(a,b,c) VALUES (1.225e-05, 1.225e-05, 1.225e-05);
Warnings:
Warning	1265	Data truncated for column 'c' at row 1
INSERT INTO t1(a,b) VALUES (1.225e-04, 1.225e-04);
INSERT INTO t1(a,b) VALUES (1.225e-01, 1.225e-01);
INSERT INTO t1(a,b) VALUES (1.225877e-01, 1.225877e-01);
INSERT INTO t1(a,b) VALUES (1.225e+01, 1.225e+01);
INSERT INTO t1(a,b,c) VALUES (1.225e+01, 1.225e+01, 1.225e+01);
INSERT INTO t1(a,b) VALUES (1.225e+05, 1.225e+05);
INSERT INTO t1(a,b) VALUES (1.225e+10, 1.225e+10);
INSERT INTO t1(a,b) VALUES (1.225e+15, 1.225e+15);
INSERT INTO t1(a,b) VALUES (5000000e+0, 5000000e+0);
INSERT INTO t1(a,b) VALUES (1.25e+78, 1.25e+78);
INSERT INTO t1(a,b) VALUES (1.25e-94, 1.25e-94);
INSERT INTO t1(a,b) VALUES (1.25e+203, 1.25e+203);
INSERT INTO t1(a,b) VALUES (1.25e-175, 1.25e-175);
INSERT INTO t1(a,c) VALUES (1.225e+0, 1.225e+0);
INSERT INTO t1(a,c) VALUES (1.37e+0, 1.37e+0);
INSERT INTO t1(a,c) VALUES (-1.37e+0, -1.37e+0);
INSERT INTO t1(a,c) VALUES (1.87e-3, 1.87e-3);
Warnings:
Warning	1265	Data truncated for column 'c' at row 1
INSERT INTO t1(a,c) VALUES (-1.87e-2, -1.87e-2);
INSERT INTO t1(a,c) VALUES (5000e+0, 5000e+0);
INSERT INTO t1(a,c) VALUES (-5000e+0, -5000e+0);
SELECT * FROM t1;
a	b	c
9.999999	10	10
0.00001225	1.22e-5	1e-5
0.0001225	1.22e-4	NULL
0.1225	0.1225	NULL
0.1225877	0.12259	NULL
12.25	12.25	NULL
12.25	12.25	12.2
122500	122500	NULL
12250000000	1.22e10	NULL
1.225e15	1.22e15	NULL
5000000	5000000	NULL
1.25e78	1.25e78	NULL
1.25e-94	1.2e-94	NULL
1.25e203	1.2e203	NULL
1.25e-175	1e-175	NULL
1.225	NULL	1.23
1.37	NULL	1.37
-1.37	NULL	-1.4
0.00187	NULL	2e-3
-0.0187	NULL	0
5000	NULL	5000
-5000	NULL	-5e3
DROP TABLE t1;
CREATE TABLE t1 (
a char(20) NOT NULL,
b char(7) DEFAULT NULL,
c char(5)
);
INSERT INTO t1(a,b,c) VALUES (9.999999e+0, 9.999999e+0, 9.999e+0);
INSERT INTO t1(a,b,c) VALUES (1.225e-05, 1.225e-05, 1.225e-05);
INSERT INTO t1(a,b) VALUES (1.225e-04, 1.225e-04);
INSERT INTO t1(a,b) VALUES (1.225e-01, 1.225e-01);
INSERT INTO t1(a,b) VALUES (1.225877e-01, 1.225877e-01);
INSERT INTO t1(a,b) VALUES (1.225e+01, 1.225e+01);
INSERT INTO t1(a,b,c) VALUES (1.225e+01, 1.225e+01, 1.225e+01);
INSERT INTO t1(a,b) VALUES (1.225e+05, 1.225e+05);
INSERT INTO t1(a,b) VALUES (1.225e+10, 1.225e+10);
INSERT INTO t1(a,b) VALUES (1.225e+15, 1.225e+15);
INSERT INTO t1(a,b) VALUES (5000000e+0, 5000000e+0);
INSERT INTO t1(a,b) VALUES (1.25e+78, 1.25e+78);
INSERT INTO t1(a,b) VALUES (1.25e-94, 1.25e-94);
INSERT INTO t1(a,b) VALUES (1.25e+203, 1.25e+203);
INSERT INTO t1(a,b) VALUES (1.25e-175, 1.25e-175);
INSERT INTO t1(a,c) VALUES (1.225e+0, 1.225e+0);
INSERT INTO t1(a,c) VALUES (1.37e+0, 1.37e+0);
INSERT INTO t1(a,c) VALUES (-1.37e+0, -1.37e+0);
INSERT INTO t1(a,c) VALUES (1.87e-3, 1.87e-3);
INSERT INTO t1(a,c) VALUES (-1.87e-2, -1.87e-2);
INSERT INTO t1(a,c) VALUES (5000e+0, 5000e+0);
INSERT INTO t1(a,c) VALUES (-5000e+0, -5000e+0);
SELECT * FROM t1;
a	b	c
9.999999	10	9.999
0.00001225	1.22e-5	1e-5
0.0001225	1.22e-4	NULL
0.1225	0.1225	NULL
0.1225877	0.12259	NULL
12.25	12.25	NULL
12.25	12.25	12.25
122500	122500	NULL
12250000000	1.22e10	NULL
1.225e15	1.22e15	NULL
5000000	5000000	NULL
1.25e78	1.25e78	NULL
1.25e-94	1.2e-94	NULL
1.25e203	1.2e203	NULL
1.25e-175	1e-175	NULL
1.225	NULL	1.225
1.37	NULL	1.37
-1.37	NULL	-1.37
0.00187	NULL	0.002
-0.0187	NULL	-0.02
5000	NULL	5000
-5000	NULL	-5000
DROP TABLE t1;
SET sql_mode = default;
CREATE TABLE t (a CHAR(10),b INT);
INSERT INTO t VALUES (),(),();
INSERT INTO t(a) SELECT rand() FROM t;
DROP TABLE t;
CREATE TABLE t1 (c1 INT NOT NULL);
INSERT INTO t1 VALUES(4188.32999999999992724042385816574096679687500),
('4188.32999999999992724042385816574096679687500'), (4188);
SELECT * FROM t1;
c1
4188
4188
4188
CREATE TABLE t2 (c1 BIGINT);
INSERT INTO t2 VALUES('15449237462.0000000000');
SELECT * FROM t2;
c1
15449237462
DROP TABLE t1, t2;
CREATE TABLE t1(f1 FLOAT);
INSERT INTO t1 VALUES (1.23);
CREATE TABLE t2(f1 CHAR(1));
INSERT INTO t2 SELECT f1 FROM t1;
DROP TABLE t1, t2;
End of 5.0 tests.
#
# Bug#34898 "mysql_info() reports 0 warnings while
# mysql_warning_count() reports 1"
# Check that the number of warnings reported by
# mysql_info() is correct.
#
drop table if exists t1;
create table t1 (data varchar(4) not null);
#
# Demonstrate that the number of warnings matches
# the information in mysql_info().
#
insert ignore t1 (data) values ('letter'), (1/0);
affected rows: 2
info: Records: 2  Duplicates: 0  Warnings: 3
Warnings:
Warning	1265	Data truncated for column 'data' at row 1
Warning	1365	Division by 0
Warning	1048	Column 'data' cannot be null
update ignore t1 set data='envelope' where 1/0 or 1;
affected rows: 2
info: Rows matched: 2  Changed: 2  Warnings: 3
Warnings:
Warning	1365	Division by 0
Warning	1265	Data truncated for column 'data' at row 1
Warning	1265	Data truncated for column 'data' at row 2
insert ignore t1 (data) values (default), (1/0), ('dead beef');
affected rows: 3
info: Records: 3  Duplicates: 0  Warnings: 4
Warnings:
Warning	1364	Field 'data' doesn't have a default value
Warning	1365	Division by 0
Warning	1048	Column 'data' cannot be null
Warning	1265	Data truncated for column 'data' at row 3
drop table t1;
#
# End of 5.4 tests
#
#
# Bug#54106 assert in Protocol::end_statement,
#           INSERT IGNORE ... SELECT ... UNION SELECT ...
#
DROP TABLE IF EXISTS t1;
CREATE TABLE t1 (a INT);
INSERT INTO t1 (a, a) VALUES (1, 1);
ERROR 42000: Column 'a' specified twice
INSERT IGNORE t1 (a, a) VALUES (1, 1);
ERROR 42000: Column 'a' specified twice
INSERT IGNORE t1 (a, a) SELECT 1,1;
ERROR 42000: Column 'a' specified twice
INSERT IGNORE t1 (a, a) SELECT 1,1 UNION SELECT 2,2;
ERROR 42000: Column 'a' specified twice
DROP TABLE t1;
#
# Worklog #6073: Remove INSERT DELAYED
#
CREATE TABLE t1( a INT );
INSERT DELAYED INTO t1 VALUES ( 1 );
Warnings:
Warning	3005	INSERT DELAYED is no longer supported. The statement was converted to INSERT.
REPLACE DELAYED INTO t1 VALUES ( 1 );
Warnings:
Warning	3005	REPLACE DELAYED is no longer supported. The statement was converted to REPLACE.
DROP TABLE t1;
SET GLOBAL delayed_insert_limit = DEFAULT;
Warnings:
Warning	1287	'@@delayed_insert_limit' is deprecated and will be removed in a future release.
SET GLOBAL delayed_insert_timeout = DEFAULT;
Warnings:
Warning	1287	'@@delayed_insert_timeout' is deprecated and will be removed in a future release.
SET GLOBAL delayed_queue_size = DEFAULT;
Warnings:
Warning	1287	'@@delayed_queue_size' is deprecated and will be removed in a future release.
SET GLOBAL max_insert_delayed_threads = DEFAULT;
Warnings:
Warning	1287	'@@max_insert_delayed_threads' is deprecated and will be removed in a future release.
SET GLOBAL max_delayed_threads = DEFAULT;
Warnings:
Warning	1287	'@@max_delayed_threads' is deprecated and will be removed in a future release.
#
# Bug#18064775 Assertion failed: fields.elements == values.elements
#
CREATE TABLE t1(a INTEGER);
INSERT INTO t1(a) values();
ERROR 21S01: Column count doesn't match value count at row 1
DROP TABLE t1;
#
# Bug#11745889 Traditional: INSERT accepts invalid date from default val
#
SET sql_mode='';
Warnings:
Warning	3090	Changing sql mode 'NO_AUTO_CREATE_USER' is deprecated. It will be removed in a future release.
CREATE TABLE default_date(a DATE NOT NULL DEFAULT '0000-00-00');
INSERT INTO default_date VALUES();
SET sql_mode=default;
INSERT INTO default_date VALUES();
ERROR 22007: Incorrect date value: '0000-00-00' for column 'a' at row 1
INSERT INTO default_date VALUES('0000-00-00');
ERROR 22007: Incorrect date value: '0000-00-00' for column 'a' at row 1
SELECT * FROM default_date;
a
0000-00-00
Warnings:
Warning	1292	Incorrect date value: '0000-00-00 00:00:00' for column 'a' at row 1
DROP TABLE default_date;

# Bug#11744960 : INSERT IGNORE SHOULD RETURN WARNINGS
#
CREATE TABLE t (a INT PRIMARY KEY);
affected rows: 0
INSERT IGNORE INTO t VALUES (1);
affected rows: 1
INSERT IGNORE INTO t VALUES (1),(1);
affected rows: 2
info: Records: 2  Duplicates: 0  Warnings: 0
DROP TABLE t;
affected rows: 0
#
# WL#5275 Process subqueries in FROM clause in the same way as view
#
CREATE TABLE t1(pk INTEGER PRIMARY KEY, a INTEGER);
CREATE TABLE t2(pk INTEGER PRIMARY KEY, a INTEGER);
CREATE TABLE t3(a INTEGER);
CREATE TABLE t4(b INTEGER);
INSERT INTO t2 VALUES(1, 10), (2, 20), (3, 30), (4, 40);
INSERT INTO t3 VALUES(1), (3);
INSERT INTO t4 VALUES(1);
CREATE VIEW v1 AS
SELECT * FROM t1 WHERE pk IN (SELECT a FROM t3);
CREATE VIEW v2 AS
SELECT * FROM t2 WHERE pk IN (SELECT a FROM t3);
CREATE VIEW v3 AS
SELECT t1.pk,t1.a FROM t1 JOIN t4 ON pk IN (SELECT a FROM t3);
INSERT INTO v1
SELECT * FROM v2;
DELETE FROM t1;
INSERT INTO v3(pk,a)
SELECT * FROM v2;
DELETE FROM t1;
INSERT INTO v1
SELECT dt.pk, v2.a
FROM (SELECT * FROM v2) AS dt JOIN v2 ON dt.pk=v2.pk;
DROP VIEW v1, v2, v3;
DROP TABLE t1, t2, t3, t4;
# Bug#20310257 Explain for insert into a view show wrong table for ins.
CREATE TABLE t1(a INTEGER);
CREATE TABLE t2(b INTEGER);
CREATE VIEW v AS SELECT * FROM t1 JOIN t2 ON TRUE;
INSERT INTO v(a) VALUES(1);
INSERT INTO v(b) VALUES(1);
INSERT INTO v(a) SELECT 2;
INSERT INTO v(b) SELECT 2;
SELECT * FROM t1;
a
1
2
SELECT * FROM t2;
b
1
2
DROP VIEW v;
DROP TABLE t1, t2;
# Bug#20753569: handle_fatal_signal (sig=11) in
#               st_select_lex::merge_derived
CREATE TABLE t1(a INTEGER);
CREATE VIEW v1 AS SELECT a FROM t1 ORDER BY a;
INSERT INTO v1 SELECT 3;
REPLACE INTO v1 SELECT 3;
INSERT INTO v1 VALUES(3);
REPLACE INTO v1 VALUES(3);
DROP VIEW v1;
DROP TABLE t1;
#
# Bug#21696206: ASSERTION `TRANSL->ITEM->FIXED' FAILED IN
#               SELECT_LEX::DELETE_UNUSED_MERGED_COLUMN
#
CREATE TABLE t1 ( pk INT, PRIMARY KEY (pk));
CREATE TABLE t2 LIKE t1;
INSERT INTO t1 VALUES (2);
INSERT INTO t2 VALUES (2);
CREATE VIEW v1 AS SELECT * FROM t2 AS a
WHERE a.pk IN ( SELECT pk FROM t1 AS b WHERE b.pk = a.pk );
CREATE VIEW v2 AS SELECT * FROM t1 AS a
WHERE a.pk IN ( SELECT pk FROM v1 AS b WHERE b.pk = a.pk );
PREPARE st1 FROM 'INSERT INTO v2 (pk) VALUES ( 1 )';
EXECUTE st1;
SELECT * FROM t1;
pk
1
2
SELECT * FROM t2;
pk
2
DROP TABLE t1, t2;
DROP VIEW v1, v2;
#
# Bug#21696641: ASSERTION !(WANT_PRIVILEGE & ~(GRANT->WANT_PRIVILEGE |
#               GRANT->PRIVILEGE))'
#
CREATE TABLE t1 (pk INT, PRIMARY KEY (pk));
INSERT INTO t1 VALUES (1);
CREATE ALGORITHM = TEMPTABLE VIEW v2 AS
SELECT * FROM t1 AS a NATURAL JOIN t1 b WHERE pk BETWEEN 1 AND 2;
CREATE ALGORITHM = UNDEFINED VIEW v1 AS
SELECT * FROM t1 AS a
WHERE a.pk IN ( SELECT pk FROM v2 AS b WHERE b.pk = a.pk );
PREPARE st1 FROM "INSERT INTO v1 (pk) VALUES (2)";
EXECUTE st1;
SELECT * FROM t1;
pk
1
2
DROP VIEW v1, v2;
DROP TABLE t1;
DROP DATABASE test_insert;
