drop table if exists t1, t2;
create table t1(a bigint unsigned not null, primary key(a));
insert into t1 values (922337203685477807),(922337203685477808),(18446744073709551613),(18446744073709551615);
select * from t1;
a
922337203685477807
922337203685477808
18446744073709551613
18446744073709551615
update t1 set a = 0 where a = 18446744073709551615;
select * from t1 where a = 0;
a
0
delete from t1 where a = 0;
select * from t1 where a = 0;
a
insert into t1 values (18446744073709551615);
select * from t1 where a = 18446744073709551615;
a
18446744073709551615
select * from t1 where a between 922337203685477808 and 18446744073709551615;
a
922337203685477808
18446744073709551613
18446744073709551615
select * from t1 where a >= 922337203685477808 order by a;
a
922337203685477808
18446744073709551613
18446744073709551615
select * from t1 group by a having a > 922337203685477808;
a
18446744073709551613
18446744073709551615
select * from t1 where a <> all (select a from t1 where a <> 922337203685477807);
a
922337203685477807
create table t2(a bigint unsigned not null, primary key(a));
insert into t2 values (0),(922337203685477808),(18446744073709551615);
select t1.a,t2.a from t1 left join t2 on t1.a = t2.a;
a	a
922337203685477807	NULL
922337203685477808	922337203685477808
18446744073709551613	NULL
18446744073709551615	18446744073709551615
select format(a, 2) from t1 where a > 922337203685477807 and a < 18446744073709551615;
format(a, 2)
922,337,203,685,477,808.00
18,446,744,073,709,551,613.00
drop table t1,t2;
create table t1(a bigint unsigned not null, unique key(a));
insert into t1 values (922337203685477807),(922337203685477808),(18446744073709551613),(18446744073709551615);
select * from t1;
a
922337203685477807
922337203685477808
18446744073709551613
18446744073709551615
update t1 set a = 0 where a = 18446744073709551615;
select * from t1 where a = 0;
a
0
delete from t1 where a = 0;
select * from t1 where a = 0;
a
insert into t1 values (18446744073709551615);
select * from t1 where a = 18446744073709551615;
a
18446744073709551615
select * from t1 where a between 922337203685477808 and 18446744073709551615;
a
922337203685477808
18446744073709551613
18446744073709551615
select * from t1 where a >= 922337203685477808 order by a;
a
922337203685477808
18446744073709551613
18446744073709551615
select * from t1 group by a having a > 922337203685477808;
a
18446744073709551613
18446744073709551615
select * from t1 where a <> all (select a from t1 where a <> 922337203685477807);
a
922337203685477807
create table t2(a bigint unsigned not null, unique key(a));
insert into t2 values (0),(922337203685477808),(18446744073709551615);
select t1.a,t2.a from t1 left join t2 on t1.a = t2.a;
a	a
922337203685477807	NULL
922337203685477808	922337203685477808
18446744073709551613	NULL
18446744073709551615	18446744073709551615
select format(a, 2) from t1 where a > 922337203685477807 and a < 18446744073709551615;
format(a, 2)
922,337,203,685,477,808.00
18,446,744,073,709,551,613.00
drop table t1,t2;
create table t1(a bigint unsigned not null, key(a));
insert into t1 values (922337203685477807),(922337203685477808),(18446744073709551613),(18446744073709551615);
select * from t1;
a
922337203685477807
922337203685477808
18446744073709551613
18446744073709551615
update t1 set a = 0 where a = 18446744073709551615;
select * from t1 where a = 0;
a
0
delete from t1 where a = 0;
select * from t1 where a = 0;
a
insert into t1 values (18446744073709551615);
select * from t1 where a = 18446744073709551615;
a
18446744073709551615
select * from t1 where a between 922337203685477808 and 18446744073709551615 order by a;
a
922337203685477808
18446744073709551613
18446744073709551615
select * from t1 group by a having a > 922337203685477808;
a
18446744073709551613
18446744073709551615
select * from t1 where a in (select a from t1 group by a having a <= 18446744073709551613);
a
922337203685477807
922337203685477808
18446744073709551613
create table t2(a bigint unsigned not null, key(a));
insert into t2 values (0),(922337203685477808),(18446744073709551615);
select t1.a,t2.a from t1 inner join t2 on t1.a = t2.a;
a	a
922337203685477808	922337203685477808
18446744073709551615	18446744073709551615
select * from t1 where a > floor(922337203685477808);
a
18446744073709551613
18446744073709551615
drop table t1,t2;
