create table t1(a enum('1','2','3','a','b','c','d'));
insert into t1 values ('1'),('3'),('a');
select * from t1;
a
1
3
a
update t1 set a = '2' where a = '3';
select * from t1 where a = 1;
a
1
delete from t1 where a = '2';
create index a on t1(a);
insert into t1 values ('c'),('d');
select * from t1 where a = 'c';
a
c
select * from t1 where a < 'a';
a
1
select * from t1 where a > '1' order by a;
a
a
c
d
select * from t1 where a is not null;
a
1
a
c
d
select * from t1 where a > 0 limit 3 offset 1;
a
a
c
d
drop table t1;
